[
  {
    "from": "T1098",
    "to": "CAPEC-117",
    "from_name": "Account Manipulation",
    "to_name": "Interception",
    "from_layer": "technique",
    "to_layer": "capec",
    "justification": "Both entities appear in the same sentence: 'ATT&CK Tactic Category Techniques Defense Evasion    T1027: Obfuscated Files or Information Discovery    T1012: Query Registry    T1016: System Network Configuration Discovery    T1049: System Network Connections Discovery    T1057: Process Discovery    T1518: Software Discovery 7/9 Credential Access    T1003.004: LSA Secrets    T1003.006: DCSync    T1111: Two-Factor Authentication Interception Collection    T1114: Email Collection    T1114.002: Remote Email Collection Lateral Movement    T1021.004: SSH Persistence    T1037.004: RC Scripts    T1098.001: Additional Cloud Credentials    T1505.003: Web Shell Command and Control    T1071: Application Layer Protocol    T1090.003: Multi-hop Proxy    T1095: Non-Application Layer Protocol    T1572: Protocol Tunneling    T1573.002: Asymmetric Cryptography Resource Development    T1583.003: Virtual Private Server    T1584: Compromise Infrastructure    T1608.003: Install Digital Certificate Execution    T1059.001: PowerShell    T1059.003: Windows Command Shell YARA Signatures Note: These rules are designed to broadly capture suspicious files and are not designed to detect a particular malware or threat. 8/9 rule QUIETEXIT_strings {     meta:         author = \"Mandiant\"         date_created = \"2022-01-13\"         date_modified = \"2022-01-13\"         rev = 1     strings:         $s1 = \"auth-agent@openssh.com\"         $s2 = \"auth-%.8x-%d\"         $s3 = \"Child connection from %s:%s\"         $s4 = \"Compiled without normal mode, can't run without -i\"         $s5 = \"cancel-tcpip-forward\"         $s6 = \"dropbear_prng\"         $s7 = \"cron\"     condition:         uint32be(0) == 0x7F454C46 and filesize < 2MB and all of them } rule REGEORG_Tuneller_generic {     meta:         author = \"Mandiant\"         date_created = \"2021-12-20\"         date_modified = \"2021-12-20\"         md5 = \"ba22992ce835dadcd06bff4ab7b162f9\"     strings:         $s1 = \"System.Net.IPEndPoint\"         $s2 = \"Response.AddHeader\"         $s3 = \"Request.InputStream.Read\"         $s4 = \"Request.Headers.Get\"         $s5 = \"Response.Write\"         $s6 = \"System.Buffer.BlockCopy\"         $s7 = \"Response.BinaryWrite\"         $s8 = \"SocketException soex\"     condition:         filesize < 1MB and 7 of them } 9/9 rule UNC3524_sha1 {     meta:         author = \"Mandiant\"         date_created = \"2022-01-19\"         date_modified = \"2022-01-19\"    strings:         $h1 = { DD E5 D5 97 20 53 27 BF F0 A2 BA CD 96 35 9A AD 1C 75 EB 47 }     condition:         uint32be(0) == 0x7F454C46 and filesize < 10MB and all of them } Indicators MALWARE FAMILY Indicator QUIETEXIT Dynamic DNS cloudns.asia dynu.net mywire.org webredirect.org MALWARE FAMILY MD5 SHA1 SHA256 REGEORG GitHub version ba22992ce835dadcd06bff4ab7b162f9 3d4dcc859c6ca7e5b36483ad84c9ceef34973f9a 7b5e3c1c06d82b3e7309C258dfbd4bfcd' which indicates a potential connection between a technique and a capec.",
    "context": "ATT&CK Tactic Category Techniques Defense Evasion    T1027: Obfuscated Files or Information Discovery    T1012: Query Registry    T1016: System Network Configuration Discovery    T1049: System Network Connections Discovery    T1057: Process Discovery    T1518: Software Discovery 7/9 Credential Access    T1003.004: LSA Secrets    T1003.006: DCSync    T1111: Two-Factor Authentication Interception Collection    T1114: Email Collection    T1114.002: Remote Email Collection Lateral Movement    T1021.004: SSH Persistence    T1037.004: RC Scripts    T1098.001: Additional Cloud Credentials    T1505.003: Web Shell Command and Control    T1071: Application Layer Protocol    T1090.003: Multi-hop Proxy    T1095: Non-Application Layer Protocol    T1572: Protocol Tunneling    T1573.002: Asymmetric Cryptography Resource Development    T1583.003: Virtual Private Server    T1584: Compromise Infrastructure    T1608.003: Install Digital Certificate Execution    T1059.001: PowerShell    T1059.003: Windows Command Shell YARA Signatures Note: These rules are designed to broadly capture suspicious files and are not designed to detect a particular malware or threat. 8/9 rule QUIETEXIT_strings {     meta:         author = \"Mandiant\"         date_created = \"2022-01-13\"         date_modified = \"2022-01-13\"         rev = 1     strings:         $s1 = \"auth-agent@openssh.com\"         $s2 = \"auth-%.8x-%d\"         $s3 = \"Child connection from %s:%s\"         $s4 = \"Compiled without normal mode, can't run without -i\"         $s5 = \"cancel-tcpip-forward\"         $s6 = \"dropbear_prng\"         $s7 = \"cron\"     condition:         uint32be(0) == 0x7F454C46 and filesize < 2MB and all of them } rule REGEORG_Tuneller_generic {     meta:         author = \"Mandiant\"         date_created = \"2021-12-20\"         date_modified = \"2021-12-20\"         md5 = \"ba22992ce835dadcd06bff4ab7b162f9\"     strings:         $s1 = \"System.Net.IPEndPoint\"         $s2 = \"Response.AddHeader\"         $s3 = \"Request.InputStream.Read\"         $s4 = \"Request.Headers.Get\"         $s5 = \"Response.Write\"         $s6 = \"System.Buffer.BlockCopy\"         $s7 = \"Response.BinaryWrite\"         $s8 = \"SocketException soex\"     condition:         filesize < 1MB and 7 of them } 9/9 rule UNC3524_sha1 {     meta:         author = \"Mandiant\"         date_created = \"2022-01-19\"         date_modified = \"2022-01-19\"    strings:         $h1 = { DD E5 D5 97 20 53 27 BF F0 A2 BA CD 96 35 9A AD 1C 75 EB 47 }     condition:         uint32be(0) == 0x7F454C46 and filesize < 10MB and all of them } Indicators MALWARE FAMILY Indicator QUIETEXIT Dynamic DNS cloudns.asia dynu.net mywire.org webredirect.org MALWARE FAMILY MD5 SHA1 SHA256 REGEORG GitHub version ba22992ce835dadcd06bff4ab7b162f9 3d4dcc859c6ca7e5b36483ad84c9ceef34973f9a 7b5e3c1c06d82b3e7309C258dfbd4bfcd"
  },
  {
    "from": "T1583",
    "to": "CAPEC-117",
    "from_name": "Acquire Infrastructure",
    "to_name": "Interception",
    "from_layer": "technique",
    "to_layer": "capec",
    "justification": "Both entities appear in the same sentence: 'ATT&CK Tactic Category Techniques Defense Evasion    T1027: Obfuscated Files or Information Discovery    T1012: Query Registry    T1016: System Network Configuration Discovery    T1049: System Network Connections Discovery    T1057: Process Discovery    T1518: Software Discovery 7/9 Credential Access    T1003.004: LSA Secrets    T1003.006: DCSync    T1111: Two-Factor Authentication Interception Collection    T1114: Email Collection    T1114.002: Remote Email Collection Lateral Movement    T1021.004: SSH Persistence    T1037.004: RC Scripts    T1098.001: Additional Cloud Credentials    T1505.003: Web Shell Command and Control    T1071: Application Layer Protocol    T1090.003: Multi-hop Proxy    T1095: Non-Application Layer Protocol    T1572: Protocol Tunneling    T1573.002: Asymmetric Cryptography Resource Development    T1583.003: Virtual Private Server    T1584: Compromise Infrastructure    T1608.003: Install Digital Certificate Execution    T1059.001: PowerShell    T1059.003: Windows Command Shell YARA Signatures Note: These rules are designed to broadly capture suspicious files and are not designed to detect a particular malware or threat. 8/9 rule QUIETEXIT_strings {     meta:         author = \"Mandiant\"         date_created = \"2022-01-13\"         date_modified = \"2022-01-13\"         rev = 1     strings:         $s1 = \"auth-agent@openssh.com\"         $s2 = \"auth-%.8x-%d\"         $s3 = \"Child connection from %s:%s\"         $s4 = \"Compiled without normal mode, can't run without -i\"         $s5 = \"cancel-tcpip-forward\"         $s6 = \"dropbear_prng\"         $s7 = \"cron\"     condition:         uint32be(0) == 0x7F454C46 and filesize < 2MB and all of them } rule REGEORG_Tuneller_generic {     meta:         author = \"Mandiant\"         date_created = \"2021-12-20\"         date_modified = \"2021-12-20\"         md5 = \"ba22992ce835dadcd06bff4ab7b162f9\"     strings:         $s1 = \"System.Net.IPEndPoint\"         $s2 = \"Response.AddHeader\"         $s3 = \"Request.InputStream.Read\"         $s4 = \"Request.Headers.Get\"         $s5 = \"Response.Write\"         $s6 = \"System.Buffer.BlockCopy\"         $s7 = \"Response.BinaryWrite\"         $s8 = \"SocketException soex\"     condition:         filesize < 1MB and 7 of them } 9/9 rule UNC3524_sha1 {     meta:         author = \"Mandiant\"         date_created = \"2022-01-19\"         date_modified = \"2022-01-19\"    strings:         $h1 = { DD E5 D5 97 20 53 27 BF F0 A2 BA CD 96 35 9A AD 1C 75 EB 47 }     condition:         uint32be(0) == 0x7F454C46 and filesize < 10MB and all of them } Indicators MALWARE FAMILY Indicator QUIETEXIT Dynamic DNS cloudns.asia dynu.net mywire.org webredirect.org MALWARE FAMILY MD5 SHA1 SHA256 REGEORG GitHub version ba22992ce835dadcd06bff4ab7b162f9 3d4dcc859c6ca7e5b36483ad84c9ceef34973f9a 7b5e3c1c06d82b3e7309C258dfbd4bfcd' which indicates a potential connection between a technique and a capec.",
    "context": "ATT&CK Tactic Category Techniques Defense Evasion    T1027: Obfuscated Files or Information Discovery    T1012: Query Registry    T1016: System Network Configuration Discovery    T1049: System Network Connections Discovery    T1057: Process Discovery    T1518: Software Discovery 7/9 Credential Access    T1003.004: LSA Secrets    T1003.006: DCSync    T1111: Two-Factor Authentication Interception Collection    T1114: Email Collection    T1114.002: Remote Email Collection Lateral Movement    T1021.004: SSH Persistence    T1037.004: RC Scripts    T1098.001: Additional Cloud Credentials    T1505.003: Web Shell Command and Control    T1071: Application Layer Protocol    T1090.003: Multi-hop Proxy    T1095: Non-Application Layer Protocol    T1572: Protocol Tunneling    T1573.002: Asymmetric Cryptography Resource Development    T1583.003: Virtual Private Server    T1584: Compromise Infrastructure    T1608.003: Install Digital Certificate Execution    T1059.001: PowerShell    T1059.003: Windows Command Shell YARA Signatures Note: These rules are designed to broadly capture suspicious files and are not designed to detect a particular malware or threat. 8/9 rule QUIETEXIT_strings {     meta:         author = \"Mandiant\"         date_created = \"2022-01-13\"         date_modified = \"2022-01-13\"         rev = 1     strings:         $s1 = \"auth-agent@openssh.com\"         $s2 = \"auth-%.8x-%d\"         $s3 = \"Child connection from %s:%s\"         $s4 = \"Compiled without normal mode, can't run without -i\"         $s5 = \"cancel-tcpip-forward\"         $s6 = \"dropbear_prng\"         $s7 = \"cron\"     condition:         uint32be(0) == 0x7F454C46 and filesize < 2MB and all of them } rule REGEORG_Tuneller_generic {     meta:         author = \"Mandiant\"         date_created = \"2021-12-20\"         date_modified = \"2021-12-20\"         md5 = \"ba22992ce835dadcd06bff4ab7b162f9\"     strings:         $s1 = \"System.Net.IPEndPoint\"         $s2 = \"Response.AddHeader\"         $s3 = \"Request.InputStream.Read\"         $s4 = \"Request.Headers.Get\"         $s5 = \"Response.Write\"         $s6 = \"System.Buffer.BlockCopy\"         $s7 = \"Response.BinaryWrite\"         $s8 = \"SocketException soex\"     condition:         filesize < 1MB and 7 of them } 9/9 rule UNC3524_sha1 {     meta:         author = \"Mandiant\"         date_created = \"2022-01-19\"         date_modified = \"2022-01-19\"    strings:         $h1 = { DD E5 D5 97 20 53 27 BF F0 A2 BA CD 96 35 9A AD 1C 75 EB 47 }     condition:         uint32be(0) == 0x7F454C46 and filesize < 10MB and all of them } Indicators MALWARE FAMILY Indicator QUIETEXIT Dynamic DNS cloudns.asia dynu.net mywire.org webredirect.org MALWARE FAMILY MD5 SHA1 SHA256 REGEORG GitHub version ba22992ce835dadcd06bff4ab7b162f9 3d4dcc859c6ca7e5b36483ad84c9ceef34973f9a 7b5e3c1c06d82b3e7309C258dfbd4bfcd"
  },
  {
    "from": "T1098.001",
    "to": "CAPEC-117",
    "from_name": "Additional Cloud Credentials",
    "to_name": "Interception",
    "from_layer": "technique",
    "to_layer": "capec",
    "justification": "Both entities appear in the same sentence: 'ATT&CK Tactic Category Techniques Defense Evasion    T1027: Obfuscated Files or Information Discovery    T1012: Query Registry    T1016: System Network Configuration Discovery    T1049: System Network Connections Discovery    T1057: Process Discovery    T1518: Software Discovery 7/9 Credential Access    T1003.004: LSA Secrets    T1003.006: DCSync    T1111: Two-Factor Authentication Interception Collection    T1114: Email Collection    T1114.002: Remote Email Collection Lateral Movement    T1021.004: SSH Persistence    T1037.004: RC Scripts    T1098.001: Additional Cloud Credentials    T1505.003: Web Shell Command and Control    T1071: Application Layer Protocol    T1090.003: Multi-hop Proxy    T1095: Non-Application Layer Protocol    T1572: Protocol Tunneling    T1573.002: Asymmetric Cryptography Resource Development    T1583.003: Virtual Private Server    T1584: Compromise Infrastructure    T1608.003: Install Digital Certificate Execution    T1059.001: PowerShell    T1059.003: Windows Command Shell YARA Signatures Note: These rules are designed to broadly capture suspicious files and are not designed to detect a particular malware or threat. 8/9 rule QUIETEXIT_strings {     meta:         author = \"Mandiant\"         date_created = \"2022-01-13\"         date_modified = \"2022-01-13\"         rev = 1     strings:         $s1 = \"auth-agent@openssh.com\"         $s2 = \"auth-%.8x-%d\"         $s3 = \"Child connection from %s:%s\"         $s4 = \"Compiled without normal mode, can't run without -i\"         $s5 = \"cancel-tcpip-forward\"         $s6 = \"dropbear_prng\"         $s7 = \"cron\"     condition:         uint32be(0) == 0x7F454C46 and filesize < 2MB and all of them } rule REGEORG_Tuneller_generic {     meta:         author = \"Mandiant\"         date_created = \"2021-12-20\"         date_modified = \"2021-12-20\"         md5 = \"ba22992ce835dadcd06bff4ab7b162f9\"     strings:         $s1 = \"System.Net.IPEndPoint\"         $s2 = \"Response.AddHeader\"         $s3 = \"Request.InputStream.Read\"         $s4 = \"Request.Headers.Get\"         $s5 = \"Response.Write\"         $s6 = \"System.Buffer.BlockCopy\"         $s7 = \"Response.BinaryWrite\"         $s8 = \"SocketException soex\"     condition:         filesize < 1MB and 7 of them } 9/9 rule UNC3524_sha1 {     meta:         author = \"Mandiant\"         date_created = \"2022-01-19\"         date_modified = \"2022-01-19\"    strings:         $h1 = { DD E5 D5 97 20 53 27 BF F0 A2 BA CD 96 35 9A AD 1C 75 EB 47 }     condition:         uint32be(0) == 0x7F454C46 and filesize < 10MB and all of them } Indicators MALWARE FAMILY Indicator QUIETEXIT Dynamic DNS cloudns.asia dynu.net mywire.org webredirect.org MALWARE FAMILY MD5 SHA1 SHA256 REGEORG GitHub version ba22992ce835dadcd06bff4ab7b162f9 3d4dcc859c6ca7e5b36483ad84c9ceef34973f9a 7b5e3c1c06d82b3e7309C258dfbd4bfcd' which indicates a potential connection between a technique and a capec.",
    "context": "ATT&CK Tactic Category Techniques Defense Evasion    T1027: Obfuscated Files or Information Discovery    T1012: Query Registry    T1016: System Network Configuration Discovery    T1049: System Network Connections Discovery    T1057: Process Discovery    T1518: Software Discovery 7/9 Credential Access    T1003.004: LSA Secrets    T1003.006: DCSync    T1111: Two-Factor Authentication Interception Collection    T1114: Email Collection    T1114.002: Remote Email Collection Lateral Movement    T1021.004: SSH Persistence    T1037.004: RC Scripts    T1098.001: Additional Cloud Credentials    T1505.003: Web Shell Command and Control    T1071: Application Layer Protocol    T1090.003: Multi-hop Proxy    T1095: Non-Application Layer Protocol    T1572: Protocol Tunneling    T1573.002: Asymmetric Cryptography Resource Development    T1583.003: Virtual Private Server    T1584: Compromise Infrastructure    T1608.003: Install Digital Certificate Execution    T1059.001: PowerShell    T1059.003: Windows Command Shell YARA Signatures Note: These rules are designed to broadly capture suspicious files and are not designed to detect a particular malware or threat. 8/9 rule QUIETEXIT_strings {     meta:         author = \"Mandiant\"         date_created = \"2022-01-13\"         date_modified = \"2022-01-13\"         rev = 1     strings:         $s1 = \"auth-agent@openssh.com\"         $s2 = \"auth-%.8x-%d\"         $s3 = \"Child connection from %s:%s\"         $s4 = \"Compiled without normal mode, can't run without -i\"         $s5 = \"cancel-tcpip-forward\"         $s6 = \"dropbear_prng\"         $s7 = \"cron\"     condition:         uint32be(0) == 0x7F454C46 and filesize < 2MB and all of them } rule REGEORG_Tuneller_generic {     meta:         author = \"Mandiant\"         date_created = \"2021-12-20\"         date_modified = \"2021-12-20\"         md5 = \"ba22992ce835dadcd06bff4ab7b162f9\"     strings:         $s1 = \"System.Net.IPEndPoint\"         $s2 = \"Response.AddHeader\"         $s3 = \"Request.InputStream.Read\"         $s4 = \"Request.Headers.Get\"         $s5 = \"Response.Write\"         $s6 = \"System.Buffer.BlockCopy\"         $s7 = \"Response.BinaryWrite\"         $s8 = \"SocketException soex\"     condition:         filesize < 1MB and 7 of them } 9/9 rule UNC3524_sha1 {     meta:         author = \"Mandiant\"         date_created = \"2022-01-19\"         date_modified = \"2022-01-19\"    strings:         $h1 = { DD E5 D5 97 20 53 27 BF F0 A2 BA CD 96 35 9A AD 1C 75 EB 47 }     condition:         uint32be(0) == 0x7F454C46 and filesize < 10MB and all of them } Indicators MALWARE FAMILY Indicator QUIETEXIT Dynamic DNS cloudns.asia dynu.net mywire.org webredirect.org MALWARE FAMILY MD5 SHA1 SHA256 REGEORG GitHub version ba22992ce835dadcd06bff4ab7b162f9 3d4dcc859c6ca7e5b36483ad84c9ceef34973f9a 7b5e3c1c06d82b3e7309C258dfbd4bfcd"
  },
  {
    "from": "T1071",
    "to": "CAPEC-117",
    "from_name": "Application Layer Protocol",
    "to_name": "Interception",
    "from_layer": "technique",
    "to_layer": "capec",
    "justification": "Both entities appear in the same sentence: 'ATT&CK Tactic Category Techniques Defense Evasion    T1027: Obfuscated Files or Information Discovery    T1012: Query Registry    T1016: System Network Configuration Discovery    T1049: System Network Connections Discovery    T1057: Process Discovery    T1518: Software Discovery 7/9 Credential Access    T1003.004: LSA Secrets    T1003.006: DCSync    T1111: Two-Factor Authentication Interception Collection    T1114: Email Collection    T1114.002: Remote Email Collection Lateral Movement    T1021.004: SSH Persistence    T1037.004: RC Scripts    T1098.001: Additional Cloud Credentials    T1505.003: Web Shell Command and Control    T1071: Application Layer Protocol    T1090.003: Multi-hop Proxy    T1095: Non-Application Layer Protocol    T1572: Protocol Tunneling    T1573.002: Asymmetric Cryptography Resource Development    T1583.003: Virtual Private Server    T1584: Compromise Infrastructure    T1608.003: Install Digital Certificate Execution    T1059.001: PowerShell    T1059.003: Windows Command Shell YARA Signatures Note: These rules are designed to broadly capture suspicious files and are not designed to detect a particular malware or threat. 8/9 rule QUIETEXIT_strings {     meta:         author = \"Mandiant\"         date_created = \"2022-01-13\"         date_modified = \"2022-01-13\"         rev = 1     strings:         $s1 = \"auth-agent@openssh.com\"         $s2 = \"auth-%.8x-%d\"         $s3 = \"Child connection from %s:%s\"         $s4 = \"Compiled without normal mode, can't run without -i\"         $s5 = \"cancel-tcpip-forward\"         $s6 = \"dropbear_prng\"         $s7 = \"cron\"     condition:         uint32be(0) == 0x7F454C46 and filesize < 2MB and all of them } rule REGEORG_Tuneller_generic {     meta:         author = \"Mandiant\"         date_created = \"2021-12-20\"         date_modified = \"2021-12-20\"         md5 = \"ba22992ce835dadcd06bff4ab7b162f9\"     strings:         $s1 = \"System.Net.IPEndPoint\"         $s2 = \"Response.AddHeader\"         $s3 = \"Request.InputStream.Read\"         $s4 = \"Request.Headers.Get\"         $s5 = \"Response.Write\"         $s6 = \"System.Buffer.BlockCopy\"         $s7 = \"Response.BinaryWrite\"         $s8 = \"SocketException soex\"     condition:         filesize < 1MB and 7 of them } 9/9 rule UNC3524_sha1 {     meta:         author = \"Mandiant\"         date_created = \"2022-01-19\"         date_modified = \"2022-01-19\"    strings:         $h1 = { DD E5 D5 97 20 53 27 BF F0 A2 BA CD 96 35 9A AD 1C 75 EB 47 }     condition:         uint32be(0) == 0x7F454C46 and filesize < 10MB and all of them } Indicators MALWARE FAMILY Indicator QUIETEXIT Dynamic DNS cloudns.asia dynu.net mywire.org webredirect.org MALWARE FAMILY MD5 SHA1 SHA256 REGEORG GitHub version ba22992ce835dadcd06bff4ab7b162f9 3d4dcc859c6ca7e5b36483ad84c9ceef34973f9a 7b5e3c1c06d82b3e7309C258dfbd4bfcd' which indicates a potential connection between a technique and a capec.",
    "context": "ATT&CK Tactic Category Techniques Defense Evasion    T1027: Obfuscated Files or Information Discovery    T1012: Query Registry    T1016: System Network Configuration Discovery    T1049: System Network Connections Discovery    T1057: Process Discovery    T1518: Software Discovery 7/9 Credential Access    T1003.004: LSA Secrets    T1003.006: DCSync    T1111: Two-Factor Authentication Interception Collection    T1114: Email Collection    T1114.002: Remote Email Collection Lateral Movement    T1021.004: SSH Persistence    T1037.004: RC Scripts    T1098.001: Additional Cloud Credentials    T1505.003: Web Shell Command and Control    T1071: Application Layer Protocol    T1090.003: Multi-hop Proxy    T1095: Non-Application Layer Protocol    T1572: Protocol Tunneling    T1573.002: Asymmetric Cryptography Resource Development    T1583.003: Virtual Private Server    T1584: Compromise Infrastructure    T1608.003: Install Digital Certificate Execution    T1059.001: PowerShell    T1059.003: Windows Command Shell YARA Signatures Note: These rules are designed to broadly capture suspicious files and are not designed to detect a particular malware or threat. 8/9 rule QUIETEXIT_strings {     meta:         author = \"Mandiant\"         date_created = \"2022-01-13\"         date_modified = \"2022-01-13\"         rev = 1     strings:         $s1 = \"auth-agent@openssh.com\"         $s2 = \"auth-%.8x-%d\"         $s3 = \"Child connection from %s:%s\"         $s4 = \"Compiled without normal mode, can't run without -i\"         $s5 = \"cancel-tcpip-forward\"         $s6 = \"dropbear_prng\"         $s7 = \"cron\"     condition:         uint32be(0) == 0x7F454C46 and filesize < 2MB and all of them } rule REGEORG_Tuneller_generic {     meta:         author = \"Mandiant\"         date_created = \"2021-12-20\"         date_modified = \"2021-12-20\"         md5 = \"ba22992ce835dadcd06bff4ab7b162f9\"     strings:         $s1 = \"System.Net.IPEndPoint\"         $s2 = \"Response.AddHeader\"         $s3 = \"Request.InputStream.Read\"         $s4 = \"Request.Headers.Get\"         $s5 = \"Response.Write\"         $s6 = \"System.Buffer.BlockCopy\"         $s7 = \"Response.BinaryWrite\"         $s8 = \"SocketException soex\"     condition:         filesize < 1MB and 7 of them } 9/9 rule UNC3524_sha1 {     meta:         author = \"Mandiant\"         date_created = \"2022-01-19\"         date_modified = \"2022-01-19\"    strings:         $h1 = { DD E5 D5 97 20 53 27 BF F0 A2 BA CD 96 35 9A AD 1C 75 EB 47 }     condition:         uint32be(0) == 0x7F454C46 and filesize < 10MB and all of them } Indicators MALWARE FAMILY Indicator QUIETEXIT Dynamic DNS cloudns.asia dynu.net mywire.org webredirect.org MALWARE FAMILY MD5 SHA1 SHA256 REGEORG GitHub version ba22992ce835dadcd06bff4ab7b162f9 3d4dcc859c6ca7e5b36483ad84c9ceef34973f9a 7b5e3c1c06d82b3e7309C258dfbd4bfcd"
  },
  {
    "from": "T1573.002",
    "to": "CAPEC-117",
    "from_name": "Asymmetric Cryptography",
    "to_name": "Interception",
    "from_layer": "technique",
    "to_layer": "capec",
    "justification": "Both entities appear in the same sentence: 'ATT&CK Tactic Category Techniques Defense Evasion    T1027: Obfuscated Files or Information Discovery    T1012: Query Registry    T1016: System Network Configuration Discovery    T1049: System Network Connections Discovery    T1057: Process Discovery    T1518: Software Discovery 7/9 Credential Access    T1003.004: LSA Secrets    T1003.006: DCSync    T1111: Two-Factor Authentication Interception Collection    T1114: Email Collection    T1114.002: Remote Email Collection Lateral Movement    T1021.004: SSH Persistence    T1037.004: RC Scripts    T1098.001: Additional Cloud Credentials    T1505.003: Web Shell Command and Control    T1071: Application Layer Protocol    T1090.003: Multi-hop Proxy    T1095: Non-Application Layer Protocol    T1572: Protocol Tunneling    T1573.002: Asymmetric Cryptography Resource Development    T1583.003: Virtual Private Server    T1584: Compromise Infrastructure    T1608.003: Install Digital Certificate Execution    T1059.001: PowerShell    T1059.003: Windows Command Shell YARA Signatures Note: These rules are designed to broadly capture suspicious files and are not designed to detect a particular malware or threat. 8/9 rule QUIETEXIT_strings {     meta:         author = \"Mandiant\"         date_created = \"2022-01-13\"         date_modified = \"2022-01-13\"         rev = 1     strings:         $s1 = \"auth-agent@openssh.com\"         $s2 = \"auth-%.8x-%d\"         $s3 = \"Child connection from %s:%s\"         $s4 = \"Compiled without normal mode, can't run without -i\"         $s5 = \"cancel-tcpip-forward\"         $s6 = \"dropbear_prng\"         $s7 = \"cron\"     condition:         uint32be(0) == 0x7F454C46 and filesize < 2MB and all of them } rule REGEORG_Tuneller_generic {     meta:         author = \"Mandiant\"         date_created = \"2021-12-20\"         date_modified = \"2021-12-20\"         md5 = \"ba22992ce835dadcd06bff4ab7b162f9\"     strings:         $s1 = \"System.Net.IPEndPoint\"         $s2 = \"Response.AddHeader\"         $s3 = \"Request.InputStream.Read\"         $s4 = \"Request.Headers.Get\"         $s5 = \"Response.Write\"         $s6 = \"System.Buffer.BlockCopy\"         $s7 = \"Response.BinaryWrite\"         $s8 = \"SocketException soex\"     condition:         filesize < 1MB and 7 of them } 9/9 rule UNC3524_sha1 {     meta:         author = \"Mandiant\"         date_created = \"2022-01-19\"         date_modified = \"2022-01-19\"    strings:         $h1 = { DD E5 D5 97 20 53 27 BF F0 A2 BA CD 96 35 9A AD 1C 75 EB 47 }     condition:         uint32be(0) == 0x7F454C46 and filesize < 10MB and all of them } Indicators MALWARE FAMILY Indicator QUIETEXIT Dynamic DNS cloudns.asia dynu.net mywire.org webredirect.org MALWARE FAMILY MD5 SHA1 SHA256 REGEORG GitHub version ba22992ce835dadcd06bff4ab7b162f9 3d4dcc859c6ca7e5b36483ad84c9ceef34973f9a 7b5e3c1c06d82b3e7309C258dfbd4bfcd' which indicates a potential connection between a technique and a capec.",
    "context": "ATT&CK Tactic Category Techniques Defense Evasion    T1027: Obfuscated Files or Information Discovery    T1012: Query Registry    T1016: System Network Configuration Discovery    T1049: System Network Connections Discovery    T1057: Process Discovery    T1518: Software Discovery 7/9 Credential Access    T1003.004: LSA Secrets    T1003.006: DCSync    T1111: Two-Factor Authentication Interception Collection    T1114: Email Collection    T1114.002: Remote Email Collection Lateral Movement    T1021.004: SSH Persistence    T1037.004: RC Scripts    T1098.001: Additional Cloud Credentials    T1505.003: Web Shell Command and Control    T1071: Application Layer Protocol    T1090.003: Multi-hop Proxy    T1095: Non-Application Layer Protocol    T1572: Protocol Tunneling    T1573.002: Asymmetric Cryptography Resource Development    T1583.003: Virtual Private Server    T1584: Compromise Infrastructure    T1608.003: Install Digital Certificate Execution    T1059.001: PowerShell    T1059.003: Windows Command Shell YARA Signatures Note: These rules are designed to broadly capture suspicious files and are not designed to detect a particular malware or threat. 8/9 rule QUIETEXIT_strings {     meta:         author = \"Mandiant\"         date_created = \"2022-01-13\"         date_modified = \"2022-01-13\"         rev = 1     strings:         $s1 = \"auth-agent@openssh.com\"         $s2 = \"auth-%.8x-%d\"         $s3 = \"Child connection from %s:%s\"         $s4 = \"Compiled without normal mode, can't run without -i\"         $s5 = \"cancel-tcpip-forward\"         $s6 = \"dropbear_prng\"         $s7 = \"cron\"     condition:         uint32be(0) == 0x7F454C46 and filesize < 2MB and all of them } rule REGEORG_Tuneller_generic {     meta:         author = \"Mandiant\"         date_created = \"2021-12-20\"         date_modified = \"2021-12-20\"         md5 = \"ba22992ce835dadcd06bff4ab7b162f9\"     strings:         $s1 = \"System.Net.IPEndPoint\"         $s2 = \"Response.AddHeader\"         $s3 = \"Request.InputStream.Read\"         $s4 = \"Request.Headers.Get\"         $s5 = \"Response.Write\"         $s6 = \"System.Buffer.BlockCopy\"         $s7 = \"Response.BinaryWrite\"         $s8 = \"SocketException soex\"     condition:         filesize < 1MB and 7 of them } 9/9 rule UNC3524_sha1 {     meta:         author = \"Mandiant\"         date_created = \"2022-01-19\"         date_modified = \"2022-01-19\"    strings:         $h1 = { DD E5 D5 97 20 53 27 BF F0 A2 BA CD 96 35 9A AD 1C 75 EB 47 }     condition:         uint32be(0) == 0x7F454C46 and filesize < 10MB and all of them } Indicators MALWARE FAMILY Indicator QUIETEXIT Dynamic DNS cloudns.asia dynu.net mywire.org webredirect.org MALWARE FAMILY MD5 SHA1 SHA256 REGEORG GitHub version ba22992ce835dadcd06bff4ab7b162f9 3d4dcc859c6ca7e5b36483ad84c9ceef34973f9a 7b5e3c1c06d82b3e7309C258dfbd4bfcd"
  },
  {
    "from": "T1037",
    "to": "CAPEC-117",
    "from_name": "Boot or Logon Initialization Scripts",
    "to_name": "Interception",
    "from_layer": "technique",
    "to_layer": "capec",
    "justification": "Both entities appear in the same sentence: 'ATT&CK Tactic Category Techniques Defense Evasion    T1027: Obfuscated Files or Information Discovery    T1012: Query Registry    T1016: System Network Configuration Discovery    T1049: System Network Connections Discovery    T1057: Process Discovery    T1518: Software Discovery 7/9 Credential Access    T1003.004: LSA Secrets    T1003.006: DCSync    T1111: Two-Factor Authentication Interception Collection    T1114: Email Collection    T1114.002: Remote Email Collection Lateral Movement    T1021.004: SSH Persistence    T1037.004: RC Scripts    T1098.001: Additional Cloud Credentials    T1505.003: Web Shell Command and Control    T1071: Application Layer Protocol    T1090.003: Multi-hop Proxy    T1095: Non-Application Layer Protocol    T1572: Protocol Tunneling    T1573.002: Asymmetric Cryptography Resource Development    T1583.003: Virtual Private Server    T1584: Compromise Infrastructure    T1608.003: Install Digital Certificate Execution    T1059.001: PowerShell    T1059.003: Windows Command Shell YARA Signatures Note: These rules are designed to broadly capture suspicious files and are not designed to detect a particular malware or threat. 8/9 rule QUIETEXIT_strings {     meta:         author = \"Mandiant\"         date_created = \"2022-01-13\"         date_modified = \"2022-01-13\"         rev = 1     strings:         $s1 = \"auth-agent@openssh.com\"         $s2 = \"auth-%.8x-%d\"         $s3 = \"Child connection from %s:%s\"         $s4 = \"Compiled without normal mode, can't run without -i\"         $s5 = \"cancel-tcpip-forward\"         $s6 = \"dropbear_prng\"         $s7 = \"cron\"     condition:         uint32be(0) == 0x7F454C46 and filesize < 2MB and all of them } rule REGEORG_Tuneller_generic {     meta:         author = \"Mandiant\"         date_created = \"2021-12-20\"         date_modified = \"2021-12-20\"         md5 = \"ba22992ce835dadcd06bff4ab7b162f9\"     strings:         $s1 = \"System.Net.IPEndPoint\"         $s2 = \"Response.AddHeader\"         $s3 = \"Request.InputStream.Read\"         $s4 = \"Request.Headers.Get\"         $s5 = \"Response.Write\"         $s6 = \"System.Buffer.BlockCopy\"         $s7 = \"Response.BinaryWrite\"         $s8 = \"SocketException soex\"     condition:         filesize < 1MB and 7 of them } 9/9 rule UNC3524_sha1 {     meta:         author = \"Mandiant\"         date_created = \"2022-01-19\"         date_modified = \"2022-01-19\"    strings:         $h1 = { DD E5 D5 97 20 53 27 BF F0 A2 BA CD 96 35 9A AD 1C 75 EB 47 }     condition:         uint32be(0) == 0x7F454C46 and filesize < 10MB and all of them } Indicators MALWARE FAMILY Indicator QUIETEXIT Dynamic DNS cloudns.asia dynu.net mywire.org webredirect.org MALWARE FAMILY MD5 SHA1 SHA256 REGEORG GitHub version ba22992ce835dadcd06bff4ab7b162f9 3d4dcc859c6ca7e5b36483ad84c9ceef34973f9a 7b5e3c1c06d82b3e7309C258dfbd4bfcd' which indicates a potential connection between a technique and a capec.",
    "context": "ATT&CK Tactic Category Techniques Defense Evasion    T1027: Obfuscated Files or Information Discovery    T1012: Query Registry    T1016: System Network Configuration Discovery    T1049: System Network Connections Discovery    T1057: Process Discovery    T1518: Software Discovery 7/9 Credential Access    T1003.004: LSA Secrets    T1003.006: DCSync    T1111: Two-Factor Authentication Interception Collection    T1114: Email Collection    T1114.002: Remote Email Collection Lateral Movement    T1021.004: SSH Persistence    T1037.004: RC Scripts    T1098.001: Additional Cloud Credentials    T1505.003: Web Shell Command and Control    T1071: Application Layer Protocol    T1090.003: Multi-hop Proxy    T1095: Non-Application Layer Protocol    T1572: Protocol Tunneling    T1573.002: Asymmetric Cryptography Resource Development    T1583.003: Virtual Private Server    T1584: Compromise Infrastructure    T1608.003: Install Digital Certificate Execution    T1059.001: PowerShell    T1059.003: Windows Command Shell YARA Signatures Note: These rules are designed to broadly capture suspicious files and are not designed to detect a particular malware or threat. 8/9 rule QUIETEXIT_strings {     meta:         author = \"Mandiant\"         date_created = \"2022-01-13\"         date_modified = \"2022-01-13\"         rev = 1     strings:         $s1 = \"auth-agent@openssh.com\"         $s2 = \"auth-%.8x-%d\"         $s3 = \"Child connection from %s:%s\"         $s4 = \"Compiled without normal mode, can't run without -i\"         $s5 = \"cancel-tcpip-forward\"         $s6 = \"dropbear_prng\"         $s7 = \"cron\"     condition:         uint32be(0) == 0x7F454C46 and filesize < 2MB and all of them } rule REGEORG_Tuneller_generic {     meta:         author = \"Mandiant\"         date_created = \"2021-12-20\"         date_modified = \"2021-12-20\"         md5 = \"ba22992ce835dadcd06bff4ab7b162f9\"     strings:         $s1 = \"System.Net.IPEndPoint\"         $s2 = \"Response.AddHeader\"         $s3 = \"Request.InputStream.Read\"         $s4 = \"Request.Headers.Get\"         $s5 = \"Response.Write\"         $s6 = \"System.Buffer.BlockCopy\"         $s7 = \"Response.BinaryWrite\"         $s8 = \"SocketException soex\"     condition:         filesize < 1MB and 7 of them } 9/9 rule UNC3524_sha1 {     meta:         author = \"Mandiant\"         date_created = \"2022-01-19\"         date_modified = \"2022-01-19\"    strings:         $h1 = { DD E5 D5 97 20 53 27 BF F0 A2 BA CD 96 35 9A AD 1C 75 EB 47 }     condition:         uint32be(0) == 0x7F454C46 and filesize < 10MB and all of them } Indicators MALWARE FAMILY Indicator QUIETEXIT Dynamic DNS cloudns.asia dynu.net mywire.org webredirect.org MALWARE FAMILY MD5 SHA1 SHA256 REGEORG GitHub version ba22992ce835dadcd06bff4ab7b162f9 3d4dcc859c6ca7e5b36483ad84c9ceef34973f9a 7b5e3c1c06d82b3e7309C258dfbd4bfcd"
  },
  {
    "from": "T1059",
    "to": "CAPEC-117",
    "from_name": "Command and Scripting Interpreter",
    "to_name": "Interception",
    "from_layer": "technique",
    "to_layer": "capec",
    "justification": "Both entities appear in the same sentence: 'ATT&CK Tactic Category Techniques Defense Evasion    T1027: Obfuscated Files or Information Discovery    T1012: Query Registry    T1016: System Network Configuration Discovery    T1049: System Network Connections Discovery    T1057: Process Discovery    T1518: Software Discovery 7/9 Credential Access    T1003.004: LSA Secrets    T1003.006: DCSync    T1111: Two-Factor Authentication Interception Collection    T1114: Email Collection    T1114.002: Remote Email Collection Lateral Movement    T1021.004: SSH Persistence    T1037.004: RC Scripts    T1098.001: Additional Cloud Credentials    T1505.003: Web Shell Command and Control    T1071: Application Layer Protocol    T1090.003: Multi-hop Proxy    T1095: Non-Application Layer Protocol    T1572: Protocol Tunneling    T1573.002: Asymmetric Cryptography Resource Development    T1583.003: Virtual Private Server    T1584: Compromise Infrastructure    T1608.003: Install Digital Certificate Execution    T1059.001: PowerShell    T1059.003: Windows Command Shell YARA Signatures Note: These rules are designed to broadly capture suspicious files and are not designed to detect a particular malware or threat. 8/9 rule QUIETEXIT_strings {     meta:         author = \"Mandiant\"         date_created = \"2022-01-13\"         date_modified = \"2022-01-13\"         rev = 1     strings:         $s1 = \"auth-agent@openssh.com\"         $s2 = \"auth-%.8x-%d\"         $s3 = \"Child connection from %s:%s\"         $s4 = \"Compiled without normal mode, can't run without -i\"         $s5 = \"cancel-tcpip-forward\"         $s6 = \"dropbear_prng\"         $s7 = \"cron\"     condition:         uint32be(0) == 0x7F454C46 and filesize < 2MB and all of them } rule REGEORG_Tuneller_generic {     meta:         author = \"Mandiant\"         date_created = \"2021-12-20\"         date_modified = \"2021-12-20\"         md5 = \"ba22992ce835dadcd06bff4ab7b162f9\"     strings:         $s1 = \"System.Net.IPEndPoint\"         $s2 = \"Response.AddHeader\"         $s3 = \"Request.InputStream.Read\"         $s4 = \"Request.Headers.Get\"         $s5 = \"Response.Write\"         $s6 = \"System.Buffer.BlockCopy\"         $s7 = \"Response.BinaryWrite\"         $s8 = \"SocketException soex\"     condition:         filesize < 1MB and 7 of them } 9/9 rule UNC3524_sha1 {     meta:         author = \"Mandiant\"         date_created = \"2022-01-19\"         date_modified = \"2022-01-19\"    strings:         $h1 = { DD E5 D5 97 20 53 27 BF F0 A2 BA CD 96 35 9A AD 1C 75 EB 47 }     condition:         uint32be(0) == 0x7F454C46 and filesize < 10MB and all of them } Indicators MALWARE FAMILY Indicator QUIETEXIT Dynamic DNS cloudns.asia dynu.net mywire.org webredirect.org MALWARE FAMILY MD5 SHA1 SHA256 REGEORG GitHub version ba22992ce835dadcd06bff4ab7b162f9 3d4dcc859c6ca7e5b36483ad84c9ceef34973f9a 7b5e3c1c06d82b3e7309C258dfbd4bfcd' which indicates a potential connection between a technique and a capec.",
    "context": "ATT&CK Tactic Category Techniques Defense Evasion    T1027: Obfuscated Files or Information Discovery    T1012: Query Registry    T1016: System Network Configuration Discovery    T1049: System Network Connections Discovery    T1057: Process Discovery    T1518: Software Discovery 7/9 Credential Access    T1003.004: LSA Secrets    T1003.006: DCSync    T1111: Two-Factor Authentication Interception Collection    T1114: Email Collection    T1114.002: Remote Email Collection Lateral Movement    T1021.004: SSH Persistence    T1037.004: RC Scripts    T1098.001: Additional Cloud Credentials    T1505.003: Web Shell Command and Control    T1071: Application Layer Protocol    T1090.003: Multi-hop Proxy    T1095: Non-Application Layer Protocol    T1572: Protocol Tunneling    T1573.002: Asymmetric Cryptography Resource Development    T1583.003: Virtual Private Server    T1584: Compromise Infrastructure    T1608.003: Install Digital Certificate Execution    T1059.001: PowerShell    T1059.003: Windows Command Shell YARA Signatures Note: These rules are designed to broadly capture suspicious files and are not designed to detect a particular malware or threat. 8/9 rule QUIETEXIT_strings {     meta:         author = \"Mandiant\"         date_created = \"2022-01-13\"         date_modified = \"2022-01-13\"         rev = 1     strings:         $s1 = \"auth-agent@openssh.com\"         $s2 = \"auth-%.8x-%d\"         $s3 = \"Child connection from %s:%s\"         $s4 = \"Compiled without normal mode, can't run without -i\"         $s5 = \"cancel-tcpip-forward\"         $s6 = \"dropbear_prng\"         $s7 = \"cron\"     condition:         uint32be(0) == 0x7F454C46 and filesize < 2MB and all of them } rule REGEORG_Tuneller_generic {     meta:         author = \"Mandiant\"         date_created = \"2021-12-20\"         date_modified = \"2021-12-20\"         md5 = \"ba22992ce835dadcd06bff4ab7b162f9\"     strings:         $s1 = \"System.Net.IPEndPoint\"         $s2 = \"Response.AddHeader\"         $s3 = \"Request.InputStream.Read\"         $s4 = \"Request.Headers.Get\"         $s5 = \"Response.Write\"         $s6 = \"System.Buffer.BlockCopy\"         $s7 = \"Response.BinaryWrite\"         $s8 = \"SocketException soex\"     condition:         filesize < 1MB and 7 of them } 9/9 rule UNC3524_sha1 {     meta:         author = \"Mandiant\"         date_created = \"2022-01-19\"         date_modified = \"2022-01-19\"    strings:         $h1 = { DD E5 D5 97 20 53 27 BF F0 A2 BA CD 96 35 9A AD 1C 75 EB 47 }     condition:         uint32be(0) == 0x7F454C46 and filesize < 10MB and all of them } Indicators MALWARE FAMILY Indicator QUIETEXIT Dynamic DNS cloudns.asia dynu.net mywire.org webredirect.org MALWARE FAMILY MD5 SHA1 SHA256 REGEORG GitHub version ba22992ce835dadcd06bff4ab7b162f9 3d4dcc859c6ca7e5b36483ad84c9ceef34973f9a 7b5e3c1c06d82b3e7309C258dfbd4bfcd"
  },
  {
    "from": "T1584",
    "to": "CAPEC-117",
    "from_name": "Compromise Infrastructure",
    "to_name": "Interception",
    "from_layer": "technique",
    "to_layer": "capec",
    "justification": "Both entities appear in the same sentence: 'ATT&CK Tactic Category Techniques Defense Evasion    T1027: Obfuscated Files or Information Discovery    T1012: Query Registry    T1016: System Network Configuration Discovery    T1049: System Network Connections Discovery    T1057: Process Discovery    T1518: Software Discovery 7/9 Credential Access    T1003.004: LSA Secrets    T1003.006: DCSync    T1111: Two-Factor Authentication Interception Collection    T1114: Email Collection    T1114.002: Remote Email Collection Lateral Movement    T1021.004: SSH Persistence    T1037.004: RC Scripts    T1098.001: Additional Cloud Credentials    T1505.003: Web Shell Command and Control    T1071: Application Layer Protocol    T1090.003: Multi-hop Proxy    T1095: Non-Application Layer Protocol    T1572: Protocol Tunneling    T1573.002: Asymmetric Cryptography Resource Development    T1583.003: Virtual Private Server    T1584: Compromise Infrastructure    T1608.003: Install Digital Certificate Execution    T1059.001: PowerShell    T1059.003: Windows Command Shell YARA Signatures Note: These rules are designed to broadly capture suspicious files and are not designed to detect a particular malware or threat. 8/9 rule QUIETEXIT_strings {     meta:         author = \"Mandiant\"         date_created = \"2022-01-13\"         date_modified = \"2022-01-13\"         rev = 1     strings:         $s1 = \"auth-agent@openssh.com\"         $s2 = \"auth-%.8x-%d\"         $s3 = \"Child connection from %s:%s\"         $s4 = \"Compiled without normal mode, can't run without -i\"         $s5 = \"cancel-tcpip-forward\"         $s6 = \"dropbear_prng\"         $s7 = \"cron\"     condition:         uint32be(0) == 0x7F454C46 and filesize < 2MB and all of them } rule REGEORG_Tuneller_generic {     meta:         author = \"Mandiant\"         date_created = \"2021-12-20\"         date_modified = \"2021-12-20\"         md5 = \"ba22992ce835dadcd06bff4ab7b162f9\"     strings:         $s1 = \"System.Net.IPEndPoint\"         $s2 = \"Response.AddHeader\"         $s3 = \"Request.InputStream.Read\"         $s4 = \"Request.Headers.Get\"         $s5 = \"Response.Write\"         $s6 = \"System.Buffer.BlockCopy\"         $s7 = \"Response.BinaryWrite\"         $s8 = \"SocketException soex\"     condition:         filesize < 1MB and 7 of them } 9/9 rule UNC3524_sha1 {     meta:         author = \"Mandiant\"         date_created = \"2022-01-19\"         date_modified = \"2022-01-19\"    strings:         $h1 = { DD E5 D5 97 20 53 27 BF F0 A2 BA CD 96 35 9A AD 1C 75 EB 47 }     condition:         uint32be(0) == 0x7F454C46 and filesize < 10MB and all of them } Indicators MALWARE FAMILY Indicator QUIETEXIT Dynamic DNS cloudns.asia dynu.net mywire.org webredirect.org MALWARE FAMILY MD5 SHA1 SHA256 REGEORG GitHub version ba22992ce835dadcd06bff4ab7b162f9 3d4dcc859c6ca7e5b36483ad84c9ceef34973f9a 7b5e3c1c06d82b3e7309C258dfbd4bfcd' which indicates a potential connection between a technique and a capec.",
    "context": "ATT&CK Tactic Category Techniques Defense Evasion    T1027: Obfuscated Files or Information Discovery    T1012: Query Registry    T1016: System Network Configuration Discovery    T1049: System Network Connections Discovery    T1057: Process Discovery    T1518: Software Discovery 7/9 Credential Access    T1003.004: LSA Secrets    T1003.006: DCSync    T1111: Two-Factor Authentication Interception Collection    T1114: Email Collection    T1114.002: Remote Email Collection Lateral Movement    T1021.004: SSH Persistence    T1037.004: RC Scripts    T1098.001: Additional Cloud Credentials    T1505.003: Web Shell Command and Control    T1071: Application Layer Protocol    T1090.003: Multi-hop Proxy    T1095: Non-Application Layer Protocol    T1572: Protocol Tunneling    T1573.002: Asymmetric Cryptography Resource Development    T1583.003: Virtual Private Server    T1584: Compromise Infrastructure    T1608.003: Install Digital Certificate Execution    T1059.001: PowerShell    T1059.003: Windows Command Shell YARA Signatures Note: These rules are designed to broadly capture suspicious files and are not designed to detect a particular malware or threat. 8/9 rule QUIETEXIT_strings {     meta:         author = \"Mandiant\"         date_created = \"2022-01-13\"         date_modified = \"2022-01-13\"         rev = 1     strings:         $s1 = \"auth-agent@openssh.com\"         $s2 = \"auth-%.8x-%d\"         $s3 = \"Child connection from %s:%s\"         $s4 = \"Compiled without normal mode, can't run without -i\"         $s5 = \"cancel-tcpip-forward\"         $s6 = \"dropbear_prng\"         $s7 = \"cron\"     condition:         uint32be(0) == 0x7F454C46 and filesize < 2MB and all of them } rule REGEORG_Tuneller_generic {     meta:         author = \"Mandiant\"         date_created = \"2021-12-20\"         date_modified = \"2021-12-20\"         md5 = \"ba22992ce835dadcd06bff4ab7b162f9\"     strings:         $s1 = \"System.Net.IPEndPoint\"         $s2 = \"Response.AddHeader\"         $s3 = \"Request.InputStream.Read\"         $s4 = \"Request.Headers.Get\"         $s5 = \"Response.Write\"         $s6 = \"System.Buffer.BlockCopy\"         $s7 = \"Response.BinaryWrite\"         $s8 = \"SocketException soex\"     condition:         filesize < 1MB and 7 of them } 9/9 rule UNC3524_sha1 {     meta:         author = \"Mandiant\"         date_created = \"2022-01-19\"         date_modified = \"2022-01-19\"    strings:         $h1 = { DD E5 D5 97 20 53 27 BF F0 A2 BA CD 96 35 9A AD 1C 75 EB 47 }     condition:         uint32be(0) == 0x7F454C46 and filesize < 10MB and all of them } Indicators MALWARE FAMILY Indicator QUIETEXIT Dynamic DNS cloudns.asia dynu.net mywire.org webredirect.org MALWARE FAMILY MD5 SHA1 SHA256 REGEORG GitHub version ba22992ce835dadcd06bff4ab7b162f9 3d4dcc859c6ca7e5b36483ad84c9ceef34973f9a 7b5e3c1c06d82b3e7309C258dfbd4bfcd"
  },
  {
    "from": "T1003.006",
    "to": "CAPEC-117",
    "from_name": "DCSync",
    "to_name": "Interception",
    "from_layer": "technique",
    "to_layer": "capec",
    "justification": "Both entities appear in the same sentence: 'ATT&CK Tactic Category Techniques Defense Evasion    T1027: Obfuscated Files or Information Discovery    T1012: Query Registry    T1016: System Network Configuration Discovery    T1049: System Network Connections Discovery    T1057: Process Discovery    T1518: Software Discovery 7/9 Credential Access    T1003.004: LSA Secrets    T1003.006: DCSync    T1111: Two-Factor Authentication Interception Collection    T1114: Email Collection    T1114.002: Remote Email Collection Lateral Movement    T1021.004: SSH Persistence    T1037.004: RC Scripts    T1098.001: Additional Cloud Credentials    T1505.003: Web Shell Command and Control    T1071: Application Layer Protocol    T1090.003: Multi-hop Proxy    T1095: Non-Application Layer Protocol    T1572: Protocol Tunneling    T1573.002: Asymmetric Cryptography Resource Development    T1583.003: Virtual Private Server    T1584: Compromise Infrastructure    T1608.003: Install Digital Certificate Execution    T1059.001: PowerShell    T1059.003: Windows Command Shell YARA Signatures Note: These rules are designed to broadly capture suspicious files and are not designed to detect a particular malware or threat. 8/9 rule QUIETEXIT_strings {     meta:         author = \"Mandiant\"         date_created = \"2022-01-13\"         date_modified = \"2022-01-13\"         rev = 1     strings:         $s1 = \"auth-agent@openssh.com\"         $s2 = \"auth-%.8x-%d\"         $s3 = \"Child connection from %s:%s\"         $s4 = \"Compiled without normal mode, can't run without -i\"         $s5 = \"cancel-tcpip-forward\"         $s6 = \"dropbear_prng\"         $s7 = \"cron\"     condition:         uint32be(0) == 0x7F454C46 and filesize < 2MB and all of them } rule REGEORG_Tuneller_generic {     meta:         author = \"Mandiant\"         date_created = \"2021-12-20\"         date_modified = \"2021-12-20\"         md5 = \"ba22992ce835dadcd06bff4ab7b162f9\"     strings:         $s1 = \"System.Net.IPEndPoint\"         $s2 = \"Response.AddHeader\"         $s3 = \"Request.InputStream.Read\"         $s4 = \"Request.Headers.Get\"         $s5 = \"Response.Write\"         $s6 = \"System.Buffer.BlockCopy\"         $s7 = \"Response.BinaryWrite\"         $s8 = \"SocketException soex\"     condition:         filesize < 1MB and 7 of them } 9/9 rule UNC3524_sha1 {     meta:         author = \"Mandiant\"         date_created = \"2022-01-19\"         date_modified = \"2022-01-19\"    strings:         $h1 = { DD E5 D5 97 20 53 27 BF F0 A2 BA CD 96 35 9A AD 1C 75 EB 47 }     condition:         uint32be(0) == 0x7F454C46 and filesize < 10MB and all of them } Indicators MALWARE FAMILY Indicator QUIETEXIT Dynamic DNS cloudns.asia dynu.net mywire.org webredirect.org MALWARE FAMILY MD5 SHA1 SHA256 REGEORG GitHub version ba22992ce835dadcd06bff4ab7b162f9 3d4dcc859c6ca7e5b36483ad84c9ceef34973f9a 7b5e3c1c06d82b3e7309C258dfbd4bfcd' which indicates a potential connection between a technique and a capec.",
    "context": "ATT&CK Tactic Category Techniques Defense Evasion    T1027: Obfuscated Files or Information Discovery    T1012: Query Registry    T1016: System Network Configuration Discovery    T1049: System Network Connections Discovery    T1057: Process Discovery    T1518: Software Discovery 7/9 Credential Access    T1003.004: LSA Secrets    T1003.006: DCSync    T1111: Two-Factor Authentication Interception Collection    T1114: Email Collection    T1114.002: Remote Email Collection Lateral Movement    T1021.004: SSH Persistence    T1037.004: RC Scripts    T1098.001: Additional Cloud Credentials    T1505.003: Web Shell Command and Control    T1071: Application Layer Protocol    T1090.003: Multi-hop Proxy    T1095: Non-Application Layer Protocol    T1572: Protocol Tunneling    T1573.002: Asymmetric Cryptography Resource Development    T1583.003: Virtual Private Server    T1584: Compromise Infrastructure    T1608.003: Install Digital Certificate Execution    T1059.001: PowerShell    T1059.003: Windows Command Shell YARA Signatures Note: These rules are designed to broadly capture suspicious files and are not designed to detect a particular malware or threat. 8/9 rule QUIETEXIT_strings {     meta:         author = \"Mandiant\"         date_created = \"2022-01-13\"         date_modified = \"2022-01-13\"         rev = 1     strings:         $s1 = \"auth-agent@openssh.com\"         $s2 = \"auth-%.8x-%d\"         $s3 = \"Child connection from %s:%s\"         $s4 = \"Compiled without normal mode, can't run without -i\"         $s5 = \"cancel-tcpip-forward\"         $s6 = \"dropbear_prng\"         $s7 = \"cron\"     condition:         uint32be(0) == 0x7F454C46 and filesize < 2MB and all of them } rule REGEORG_Tuneller_generic {     meta:         author = \"Mandiant\"         date_created = \"2021-12-20\"         date_modified = \"2021-12-20\"         md5 = \"ba22992ce835dadcd06bff4ab7b162f9\"     strings:         $s1 = \"System.Net.IPEndPoint\"         $s2 = \"Response.AddHeader\"         $s3 = \"Request.InputStream.Read\"         $s4 = \"Request.Headers.Get\"         $s5 = \"Response.Write\"         $s6 = \"System.Buffer.BlockCopy\"         $s7 = \"Response.BinaryWrite\"         $s8 = \"SocketException soex\"     condition:         filesize < 1MB and 7 of them } 9/9 rule UNC3524_sha1 {     meta:         author = \"Mandiant\"         date_created = \"2022-01-19\"         date_modified = \"2022-01-19\"    strings:         $h1 = { DD E5 D5 97 20 53 27 BF F0 A2 BA CD 96 35 9A AD 1C 75 EB 47 }     condition:         uint32be(0) == 0x7F454C46 and filesize < 10MB and all of them } Indicators MALWARE FAMILY Indicator QUIETEXIT Dynamic DNS cloudns.asia dynu.net mywire.org webredirect.org MALWARE FAMILY MD5 SHA1 SHA256 REGEORG GitHub version ba22992ce835dadcd06bff4ab7b162f9 3d4dcc859c6ca7e5b36483ad84c9ceef34973f9a 7b5e3c1c06d82b3e7309C258dfbd4bfcd"
  },
  {
    "from": "T1587.003",
    "to": "CAPEC-117",
    "from_name": "Digital Certificates",
    "to_name": "Interception",
    "from_layer": "technique",
    "to_layer": "capec",
    "justification": "Both entities appear in the same sentence: 'ATT&CK Tactic Category Techniques Defense Evasion    T1027: Obfuscated Files or Information Discovery    T1012: Query Registry    T1016: System Network Configuration Discovery    T1049: System Network Connections Discovery    T1057: Process Discovery    T1518: Software Discovery 7/9 Credential Access    T1003.004: LSA Secrets    T1003.006: DCSync    T1111: Two-Factor Authentication Interception Collection    T1114: Email Collection    T1114.002: Remote Email Collection Lateral Movement    T1021.004: SSH Persistence    T1037.004: RC Scripts    T1098.001: Additional Cloud Credentials    T1505.003: Web Shell Command and Control    T1071: Application Layer Protocol    T1090.003: Multi-hop Proxy    T1095: Non-Application Layer Protocol    T1572: Protocol Tunneling    T1573.002: Asymmetric Cryptography Resource Development    T1583.003: Virtual Private Server    T1584: Compromise Infrastructure    T1608.003: Install Digital Certificate Execution    T1059.001: PowerShell    T1059.003: Windows Command Shell YARA Signatures Note: These rules are designed to broadly capture suspicious files and are not designed to detect a particular malware or threat. 8/9 rule QUIETEXIT_strings {     meta:         author = \"Mandiant\"         date_created = \"2022-01-13\"         date_modified = \"2022-01-13\"         rev = 1     strings:         $s1 = \"auth-agent@openssh.com\"         $s2 = \"auth-%.8x-%d\"         $s3 = \"Child connection from %s:%s\"         $s4 = \"Compiled without normal mode, can't run without -i\"         $s5 = \"cancel-tcpip-forward\"         $s6 = \"dropbear_prng\"         $s7 = \"cron\"     condition:         uint32be(0) == 0x7F454C46 and filesize < 2MB and all of them } rule REGEORG_Tuneller_generic {     meta:         author = \"Mandiant\"         date_created = \"2021-12-20\"         date_modified = \"2021-12-20\"         md5 = \"ba22992ce835dadcd06bff4ab7b162f9\"     strings:         $s1 = \"System.Net.IPEndPoint\"         $s2 = \"Response.AddHeader\"         $s3 = \"Request.InputStream.Read\"         $s4 = \"Request.Headers.Get\"         $s5 = \"Response.Write\"         $s6 = \"System.Buffer.BlockCopy\"         $s7 = \"Response.BinaryWrite\"         $s8 = \"SocketException soex\"     condition:         filesize < 1MB and 7 of them } 9/9 rule UNC3524_sha1 {     meta:         author = \"Mandiant\"         date_created = \"2022-01-19\"         date_modified = \"2022-01-19\"    strings:         $h1 = { DD E5 D5 97 20 53 27 BF F0 A2 BA CD 96 35 9A AD 1C 75 EB 47 }     condition:         uint32be(0) == 0x7F454C46 and filesize < 10MB and all of them } Indicators MALWARE FAMILY Indicator QUIETEXIT Dynamic DNS cloudns.asia dynu.net mywire.org webredirect.org MALWARE FAMILY MD5 SHA1 SHA256 REGEORG GitHub version ba22992ce835dadcd06bff4ab7b162f9 3d4dcc859c6ca7e5b36483ad84c9ceef34973f9a 7b5e3c1c06d82b3e7309C258dfbd4bfcd' which indicates a potential connection between a technique and a capec.",
    "context": "ATT&CK Tactic Category Techniques Defense Evasion    T1027: Obfuscated Files or Information Discovery    T1012: Query Registry    T1016: System Network Configuration Discovery    T1049: System Network Connections Discovery    T1057: Process Discovery    T1518: Software Discovery 7/9 Credential Access    T1003.004: LSA Secrets    T1003.006: DCSync    T1111: Two-Factor Authentication Interception Collection    T1114: Email Collection    T1114.002: Remote Email Collection Lateral Movement    T1021.004: SSH Persistence    T1037.004: RC Scripts    T1098.001: Additional Cloud Credentials    T1505.003: Web Shell Command and Control    T1071: Application Layer Protocol    T1090.003: Multi-hop Proxy    T1095: Non-Application Layer Protocol    T1572: Protocol Tunneling    T1573.002: Asymmetric Cryptography Resource Development    T1583.003: Virtual Private Server    T1584: Compromise Infrastructure    T1608.003: Install Digital Certificate Execution    T1059.001: PowerShell    T1059.003: Windows Command Shell YARA Signatures Note: These rules are designed to broadly capture suspicious files and are not designed to detect a particular malware or threat. 8/9 rule QUIETEXIT_strings {     meta:         author = \"Mandiant\"         date_created = \"2022-01-13\"         date_modified = \"2022-01-13\"         rev = 1     strings:         $s1 = \"auth-agent@openssh.com\"         $s2 = \"auth-%.8x-%d\"         $s3 = \"Child connection from %s:%s\"         $s4 = \"Compiled without normal mode, can't run without -i\"         $s5 = \"cancel-tcpip-forward\"         $s6 = \"dropbear_prng\"         $s7 = \"cron\"     condition:         uint32be(0) == 0x7F454C46 and filesize < 2MB and all of them } rule REGEORG_Tuneller_generic {     meta:         author = \"Mandiant\"         date_created = \"2021-12-20\"         date_modified = \"2021-12-20\"         md5 = \"ba22992ce835dadcd06bff4ab7b162f9\"     strings:         $s1 = \"System.Net.IPEndPoint\"         $s2 = \"Response.AddHeader\"         $s3 = \"Request.InputStream.Read\"         $s4 = \"Request.Headers.Get\"         $s5 = \"Response.Write\"         $s6 = \"System.Buffer.BlockCopy\"         $s7 = \"Response.BinaryWrite\"         $s8 = \"SocketException soex\"     condition:         filesize < 1MB and 7 of them } 9/9 rule UNC3524_sha1 {     meta:         author = \"Mandiant\"         date_created = \"2022-01-19\"         date_modified = \"2022-01-19\"    strings:         $h1 = { DD E5 D5 97 20 53 27 BF F0 A2 BA CD 96 35 9A AD 1C 75 EB 47 }     condition:         uint32be(0) == 0x7F454C46 and filesize < 10MB and all of them } Indicators MALWARE FAMILY Indicator QUIETEXIT Dynamic DNS cloudns.asia dynu.net mywire.org webredirect.org MALWARE FAMILY MD5 SHA1 SHA256 REGEORG GitHub version ba22992ce835dadcd06bff4ab7b162f9 3d4dcc859c6ca7e5b36483ad84c9ceef34973f9a 7b5e3c1c06d82b3e7309C258dfbd4bfcd"
  },
  {
    "from": "T1588.004",
    "to": "CAPEC-117",
    "from_name": "Digital Certificates",
    "to_name": "Interception",
    "from_layer": "technique",
    "to_layer": "capec",
    "justification": "Both entities appear in the same sentence: 'ATT&CK Tactic Category Techniques Defense Evasion    T1027: Obfuscated Files or Information Discovery    T1012: Query Registry    T1016: System Network Configuration Discovery    T1049: System Network Connections Discovery    T1057: Process Discovery    T1518: Software Discovery 7/9 Credential Access    T1003.004: LSA Secrets    T1003.006: DCSync    T1111: Two-Factor Authentication Interception Collection    T1114: Email Collection    T1114.002: Remote Email Collection Lateral Movement    T1021.004: SSH Persistence    T1037.004: RC Scripts    T1098.001: Additional Cloud Credentials    T1505.003: Web Shell Command and Control    T1071: Application Layer Protocol    T1090.003: Multi-hop Proxy    T1095: Non-Application Layer Protocol    T1572: Protocol Tunneling    T1573.002: Asymmetric Cryptography Resource Development    T1583.003: Virtual Private Server    T1584: Compromise Infrastructure    T1608.003: Install Digital Certificate Execution    T1059.001: PowerShell    T1059.003: Windows Command Shell YARA Signatures Note: These rules are designed to broadly capture suspicious files and are not designed to detect a particular malware or threat. 8/9 rule QUIETEXIT_strings {     meta:         author = \"Mandiant\"         date_created = \"2022-01-13\"         date_modified = \"2022-01-13\"         rev = 1     strings:         $s1 = \"auth-agent@openssh.com\"         $s2 = \"auth-%.8x-%d\"         $s3 = \"Child connection from %s:%s\"         $s4 = \"Compiled without normal mode, can't run without -i\"         $s5 = \"cancel-tcpip-forward\"         $s6 = \"dropbear_prng\"         $s7 = \"cron\"     condition:         uint32be(0) == 0x7F454C46 and filesize < 2MB and all of them } rule REGEORG_Tuneller_generic {     meta:         author = \"Mandiant\"         date_created = \"2021-12-20\"         date_modified = \"2021-12-20\"         md5 = \"ba22992ce835dadcd06bff4ab7b162f9\"     strings:         $s1 = \"System.Net.IPEndPoint\"         $s2 = \"Response.AddHeader\"         $s3 = \"Request.InputStream.Read\"         $s4 = \"Request.Headers.Get\"         $s5 = \"Response.Write\"         $s6 = \"System.Buffer.BlockCopy\"         $s7 = \"Response.BinaryWrite\"         $s8 = \"SocketException soex\"     condition:         filesize < 1MB and 7 of them } 9/9 rule UNC3524_sha1 {     meta:         author = \"Mandiant\"         date_created = \"2022-01-19\"         date_modified = \"2022-01-19\"    strings:         $h1 = { DD E5 D5 97 20 53 27 BF F0 A2 BA CD 96 35 9A AD 1C 75 EB 47 }     condition:         uint32be(0) == 0x7F454C46 and filesize < 10MB and all of them } Indicators MALWARE FAMILY Indicator QUIETEXIT Dynamic DNS cloudns.asia dynu.net mywire.org webredirect.org MALWARE FAMILY MD5 SHA1 SHA256 REGEORG GitHub version ba22992ce835dadcd06bff4ab7b162f9 3d4dcc859c6ca7e5b36483ad84c9ceef34973f9a 7b5e3c1c06d82b3e7309C258dfbd4bfcd' which indicates a potential connection between a technique and a capec.",
    "context": "ATT&CK Tactic Category Techniques Defense Evasion    T1027: Obfuscated Files or Information Discovery    T1012: Query Registry    T1016: System Network Configuration Discovery    T1049: System Network Connections Discovery    T1057: Process Discovery    T1518: Software Discovery 7/9 Credential Access    T1003.004: LSA Secrets    T1003.006: DCSync    T1111: Two-Factor Authentication Interception Collection    T1114: Email Collection    T1114.002: Remote Email Collection Lateral Movement    T1021.004: SSH Persistence    T1037.004: RC Scripts    T1098.001: Additional Cloud Credentials    T1505.003: Web Shell Command and Control    T1071: Application Layer Protocol    T1090.003: Multi-hop Proxy    T1095: Non-Application Layer Protocol    T1572: Protocol Tunneling    T1573.002: Asymmetric Cryptography Resource Development    T1583.003: Virtual Private Server    T1584: Compromise Infrastructure    T1608.003: Install Digital Certificate Execution    T1059.001: PowerShell    T1059.003: Windows Command Shell YARA Signatures Note: These rules are designed to broadly capture suspicious files and are not designed to detect a particular malware or threat. 8/9 rule QUIETEXIT_strings {     meta:         author = \"Mandiant\"         date_created = \"2022-01-13\"         date_modified = \"2022-01-13\"         rev = 1     strings:         $s1 = \"auth-agent@openssh.com\"         $s2 = \"auth-%.8x-%d\"         $s3 = \"Child connection from %s:%s\"         $s4 = \"Compiled without normal mode, can't run without -i\"         $s5 = \"cancel-tcpip-forward\"         $s6 = \"dropbear_prng\"         $s7 = \"cron\"     condition:         uint32be(0) == 0x7F454C46 and filesize < 2MB and all of them } rule REGEORG_Tuneller_generic {     meta:         author = \"Mandiant\"         date_created = \"2021-12-20\"         date_modified = \"2021-12-20\"         md5 = \"ba22992ce835dadcd06bff4ab7b162f9\"     strings:         $s1 = \"System.Net.IPEndPoint\"         $s2 = \"Response.AddHeader\"         $s3 = \"Request.InputStream.Read\"         $s4 = \"Request.Headers.Get\"         $s5 = \"Response.Write\"         $s6 = \"System.Buffer.BlockCopy\"         $s7 = \"Response.BinaryWrite\"         $s8 = \"SocketException soex\"     condition:         filesize < 1MB and 7 of them } 9/9 rule UNC3524_sha1 {     meta:         author = \"Mandiant\"         date_created = \"2022-01-19\"         date_modified = \"2022-01-19\"    strings:         $h1 = { DD E5 D5 97 20 53 27 BF F0 A2 BA CD 96 35 9A AD 1C 75 EB 47 }     condition:         uint32be(0) == 0x7F454C46 and filesize < 10MB and all of them } Indicators MALWARE FAMILY Indicator QUIETEXIT Dynamic DNS cloudns.asia dynu.net mywire.org webredirect.org MALWARE FAMILY MD5 SHA1 SHA256 REGEORG GitHub version ba22992ce835dadcd06bff4ab7b162f9 3d4dcc859c6ca7e5b36483ad84c9ceef34973f9a 7b5e3c1c06d82b3e7309C258dfbd4bfcd"
  },
  {
    "from": "T1596.003",
    "to": "CAPEC-117",
    "from_name": "Digital Certificates",
    "to_name": "Interception",
    "from_layer": "technique",
    "to_layer": "capec",
    "justification": "Both entities appear in the same sentence: 'ATT&CK Tactic Category Techniques Defense Evasion    T1027: Obfuscated Files or Information Discovery    T1012: Query Registry    T1016: System Network Configuration Discovery    T1049: System Network Connections Discovery    T1057: Process Discovery    T1518: Software Discovery 7/9 Credential Access    T1003.004: LSA Secrets    T1003.006: DCSync    T1111: Two-Factor Authentication Interception Collection    T1114: Email Collection    T1114.002: Remote Email Collection Lateral Movement    T1021.004: SSH Persistence    T1037.004: RC Scripts    T1098.001: Additional Cloud Credentials    T1505.003: Web Shell Command and Control    T1071: Application Layer Protocol    T1090.003: Multi-hop Proxy    T1095: Non-Application Layer Protocol    T1572: Protocol Tunneling    T1573.002: Asymmetric Cryptography Resource Development    T1583.003: Virtual Private Server    T1584: Compromise Infrastructure    T1608.003: Install Digital Certificate Execution    T1059.001: PowerShell    T1059.003: Windows Command Shell YARA Signatures Note: These rules are designed to broadly capture suspicious files and are not designed to detect a particular malware or threat. 8/9 rule QUIETEXIT_strings {     meta:         author = \"Mandiant\"         date_created = \"2022-01-13\"         date_modified = \"2022-01-13\"         rev = 1     strings:         $s1 = \"auth-agent@openssh.com\"         $s2 = \"auth-%.8x-%d\"         $s3 = \"Child connection from %s:%s\"         $s4 = \"Compiled without normal mode, can't run without -i\"         $s5 = \"cancel-tcpip-forward\"         $s6 = \"dropbear_prng\"         $s7 = \"cron\"     condition:         uint32be(0) == 0x7F454C46 and filesize < 2MB and all of them } rule REGEORG_Tuneller_generic {     meta:         author = \"Mandiant\"         date_created = \"2021-12-20\"         date_modified = \"2021-12-20\"         md5 = \"ba22992ce835dadcd06bff4ab7b162f9\"     strings:         $s1 = \"System.Net.IPEndPoint\"         $s2 = \"Response.AddHeader\"         $s3 = \"Request.InputStream.Read\"         $s4 = \"Request.Headers.Get\"         $s5 = \"Response.Write\"         $s6 = \"System.Buffer.BlockCopy\"         $s7 = \"Response.BinaryWrite\"         $s8 = \"SocketException soex\"     condition:         filesize < 1MB and 7 of them } 9/9 rule UNC3524_sha1 {     meta:         author = \"Mandiant\"         date_created = \"2022-01-19\"         date_modified = \"2022-01-19\"    strings:         $h1 = { DD E5 D5 97 20 53 27 BF F0 A2 BA CD 96 35 9A AD 1C 75 EB 47 }     condition:         uint32be(0) == 0x7F454C46 and filesize < 10MB and all of them } Indicators MALWARE FAMILY Indicator QUIETEXIT Dynamic DNS cloudns.asia dynu.net mywire.org webredirect.org MALWARE FAMILY MD5 SHA1 SHA256 REGEORG GitHub version ba22992ce835dadcd06bff4ab7b162f9 3d4dcc859c6ca7e5b36483ad84c9ceef34973f9a 7b5e3c1c06d82b3e7309C258dfbd4bfcd' which indicates a potential connection between a technique and a capec.",
    "context": "ATT&CK Tactic Category Techniques Defense Evasion    T1027: Obfuscated Files or Information Discovery    T1012: Query Registry    T1016: System Network Configuration Discovery    T1049: System Network Connections Discovery    T1057: Process Discovery    T1518: Software Discovery 7/9 Credential Access    T1003.004: LSA Secrets    T1003.006: DCSync    T1111: Two-Factor Authentication Interception Collection    T1114: Email Collection    T1114.002: Remote Email Collection Lateral Movement    T1021.004: SSH Persistence    T1037.004: RC Scripts    T1098.001: Additional Cloud Credentials    T1505.003: Web Shell Command and Control    T1071: Application Layer Protocol    T1090.003: Multi-hop Proxy    T1095: Non-Application Layer Protocol    T1572: Protocol Tunneling    T1573.002: Asymmetric Cryptography Resource Development    T1583.003: Virtual Private Server    T1584: Compromise Infrastructure    T1608.003: Install Digital Certificate Execution    T1059.001: PowerShell    T1059.003: Windows Command Shell YARA Signatures Note: These rules are designed to broadly capture suspicious files and are not designed to detect a particular malware or threat. 8/9 rule QUIETEXIT_strings {     meta:         author = \"Mandiant\"         date_created = \"2022-01-13\"         date_modified = \"2022-01-13\"         rev = 1     strings:         $s1 = \"auth-agent@openssh.com\"         $s2 = \"auth-%.8x-%d\"         $s3 = \"Child connection from %s:%s\"         $s4 = \"Compiled without normal mode, can't run without -i\"         $s5 = \"cancel-tcpip-forward\"         $s6 = \"dropbear_prng\"         $s7 = \"cron\"     condition:         uint32be(0) == 0x7F454C46 and filesize < 2MB and all of them } rule REGEORG_Tuneller_generic {     meta:         author = \"Mandiant\"         date_created = \"2021-12-20\"         date_modified = \"2021-12-20\"         md5 = \"ba22992ce835dadcd06bff4ab7b162f9\"     strings:         $s1 = \"System.Net.IPEndPoint\"         $s2 = \"Response.AddHeader\"         $s3 = \"Request.InputStream.Read\"         $s4 = \"Request.Headers.Get\"         $s5 = \"Response.Write\"         $s6 = \"System.Buffer.BlockCopy\"         $s7 = \"Response.BinaryWrite\"         $s8 = \"SocketException soex\"     condition:         filesize < 1MB and 7 of them } 9/9 rule UNC3524_sha1 {     meta:         author = \"Mandiant\"         date_created = \"2022-01-19\"         date_modified = \"2022-01-19\"    strings:         $h1 = { DD E5 D5 97 20 53 27 BF F0 A2 BA CD 96 35 9A AD 1C 75 EB 47 }     condition:         uint32be(0) == 0x7F454C46 and filesize < 10MB and all of them } Indicators MALWARE FAMILY Indicator QUIETEXIT Dynamic DNS cloudns.asia dynu.net mywire.org webredirect.org MALWARE FAMILY MD5 SHA1 SHA256 REGEORG GitHub version ba22992ce835dadcd06bff4ab7b162f9 3d4dcc859c6ca7e5b36483ad84c9ceef34973f9a 7b5e3c1c06d82b3e7309C258dfbd4bfcd"
  },
  {
    "from": "T1573",
    "to": "CAPEC-117",
    "from_name": "Encrypted Channel",
    "to_name": "Interception",
    "from_layer": "technique",
    "to_layer": "capec",
    "justification": "Both entities appear in the same sentence: 'ATT&CK Tactic Category Techniques Defense Evasion    T1027: Obfuscated Files or Information Discovery    T1012: Query Registry    T1016: System Network Configuration Discovery    T1049: System Network Connections Discovery    T1057: Process Discovery    T1518: Software Discovery 7/9 Credential Access    T1003.004: LSA Secrets    T1003.006: DCSync    T1111: Two-Factor Authentication Interception Collection    T1114: Email Collection    T1114.002: Remote Email Collection Lateral Movement    T1021.004: SSH Persistence    T1037.004: RC Scripts    T1098.001: Additional Cloud Credentials    T1505.003: Web Shell Command and Control    T1071: Application Layer Protocol    T1090.003: Multi-hop Proxy    T1095: Non-Application Layer Protocol    T1572: Protocol Tunneling    T1573.002: Asymmetric Cryptography Resource Development    T1583.003: Virtual Private Server    T1584: Compromise Infrastructure    T1608.003: Install Digital Certificate Execution    T1059.001: PowerShell    T1059.003: Windows Command Shell YARA Signatures Note: These rules are designed to broadly capture suspicious files and are not designed to detect a particular malware or threat. 8/9 rule QUIETEXIT_strings {     meta:         author = \"Mandiant\"         date_created = \"2022-01-13\"         date_modified = \"2022-01-13\"         rev = 1     strings:         $s1 = \"auth-agent@openssh.com\"         $s2 = \"auth-%.8x-%d\"         $s3 = \"Child connection from %s:%s\"         $s4 = \"Compiled without normal mode, can't run without -i\"         $s5 = \"cancel-tcpip-forward\"         $s6 = \"dropbear_prng\"         $s7 = \"cron\"     condition:         uint32be(0) == 0x7F454C46 and filesize < 2MB and all of them } rule REGEORG_Tuneller_generic {     meta:         author = \"Mandiant\"         date_created = \"2021-12-20\"         date_modified = \"2021-12-20\"         md5 = \"ba22992ce835dadcd06bff4ab7b162f9\"     strings:         $s1 = \"System.Net.IPEndPoint\"         $s2 = \"Response.AddHeader\"         $s3 = \"Request.InputStream.Read\"         $s4 = \"Request.Headers.Get\"         $s5 = \"Response.Write\"         $s6 = \"System.Buffer.BlockCopy\"         $s7 = \"Response.BinaryWrite\"         $s8 = \"SocketException soex\"     condition:         filesize < 1MB and 7 of them } 9/9 rule UNC3524_sha1 {     meta:         author = \"Mandiant\"         date_created = \"2022-01-19\"         date_modified = \"2022-01-19\"    strings:         $h1 = { DD E5 D5 97 20 53 27 BF F0 A2 BA CD 96 35 9A AD 1C 75 EB 47 }     condition:         uint32be(0) == 0x7F454C46 and filesize < 10MB and all of them } Indicators MALWARE FAMILY Indicator QUIETEXIT Dynamic DNS cloudns.asia dynu.net mywire.org webredirect.org MALWARE FAMILY MD5 SHA1 SHA256 REGEORG GitHub version ba22992ce835dadcd06bff4ab7b162f9 3d4dcc859c6ca7e5b36483ad84c9ceef34973f9a 7b5e3c1c06d82b3e7309C258dfbd4bfcd' which indicates a potential connection between a technique and a capec.",
    "context": "ATT&CK Tactic Category Techniques Defense Evasion    T1027: Obfuscated Files or Information Discovery    T1012: Query Registry    T1016: System Network Configuration Discovery    T1049: System Network Connections Discovery    T1057: Process Discovery    T1518: Software Discovery 7/9 Credential Access    T1003.004: LSA Secrets    T1003.006: DCSync    T1111: Two-Factor Authentication Interception Collection    T1114: Email Collection    T1114.002: Remote Email Collection Lateral Movement    T1021.004: SSH Persistence    T1037.004: RC Scripts    T1098.001: Additional Cloud Credentials    T1505.003: Web Shell Command and Control    T1071: Application Layer Protocol    T1090.003: Multi-hop Proxy    T1095: Non-Application Layer Protocol    T1572: Protocol Tunneling    T1573.002: Asymmetric Cryptography Resource Development    T1583.003: Virtual Private Server    T1584: Compromise Infrastructure    T1608.003: Install Digital Certificate Execution    T1059.001: PowerShell    T1059.003: Windows Command Shell YARA Signatures Note: These rules are designed to broadly capture suspicious files and are not designed to detect a particular malware or threat. 8/9 rule QUIETEXIT_strings {     meta:         author = \"Mandiant\"         date_created = \"2022-01-13\"         date_modified = \"2022-01-13\"         rev = 1     strings:         $s1 = \"auth-agent@openssh.com\"         $s2 = \"auth-%.8x-%d\"         $s3 = \"Child connection from %s:%s\"         $s4 = \"Compiled without normal mode, can't run without -i\"         $s5 = \"cancel-tcpip-forward\"         $s6 = \"dropbear_prng\"         $s7 = \"cron\"     condition:         uint32be(0) == 0x7F454C46 and filesize < 2MB and all of them } rule REGEORG_Tuneller_generic {     meta:         author = \"Mandiant\"         date_created = \"2021-12-20\"         date_modified = \"2021-12-20\"         md5 = \"ba22992ce835dadcd06bff4ab7b162f9\"     strings:         $s1 = \"System.Net.IPEndPoint\"         $s2 = \"Response.AddHeader\"         $s3 = \"Request.InputStream.Read\"         $s4 = \"Request.Headers.Get\"         $s5 = \"Response.Write\"         $s6 = \"System.Buffer.BlockCopy\"         $s7 = \"Response.BinaryWrite\"         $s8 = \"SocketException soex\"     condition:         filesize < 1MB and 7 of them } 9/9 rule UNC3524_sha1 {     meta:         author = \"Mandiant\"         date_created = \"2022-01-19\"         date_modified = \"2022-01-19\"    strings:         $h1 = { DD E5 D5 97 20 53 27 BF F0 A2 BA CD 96 35 9A AD 1C 75 EB 47 }     condition:         uint32be(0) == 0x7F454C46 and filesize < 10MB and all of them } Indicators MALWARE FAMILY Indicator QUIETEXIT Dynamic DNS cloudns.asia dynu.net mywire.org webredirect.org MALWARE FAMILY MD5 SHA1 SHA256 REGEORG GitHub version ba22992ce835dadcd06bff4ab7b162f9 3d4dcc859c6ca7e5b36483ad84c9ceef34973f9a 7b5e3c1c06d82b3e7309C258dfbd4bfcd"
  },
  {
    "from": "T1608.003",
    "to": "CAPEC-117",
    "from_name": "Install Digital Certificate",
    "to_name": "Interception",
    "from_layer": "technique",
    "to_layer": "capec",
    "justification": "Both entities appear in the same sentence: 'ATT&CK Tactic Category Techniques Defense Evasion    T1027: Obfuscated Files or Information Discovery    T1012: Query Registry    T1016: System Network Configuration Discovery    T1049: System Network Connections Discovery    T1057: Process Discovery    T1518: Software Discovery 7/9 Credential Access    T1003.004: LSA Secrets    T1003.006: DCSync    T1111: Two-Factor Authentication Interception Collection    T1114: Email Collection    T1114.002: Remote Email Collection Lateral Movement    T1021.004: SSH Persistence    T1037.004: RC Scripts    T1098.001: Additional Cloud Credentials    T1505.003: Web Shell Command and Control    T1071: Application Layer Protocol    T1090.003: Multi-hop Proxy    T1095: Non-Application Layer Protocol    T1572: Protocol Tunneling    T1573.002: Asymmetric Cryptography Resource Development    T1583.003: Virtual Private Server    T1584: Compromise Infrastructure    T1608.003: Install Digital Certificate Execution    T1059.001: PowerShell    T1059.003: Windows Command Shell YARA Signatures Note: These rules are designed to broadly capture suspicious files and are not designed to detect a particular malware or threat. 8/9 rule QUIETEXIT_strings {     meta:         author = \"Mandiant\"         date_created = \"2022-01-13\"         date_modified = \"2022-01-13\"         rev = 1     strings:         $s1 = \"auth-agent@openssh.com\"         $s2 = \"auth-%.8x-%d\"         $s3 = \"Child connection from %s:%s\"         $s4 = \"Compiled without normal mode, can't run without -i\"         $s5 = \"cancel-tcpip-forward\"         $s6 = \"dropbear_prng\"         $s7 = \"cron\"     condition:         uint32be(0) == 0x7F454C46 and filesize < 2MB and all of them } rule REGEORG_Tuneller_generic {     meta:         author = \"Mandiant\"         date_created = \"2021-12-20\"         date_modified = \"2021-12-20\"         md5 = \"ba22992ce835dadcd06bff4ab7b162f9\"     strings:         $s1 = \"System.Net.IPEndPoint\"         $s2 = \"Response.AddHeader\"         $s3 = \"Request.InputStream.Read\"         $s4 = \"Request.Headers.Get\"         $s5 = \"Response.Write\"         $s6 = \"System.Buffer.BlockCopy\"         $s7 = \"Response.BinaryWrite\"         $s8 = \"SocketException soex\"     condition:         filesize < 1MB and 7 of them } 9/9 rule UNC3524_sha1 {     meta:         author = \"Mandiant\"         date_created = \"2022-01-19\"         date_modified = \"2022-01-19\"    strings:         $h1 = { DD E5 D5 97 20 53 27 BF F0 A2 BA CD 96 35 9A AD 1C 75 EB 47 }     condition:         uint32be(0) == 0x7F454C46 and filesize < 10MB and all of them } Indicators MALWARE FAMILY Indicator QUIETEXIT Dynamic DNS cloudns.asia dynu.net mywire.org webredirect.org MALWARE FAMILY MD5 SHA1 SHA256 REGEORG GitHub version ba22992ce835dadcd06bff4ab7b162f9 3d4dcc859c6ca7e5b36483ad84c9ceef34973f9a 7b5e3c1c06d82b3e7309C258dfbd4bfcd' which indicates a potential connection between a technique and a capec.",
    "context": "ATT&CK Tactic Category Techniques Defense Evasion    T1027: Obfuscated Files or Information Discovery    T1012: Query Registry    T1016: System Network Configuration Discovery    T1049: System Network Connections Discovery    T1057: Process Discovery    T1518: Software Discovery 7/9 Credential Access    T1003.004: LSA Secrets    T1003.006: DCSync    T1111: Two-Factor Authentication Interception Collection    T1114: Email Collection    T1114.002: Remote Email Collection Lateral Movement    T1021.004: SSH Persistence    T1037.004: RC Scripts    T1098.001: Additional Cloud Credentials    T1505.003: Web Shell Command and Control    T1071: Application Layer Protocol    T1090.003: Multi-hop Proxy    T1095: Non-Application Layer Protocol    T1572: Protocol Tunneling    T1573.002: Asymmetric Cryptography Resource Development    T1583.003: Virtual Private Server    T1584: Compromise Infrastructure    T1608.003: Install Digital Certificate Execution    T1059.001: PowerShell    T1059.003: Windows Command Shell YARA Signatures Note: These rules are designed to broadly capture suspicious files and are not designed to detect a particular malware or threat. 8/9 rule QUIETEXIT_strings {     meta:         author = \"Mandiant\"         date_created = \"2022-01-13\"         date_modified = \"2022-01-13\"         rev = 1     strings:         $s1 = \"auth-agent@openssh.com\"         $s2 = \"auth-%.8x-%d\"         $s3 = \"Child connection from %s:%s\"         $s4 = \"Compiled without normal mode, can't run without -i\"         $s5 = \"cancel-tcpip-forward\"         $s6 = \"dropbear_prng\"         $s7 = \"cron\"     condition:         uint32be(0) == 0x7F454C46 and filesize < 2MB and all of them } rule REGEORG_Tuneller_generic {     meta:         author = \"Mandiant\"         date_created = \"2021-12-20\"         date_modified = \"2021-12-20\"         md5 = \"ba22992ce835dadcd06bff4ab7b162f9\"     strings:         $s1 = \"System.Net.IPEndPoint\"         $s2 = \"Response.AddHeader\"         $s3 = \"Request.InputStream.Read\"         $s4 = \"Request.Headers.Get\"         $s5 = \"Response.Write\"         $s6 = \"System.Buffer.BlockCopy\"         $s7 = \"Response.BinaryWrite\"         $s8 = \"SocketException soex\"     condition:         filesize < 1MB and 7 of them } 9/9 rule UNC3524_sha1 {     meta:         author = \"Mandiant\"         date_created = \"2022-01-19\"         date_modified = \"2022-01-19\"    strings:         $h1 = { DD E5 D5 97 20 53 27 BF F0 A2 BA CD 96 35 9A AD 1C 75 EB 47 }     condition:         uint32be(0) == 0x7F454C46 and filesize < 10MB and all of them } Indicators MALWARE FAMILY Indicator QUIETEXIT Dynamic DNS cloudns.asia dynu.net mywire.org webredirect.org MALWARE FAMILY MD5 SHA1 SHA256 REGEORG GitHub version ba22992ce835dadcd06bff4ab7b162f9 3d4dcc859c6ca7e5b36483ad84c9ceef34973f9a 7b5e3c1c06d82b3e7309C258dfbd4bfcd"
  },
  {
    "from": "T1111",
    "to": "CAPEC-117",
    "from_name": "Multi-Factor Authentication Interception",
    "to_name": "Interception",
    "from_layer": "technique",
    "to_layer": "capec",
    "justification": "Both entities appear in the same sentence: 'ATT&CK Tactic Category Techniques Defense Evasion    T1027: Obfuscated Files or Information Discovery    T1012: Query Registry    T1016: System Network Configuration Discovery    T1049: System Network Connections Discovery    T1057: Process Discovery    T1518: Software Discovery 7/9 Credential Access    T1003.004: LSA Secrets    T1003.006: DCSync    T1111: Two-Factor Authentication Interception Collection    T1114: Email Collection    T1114.002: Remote Email Collection Lateral Movement    T1021.004: SSH Persistence    T1037.004: RC Scripts    T1098.001: Additional Cloud Credentials    T1505.003: Web Shell Command and Control    T1071: Application Layer Protocol    T1090.003: Multi-hop Proxy    T1095: Non-Application Layer Protocol    T1572: Protocol Tunneling    T1573.002: Asymmetric Cryptography Resource Development    T1583.003: Virtual Private Server    T1584: Compromise Infrastructure    T1608.003: Install Digital Certificate Execution    T1059.001: PowerShell    T1059.003: Windows Command Shell YARA Signatures Note: These rules are designed to broadly capture suspicious files and are not designed to detect a particular malware or threat. 8/9 rule QUIETEXIT_strings {     meta:         author = \"Mandiant\"         date_created = \"2022-01-13\"         date_modified = \"2022-01-13\"         rev = 1     strings:         $s1 = \"auth-agent@openssh.com\"         $s2 = \"auth-%.8x-%d\"         $s3 = \"Child connection from %s:%s\"         $s4 = \"Compiled without normal mode, can't run without -i\"         $s5 = \"cancel-tcpip-forward\"         $s6 = \"dropbear_prng\"         $s7 = \"cron\"     condition:         uint32be(0) == 0x7F454C46 and filesize < 2MB and all of them } rule REGEORG_Tuneller_generic {     meta:         author = \"Mandiant\"         date_created = \"2021-12-20\"         date_modified = \"2021-12-20\"         md5 = \"ba22992ce835dadcd06bff4ab7b162f9\"     strings:         $s1 = \"System.Net.IPEndPoint\"         $s2 = \"Response.AddHeader\"         $s3 = \"Request.InputStream.Read\"         $s4 = \"Request.Headers.Get\"         $s5 = \"Response.Write\"         $s6 = \"System.Buffer.BlockCopy\"         $s7 = \"Response.BinaryWrite\"         $s8 = \"SocketException soex\"     condition:         filesize < 1MB and 7 of them } 9/9 rule UNC3524_sha1 {     meta:         author = \"Mandiant\"         date_created = \"2022-01-19\"         date_modified = \"2022-01-19\"    strings:         $h1 = { DD E5 D5 97 20 53 27 BF F0 A2 BA CD 96 35 9A AD 1C 75 EB 47 }     condition:         uint32be(0) == 0x7F454C46 and filesize < 10MB and all of them } Indicators MALWARE FAMILY Indicator QUIETEXIT Dynamic DNS cloudns.asia dynu.net mywire.org webredirect.org MALWARE FAMILY MD5 SHA1 SHA256 REGEORG GitHub version ba22992ce835dadcd06bff4ab7b162f9 3d4dcc859c6ca7e5b36483ad84c9ceef34973f9a 7b5e3c1c06d82b3e7309C258dfbd4bfcd' which indicates a potential connection between a technique and a capec.",
    "context": "ATT&CK Tactic Category Techniques Defense Evasion    T1027: Obfuscated Files or Information Discovery    T1012: Query Registry    T1016: System Network Configuration Discovery    T1049: System Network Connections Discovery    T1057: Process Discovery    T1518: Software Discovery 7/9 Credential Access    T1003.004: LSA Secrets    T1003.006: DCSync    T1111: Two-Factor Authentication Interception Collection    T1114: Email Collection    T1114.002: Remote Email Collection Lateral Movement    T1021.004: SSH Persistence    T1037.004: RC Scripts    T1098.001: Additional Cloud Credentials    T1505.003: Web Shell Command and Control    T1071: Application Layer Protocol    T1090.003: Multi-hop Proxy    T1095: Non-Application Layer Protocol    T1572: Protocol Tunneling    T1573.002: Asymmetric Cryptography Resource Development    T1583.003: Virtual Private Server    T1584: Compromise Infrastructure    T1608.003: Install Digital Certificate Execution    T1059.001: PowerShell    T1059.003: Windows Command Shell YARA Signatures Note: These rules are designed to broadly capture suspicious files and are not designed to detect a particular malware or threat. 8/9 rule QUIETEXIT_strings {     meta:         author = \"Mandiant\"         date_created = \"2022-01-13\"         date_modified = \"2022-01-13\"         rev = 1     strings:         $s1 = \"auth-agent@openssh.com\"         $s2 = \"auth-%.8x-%d\"         $s3 = \"Child connection from %s:%s\"         $s4 = \"Compiled without normal mode, can't run without -i\"         $s5 = \"cancel-tcpip-forward\"         $s6 = \"dropbear_prng\"         $s7 = \"cron\"     condition:         uint32be(0) == 0x7F454C46 and filesize < 2MB and all of them } rule REGEORG_Tuneller_generic {     meta:         author = \"Mandiant\"         date_created = \"2021-12-20\"         date_modified = \"2021-12-20\"         md5 = \"ba22992ce835dadcd06bff4ab7b162f9\"     strings:         $s1 = \"System.Net.IPEndPoint\"         $s2 = \"Response.AddHeader\"         $s3 = \"Request.InputStream.Read\"         $s4 = \"Request.Headers.Get\"         $s5 = \"Response.Write\"         $s6 = \"System.Buffer.BlockCopy\"         $s7 = \"Response.BinaryWrite\"         $s8 = \"SocketException soex\"     condition:         filesize < 1MB and 7 of them } 9/9 rule UNC3524_sha1 {     meta:         author = \"Mandiant\"         date_created = \"2022-01-19\"         date_modified = \"2022-01-19\"    strings:         $h1 = { DD E5 D5 97 20 53 27 BF F0 A2 BA CD 96 35 9A AD 1C 75 EB 47 }     condition:         uint32be(0) == 0x7F454C46 and filesize < 10MB and all of them } Indicators MALWARE FAMILY Indicator QUIETEXIT Dynamic DNS cloudns.asia dynu.net mywire.org webredirect.org MALWARE FAMILY MD5 SHA1 SHA256 REGEORG GitHub version ba22992ce835dadcd06bff4ab7b162f9 3d4dcc859c6ca7e5b36483ad84c9ceef34973f9a 7b5e3c1c06d82b3e7309C258dfbd4bfcd"
  },
  {
    "from": "T1090.003",
    "to": "CAPEC-117",
    "from_name": "Multi-hop Proxy",
    "to_name": "Interception",
    "from_layer": "technique",
    "to_layer": "capec",
    "justification": "Both entities appear in the same sentence: 'ATT&CK Tactic Category Techniques Defense Evasion    T1027: Obfuscated Files or Information Discovery    T1012: Query Registry    T1016: System Network Configuration Discovery    T1049: System Network Connections Discovery    T1057: Process Discovery    T1518: Software Discovery 7/9 Credential Access    T1003.004: LSA Secrets    T1003.006: DCSync    T1111: Two-Factor Authentication Interception Collection    T1114: Email Collection    T1114.002: Remote Email Collection Lateral Movement    T1021.004: SSH Persistence    T1037.004: RC Scripts    T1098.001: Additional Cloud Credentials    T1505.003: Web Shell Command and Control    T1071: Application Layer Protocol    T1090.003: Multi-hop Proxy    T1095: Non-Application Layer Protocol    T1572: Protocol Tunneling    T1573.002: Asymmetric Cryptography Resource Development    T1583.003: Virtual Private Server    T1584: Compromise Infrastructure    T1608.003: Install Digital Certificate Execution    T1059.001: PowerShell    T1059.003: Windows Command Shell YARA Signatures Note: These rules are designed to broadly capture suspicious files and are not designed to detect a particular malware or threat. 8/9 rule QUIETEXIT_strings {     meta:         author = \"Mandiant\"         date_created = \"2022-01-13\"         date_modified = \"2022-01-13\"         rev = 1     strings:         $s1 = \"auth-agent@openssh.com\"         $s2 = \"auth-%.8x-%d\"         $s3 = \"Child connection from %s:%s\"         $s4 = \"Compiled without normal mode, can't run without -i\"         $s5 = \"cancel-tcpip-forward\"         $s6 = \"dropbear_prng\"         $s7 = \"cron\"     condition:         uint32be(0) == 0x7F454C46 and filesize < 2MB and all of them } rule REGEORG_Tuneller_generic {     meta:         author = \"Mandiant\"         date_created = \"2021-12-20\"         date_modified = \"2021-12-20\"         md5 = \"ba22992ce835dadcd06bff4ab7b162f9\"     strings:         $s1 = \"System.Net.IPEndPoint\"         $s2 = \"Response.AddHeader\"         $s3 = \"Request.InputStream.Read\"         $s4 = \"Request.Headers.Get\"         $s5 = \"Response.Write\"         $s6 = \"System.Buffer.BlockCopy\"         $s7 = \"Response.BinaryWrite\"         $s8 = \"SocketException soex\"     condition:         filesize < 1MB and 7 of them } 9/9 rule UNC3524_sha1 {     meta:         author = \"Mandiant\"         date_created = \"2022-01-19\"         date_modified = \"2022-01-19\"    strings:         $h1 = { DD E5 D5 97 20 53 27 BF F0 A2 BA CD 96 35 9A AD 1C 75 EB 47 }     condition:         uint32be(0) == 0x7F454C46 and filesize < 10MB and all of them } Indicators MALWARE FAMILY Indicator QUIETEXIT Dynamic DNS cloudns.asia dynu.net mywire.org webredirect.org MALWARE FAMILY MD5 SHA1 SHA256 REGEORG GitHub version ba22992ce835dadcd06bff4ab7b162f9 3d4dcc859c6ca7e5b36483ad84c9ceef34973f9a 7b5e3c1c06d82b3e7309C258dfbd4bfcd' which indicates a potential connection between a technique and a capec.",
    "context": "ATT&CK Tactic Category Techniques Defense Evasion    T1027: Obfuscated Files or Information Discovery    T1012: Query Registry    T1016: System Network Configuration Discovery    T1049: System Network Connections Discovery    T1057: Process Discovery    T1518: Software Discovery 7/9 Credential Access    T1003.004: LSA Secrets    T1003.006: DCSync    T1111: Two-Factor Authentication Interception Collection    T1114: Email Collection    T1114.002: Remote Email Collection Lateral Movement    T1021.004: SSH Persistence    T1037.004: RC Scripts    T1098.001: Additional Cloud Credentials    T1505.003: Web Shell Command and Control    T1071: Application Layer Protocol    T1090.003: Multi-hop Proxy    T1095: Non-Application Layer Protocol    T1572: Protocol Tunneling    T1573.002: Asymmetric Cryptography Resource Development    T1583.003: Virtual Private Server    T1584: Compromise Infrastructure    T1608.003: Install Digital Certificate Execution    T1059.001: PowerShell    T1059.003: Windows Command Shell YARA Signatures Note: These rules are designed to broadly capture suspicious files and are not designed to detect a particular malware or threat. 8/9 rule QUIETEXIT_strings {     meta:         author = \"Mandiant\"         date_created = \"2022-01-13\"         date_modified = \"2022-01-13\"         rev = 1     strings:         $s1 = \"auth-agent@openssh.com\"         $s2 = \"auth-%.8x-%d\"         $s3 = \"Child connection from %s:%s\"         $s4 = \"Compiled without normal mode, can't run without -i\"         $s5 = \"cancel-tcpip-forward\"         $s6 = \"dropbear_prng\"         $s7 = \"cron\"     condition:         uint32be(0) == 0x7F454C46 and filesize < 2MB and all of them } rule REGEORG_Tuneller_generic {     meta:         author = \"Mandiant\"         date_created = \"2021-12-20\"         date_modified = \"2021-12-20\"         md5 = \"ba22992ce835dadcd06bff4ab7b162f9\"     strings:         $s1 = \"System.Net.IPEndPoint\"         $s2 = \"Response.AddHeader\"         $s3 = \"Request.InputStream.Read\"         $s4 = \"Request.Headers.Get\"         $s5 = \"Response.Write\"         $s6 = \"System.Buffer.BlockCopy\"         $s7 = \"Response.BinaryWrite\"         $s8 = \"SocketException soex\"     condition:         filesize < 1MB and 7 of them } 9/9 rule UNC3524_sha1 {     meta:         author = \"Mandiant\"         date_created = \"2022-01-19\"         date_modified = \"2022-01-19\"    strings:         $h1 = { DD E5 D5 97 20 53 27 BF F0 A2 BA CD 96 35 9A AD 1C 75 EB 47 }     condition:         uint32be(0) == 0x7F454C46 and filesize < 10MB and all of them } Indicators MALWARE FAMILY Indicator QUIETEXIT Dynamic DNS cloudns.asia dynu.net mywire.org webredirect.org MALWARE FAMILY MD5 SHA1 SHA256 REGEORG GitHub version ba22992ce835dadcd06bff4ab7b162f9 3d4dcc859c6ca7e5b36483ad84c9ceef34973f9a 7b5e3c1c06d82b3e7309C258dfbd4bfcd"
  },
  {
    "from": "T1095",
    "to": "CAPEC-117",
    "from_name": "Non-Application Layer Protocol",
    "to_name": "Interception",
    "from_layer": "technique",
    "to_layer": "capec",
    "justification": "Both entities appear in the same sentence: 'ATT&CK Tactic Category Techniques Defense Evasion    T1027: Obfuscated Files or Information Discovery    T1012: Query Registry    T1016: System Network Configuration Discovery    T1049: System Network Connections Discovery    T1057: Process Discovery    T1518: Software Discovery 7/9 Credential Access    T1003.004: LSA Secrets    T1003.006: DCSync    T1111: Two-Factor Authentication Interception Collection    T1114: Email Collection    T1114.002: Remote Email Collection Lateral Movement    T1021.004: SSH Persistence    T1037.004: RC Scripts    T1098.001: Additional Cloud Credentials    T1505.003: Web Shell Command and Control    T1071: Application Layer Protocol    T1090.003: Multi-hop Proxy    T1095: Non-Application Layer Protocol    T1572: Protocol Tunneling    T1573.002: Asymmetric Cryptography Resource Development    T1583.003: Virtual Private Server    T1584: Compromise Infrastructure    T1608.003: Install Digital Certificate Execution    T1059.001: PowerShell    T1059.003: Windows Command Shell YARA Signatures Note: These rules are designed to broadly capture suspicious files and are not designed to detect a particular malware or threat. 8/9 rule QUIETEXIT_strings {     meta:         author = \"Mandiant\"         date_created = \"2022-01-13\"         date_modified = \"2022-01-13\"         rev = 1     strings:         $s1 = \"auth-agent@openssh.com\"         $s2 = \"auth-%.8x-%d\"         $s3 = \"Child connection from %s:%s\"         $s4 = \"Compiled without normal mode, can't run without -i\"         $s5 = \"cancel-tcpip-forward\"         $s6 = \"dropbear_prng\"         $s7 = \"cron\"     condition:         uint32be(0) == 0x7F454C46 and filesize < 2MB and all of them } rule REGEORG_Tuneller_generic {     meta:         author = \"Mandiant\"         date_created = \"2021-12-20\"         date_modified = \"2021-12-20\"         md5 = \"ba22992ce835dadcd06bff4ab7b162f9\"     strings:         $s1 = \"System.Net.IPEndPoint\"         $s2 = \"Response.AddHeader\"         $s3 = \"Request.InputStream.Read\"         $s4 = \"Request.Headers.Get\"         $s5 = \"Response.Write\"         $s6 = \"System.Buffer.BlockCopy\"         $s7 = \"Response.BinaryWrite\"         $s8 = \"SocketException soex\"     condition:         filesize < 1MB and 7 of them } 9/9 rule UNC3524_sha1 {     meta:         author = \"Mandiant\"         date_created = \"2022-01-19\"         date_modified = \"2022-01-19\"    strings:         $h1 = { DD E5 D5 97 20 53 27 BF F0 A2 BA CD 96 35 9A AD 1C 75 EB 47 }     condition:         uint32be(0) == 0x7F454C46 and filesize < 10MB and all of them } Indicators MALWARE FAMILY Indicator QUIETEXIT Dynamic DNS cloudns.asia dynu.net mywire.org webredirect.org MALWARE FAMILY MD5 SHA1 SHA256 REGEORG GitHub version ba22992ce835dadcd06bff4ab7b162f9 3d4dcc859c6ca7e5b36483ad84c9ceef34973f9a 7b5e3c1c06d82b3e7309C258dfbd4bfcd' which indicates a potential connection between a technique and a capec.",
    "context": "ATT&CK Tactic Category Techniques Defense Evasion    T1027: Obfuscated Files or Information Discovery    T1012: Query Registry    T1016: System Network Configuration Discovery    T1049: System Network Connections Discovery    T1057: Process Discovery    T1518: Software Discovery 7/9 Credential Access    T1003.004: LSA Secrets    T1003.006: DCSync    T1111: Two-Factor Authentication Interception Collection    T1114: Email Collection    T1114.002: Remote Email Collection Lateral Movement    T1021.004: SSH Persistence    T1037.004: RC Scripts    T1098.001: Additional Cloud Credentials    T1505.003: Web Shell Command and Control    T1071: Application Layer Protocol    T1090.003: Multi-hop Proxy    T1095: Non-Application Layer Protocol    T1572: Protocol Tunneling    T1573.002: Asymmetric Cryptography Resource Development    T1583.003: Virtual Private Server    T1584: Compromise Infrastructure    T1608.003: Install Digital Certificate Execution    T1059.001: PowerShell    T1059.003: Windows Command Shell YARA Signatures Note: These rules are designed to broadly capture suspicious files and are not designed to detect a particular malware or threat. 8/9 rule QUIETEXIT_strings {     meta:         author = \"Mandiant\"         date_created = \"2022-01-13\"         date_modified = \"2022-01-13\"         rev = 1     strings:         $s1 = \"auth-agent@openssh.com\"         $s2 = \"auth-%.8x-%d\"         $s3 = \"Child connection from %s:%s\"         $s4 = \"Compiled without normal mode, can't run without -i\"         $s5 = \"cancel-tcpip-forward\"         $s6 = \"dropbear_prng\"         $s7 = \"cron\"     condition:         uint32be(0) == 0x7F454C46 and filesize < 2MB and all of them } rule REGEORG_Tuneller_generic {     meta:         author = \"Mandiant\"         date_created = \"2021-12-20\"         date_modified = \"2021-12-20\"         md5 = \"ba22992ce835dadcd06bff4ab7b162f9\"     strings:         $s1 = \"System.Net.IPEndPoint\"         $s2 = \"Response.AddHeader\"         $s3 = \"Request.InputStream.Read\"         $s4 = \"Request.Headers.Get\"         $s5 = \"Response.Write\"         $s6 = \"System.Buffer.BlockCopy\"         $s7 = \"Response.BinaryWrite\"         $s8 = \"SocketException soex\"     condition:         filesize < 1MB and 7 of them } 9/9 rule UNC3524_sha1 {     meta:         author = \"Mandiant\"         date_created = \"2022-01-19\"         date_modified = \"2022-01-19\"    strings:         $h1 = { DD E5 D5 97 20 53 27 BF F0 A2 BA CD 96 35 9A AD 1C 75 EB 47 }     condition:         uint32be(0) == 0x7F454C46 and filesize < 10MB and all of them } Indicators MALWARE FAMILY Indicator QUIETEXIT Dynamic DNS cloudns.asia dynu.net mywire.org webredirect.org MALWARE FAMILY MD5 SHA1 SHA256 REGEORG GitHub version ba22992ce835dadcd06bff4ab7b162f9 3d4dcc859c6ca7e5b36483ad84c9ceef34973f9a 7b5e3c1c06d82b3e7309C258dfbd4bfcd"
  },
  {
    "from": "T1003",
    "to": "CAPEC-117",
    "from_name": "OS Credential Dumping",
    "to_name": "Interception",
    "from_layer": "technique",
    "to_layer": "capec",
    "justification": "Both entities appear in the same sentence: 'ATT&CK Tactic Category Techniques Defense Evasion    T1027: Obfuscated Files or Information Discovery    T1012: Query Registry    T1016: System Network Configuration Discovery    T1049: System Network Connections Discovery    T1057: Process Discovery    T1518: Software Discovery 7/9 Credential Access    T1003.004: LSA Secrets    T1003.006: DCSync    T1111: Two-Factor Authentication Interception Collection    T1114: Email Collection    T1114.002: Remote Email Collection Lateral Movement    T1021.004: SSH Persistence    T1037.004: RC Scripts    T1098.001: Additional Cloud Credentials    T1505.003: Web Shell Command and Control    T1071: Application Layer Protocol    T1090.003: Multi-hop Proxy    T1095: Non-Application Layer Protocol    T1572: Protocol Tunneling    T1573.002: Asymmetric Cryptography Resource Development    T1583.003: Virtual Private Server    T1584: Compromise Infrastructure    T1608.003: Install Digital Certificate Execution    T1059.001: PowerShell    T1059.003: Windows Command Shell YARA Signatures Note: These rules are designed to broadly capture suspicious files and are not designed to detect a particular malware or threat. 8/9 rule QUIETEXIT_strings {     meta:         author = \"Mandiant\"         date_created = \"2022-01-13\"         date_modified = \"2022-01-13\"         rev = 1     strings:         $s1 = \"auth-agent@openssh.com\"         $s2 = \"auth-%.8x-%d\"         $s3 = \"Child connection from %s:%s\"         $s4 = \"Compiled without normal mode, can't run without -i\"         $s5 = \"cancel-tcpip-forward\"         $s6 = \"dropbear_prng\"         $s7 = \"cron\"     condition:         uint32be(0) == 0x7F454C46 and filesize < 2MB and all of them } rule REGEORG_Tuneller_generic {     meta:         author = \"Mandiant\"         date_created = \"2021-12-20\"         date_modified = \"2021-12-20\"         md5 = \"ba22992ce835dadcd06bff4ab7b162f9\"     strings:         $s1 = \"System.Net.IPEndPoint\"         $s2 = \"Response.AddHeader\"         $s3 = \"Request.InputStream.Read\"         $s4 = \"Request.Headers.Get\"         $s5 = \"Response.Write\"         $s6 = \"System.Buffer.BlockCopy\"         $s7 = \"Response.BinaryWrite\"         $s8 = \"SocketException soex\"     condition:         filesize < 1MB and 7 of them } 9/9 rule UNC3524_sha1 {     meta:         author = \"Mandiant\"         date_created = \"2022-01-19\"         date_modified = \"2022-01-19\"    strings:         $h1 = { DD E5 D5 97 20 53 27 BF F0 A2 BA CD 96 35 9A AD 1C 75 EB 47 }     condition:         uint32be(0) == 0x7F454C46 and filesize < 10MB and all of them } Indicators MALWARE FAMILY Indicator QUIETEXIT Dynamic DNS cloudns.asia dynu.net mywire.org webredirect.org MALWARE FAMILY MD5 SHA1 SHA256 REGEORG GitHub version ba22992ce835dadcd06bff4ab7b162f9 3d4dcc859c6ca7e5b36483ad84c9ceef34973f9a 7b5e3c1c06d82b3e7309C258dfbd4bfcd' which indicates a potential connection between a technique and a capec.",
    "context": "ATT&CK Tactic Category Techniques Defense Evasion    T1027: Obfuscated Files or Information Discovery    T1012: Query Registry    T1016: System Network Configuration Discovery    T1049: System Network Connections Discovery    T1057: Process Discovery    T1518: Software Discovery 7/9 Credential Access    T1003.004: LSA Secrets    T1003.006: DCSync    T1111: Two-Factor Authentication Interception Collection    T1114: Email Collection    T1114.002: Remote Email Collection Lateral Movement    T1021.004: SSH Persistence    T1037.004: RC Scripts    T1098.001: Additional Cloud Credentials    T1505.003: Web Shell Command and Control    T1071: Application Layer Protocol    T1090.003: Multi-hop Proxy    T1095: Non-Application Layer Protocol    T1572: Protocol Tunneling    T1573.002: Asymmetric Cryptography Resource Development    T1583.003: Virtual Private Server    T1584: Compromise Infrastructure    T1608.003: Install Digital Certificate Execution    T1059.001: PowerShell    T1059.003: Windows Command Shell YARA Signatures Note: These rules are designed to broadly capture suspicious files and are not designed to detect a particular malware or threat. 8/9 rule QUIETEXIT_strings {     meta:         author = \"Mandiant\"         date_created = \"2022-01-13\"         date_modified = \"2022-01-13\"         rev = 1     strings:         $s1 = \"auth-agent@openssh.com\"         $s2 = \"auth-%.8x-%d\"         $s3 = \"Child connection from %s:%s\"         $s4 = \"Compiled without normal mode, can't run without -i\"         $s5 = \"cancel-tcpip-forward\"         $s6 = \"dropbear_prng\"         $s7 = \"cron\"     condition:         uint32be(0) == 0x7F454C46 and filesize < 2MB and all of them } rule REGEORG_Tuneller_generic {     meta:         author = \"Mandiant\"         date_created = \"2021-12-20\"         date_modified = \"2021-12-20\"         md5 = \"ba22992ce835dadcd06bff4ab7b162f9\"     strings:         $s1 = \"System.Net.IPEndPoint\"         $s2 = \"Response.AddHeader\"         $s3 = \"Request.InputStream.Read\"         $s4 = \"Request.Headers.Get\"         $s5 = \"Response.Write\"         $s6 = \"System.Buffer.BlockCopy\"         $s7 = \"Response.BinaryWrite\"         $s8 = \"SocketException soex\"     condition:         filesize < 1MB and 7 of them } 9/9 rule UNC3524_sha1 {     meta:         author = \"Mandiant\"         date_created = \"2022-01-19\"         date_modified = \"2022-01-19\"    strings:         $h1 = { DD E5 D5 97 20 53 27 BF F0 A2 BA CD 96 35 9A AD 1C 75 EB 47 }     condition:         uint32be(0) == 0x7F454C46 and filesize < 10MB and all of them } Indicators MALWARE FAMILY Indicator QUIETEXIT Dynamic DNS cloudns.asia dynu.net mywire.org webredirect.org MALWARE FAMILY MD5 SHA1 SHA256 REGEORG GitHub version ba22992ce835dadcd06bff4ab7b162f9 3d4dcc859c6ca7e5b36483ad84c9ceef34973f9a 7b5e3c1c06d82b3e7309C258dfbd4bfcd"
  },
  {
    "from": "T1027",
    "to": "CAPEC-117",
    "from_name": "Obfuscated Files or Information",
    "to_name": "Interception",
    "from_layer": "technique",
    "to_layer": "capec",
    "justification": "Both entities appear in the same sentence: 'ATT&CK Tactic Category Techniques Defense Evasion    T1027: Obfuscated Files or Information Discovery    T1012: Query Registry    T1016: System Network Configuration Discovery    T1049: System Network Connections Discovery    T1057: Process Discovery    T1518: Software Discovery 7/9 Credential Access    T1003.004: LSA Secrets    T1003.006: DCSync    T1111: Two-Factor Authentication Interception Collection    T1114: Email Collection    T1114.002: Remote Email Collection Lateral Movement    T1021.004: SSH Persistence    T1037.004: RC Scripts    T1098.001: Additional Cloud Credentials    T1505.003: Web Shell Command and Control    T1071: Application Layer Protocol    T1090.003: Multi-hop Proxy    T1095: Non-Application Layer Protocol    T1572: Protocol Tunneling    T1573.002: Asymmetric Cryptography Resource Development    T1583.003: Virtual Private Server    T1584: Compromise Infrastructure    T1608.003: Install Digital Certificate Execution    T1059.001: PowerShell    T1059.003: Windows Command Shell YARA Signatures Note: These rules are designed to broadly capture suspicious files and are not designed to detect a particular malware or threat. 8/9 rule QUIETEXIT_strings {     meta:         author = \"Mandiant\"         date_created = \"2022-01-13\"         date_modified = \"2022-01-13\"         rev = 1     strings:         $s1 = \"auth-agent@openssh.com\"         $s2 = \"auth-%.8x-%d\"         $s3 = \"Child connection from %s:%s\"         $s4 = \"Compiled without normal mode, can't run without -i\"         $s5 = \"cancel-tcpip-forward\"         $s6 = \"dropbear_prng\"         $s7 = \"cron\"     condition:         uint32be(0) == 0x7F454C46 and filesize < 2MB and all of them } rule REGEORG_Tuneller_generic {     meta:         author = \"Mandiant\"         date_created = \"2021-12-20\"         date_modified = \"2021-12-20\"         md5 = \"ba22992ce835dadcd06bff4ab7b162f9\"     strings:         $s1 = \"System.Net.IPEndPoint\"         $s2 = \"Response.AddHeader\"         $s3 = \"Request.InputStream.Read\"         $s4 = \"Request.Headers.Get\"         $s5 = \"Response.Write\"         $s6 = \"System.Buffer.BlockCopy\"         $s7 = \"Response.BinaryWrite\"         $s8 = \"SocketException soex\"     condition:         filesize < 1MB and 7 of them } 9/9 rule UNC3524_sha1 {     meta:         author = \"Mandiant\"         date_created = \"2022-01-19\"         date_modified = \"2022-01-19\"    strings:         $h1 = { DD E5 D5 97 20 53 27 BF F0 A2 BA CD 96 35 9A AD 1C 75 EB 47 }     condition:         uint32be(0) == 0x7F454C46 and filesize < 10MB and all of them } Indicators MALWARE FAMILY Indicator QUIETEXIT Dynamic DNS cloudns.asia dynu.net mywire.org webredirect.org MALWARE FAMILY MD5 SHA1 SHA256 REGEORG GitHub version ba22992ce835dadcd06bff4ab7b162f9 3d4dcc859c6ca7e5b36483ad84c9ceef34973f9a 7b5e3c1c06d82b3e7309C258dfbd4bfcd' which indicates a potential connection between a technique and a capec.",
    "context": "ATT&CK Tactic Category Techniques Defense Evasion    T1027: Obfuscated Files or Information Discovery    T1012: Query Registry    T1016: System Network Configuration Discovery    T1049: System Network Connections Discovery    T1057: Process Discovery    T1518: Software Discovery 7/9 Credential Access    T1003.004: LSA Secrets    T1003.006: DCSync    T1111: Two-Factor Authentication Interception Collection    T1114: Email Collection    T1114.002: Remote Email Collection Lateral Movement    T1021.004: SSH Persistence    T1037.004: RC Scripts    T1098.001: Additional Cloud Credentials    T1505.003: Web Shell Command and Control    T1071: Application Layer Protocol    T1090.003: Multi-hop Proxy    T1095: Non-Application Layer Protocol    T1572: Protocol Tunneling    T1573.002: Asymmetric Cryptography Resource Development    T1583.003: Virtual Private Server    T1584: Compromise Infrastructure    T1608.003: Install Digital Certificate Execution    T1059.001: PowerShell    T1059.003: Windows Command Shell YARA Signatures Note: These rules are designed to broadly capture suspicious files and are not designed to detect a particular malware or threat. 8/9 rule QUIETEXIT_strings {     meta:         author = \"Mandiant\"         date_created = \"2022-01-13\"         date_modified = \"2022-01-13\"         rev = 1     strings:         $s1 = \"auth-agent@openssh.com\"         $s2 = \"auth-%.8x-%d\"         $s3 = \"Child connection from %s:%s\"         $s4 = \"Compiled without normal mode, can't run without -i\"         $s5 = \"cancel-tcpip-forward\"         $s6 = \"dropbear_prng\"         $s7 = \"cron\"     condition:         uint32be(0) == 0x7F454C46 and filesize < 2MB and all of them } rule REGEORG_Tuneller_generic {     meta:         author = \"Mandiant\"         date_created = \"2021-12-20\"         date_modified = \"2021-12-20\"         md5 = \"ba22992ce835dadcd06bff4ab7b162f9\"     strings:         $s1 = \"System.Net.IPEndPoint\"         $s2 = \"Response.AddHeader\"         $s3 = \"Request.InputStream.Read\"         $s4 = \"Request.Headers.Get\"         $s5 = \"Response.Write\"         $s6 = \"System.Buffer.BlockCopy\"         $s7 = \"Response.BinaryWrite\"         $s8 = \"SocketException soex\"     condition:         filesize < 1MB and 7 of them } 9/9 rule UNC3524_sha1 {     meta:         author = \"Mandiant\"         date_created = \"2022-01-19\"         date_modified = \"2022-01-19\"    strings:         $h1 = { DD E5 D5 97 20 53 27 BF F0 A2 BA CD 96 35 9A AD 1C 75 EB 47 }     condition:         uint32be(0) == 0x7F454C46 and filesize < 10MB and all of them } Indicators MALWARE FAMILY Indicator QUIETEXIT Dynamic DNS cloudns.asia dynu.net mywire.org webredirect.org MALWARE FAMILY MD5 SHA1 SHA256 REGEORG GitHub version ba22992ce835dadcd06bff4ab7b162f9 3d4dcc859c6ca7e5b36483ad84c9ceef34973f9a 7b5e3c1c06d82b3e7309C258dfbd4bfcd"
  },
  {
    "from": "T1059.001",
    "to": "CAPEC-117",
    "from_name": "PowerShell",
    "to_name": "Interception",
    "from_layer": "technique",
    "to_layer": "capec",
    "justification": "Both entities appear in the same sentence: 'ATT&CK Tactic Category Techniques Defense Evasion    T1027: Obfuscated Files or Information Discovery    T1012: Query Registry    T1016: System Network Configuration Discovery    T1049: System Network Connections Discovery    T1057: Process Discovery    T1518: Software Discovery 7/9 Credential Access    T1003.004: LSA Secrets    T1003.006: DCSync    T1111: Two-Factor Authentication Interception Collection    T1114: Email Collection    T1114.002: Remote Email Collection Lateral Movement    T1021.004: SSH Persistence    T1037.004: RC Scripts    T1098.001: Additional Cloud Credentials    T1505.003: Web Shell Command and Control    T1071: Application Layer Protocol    T1090.003: Multi-hop Proxy    T1095: Non-Application Layer Protocol    T1572: Protocol Tunneling    T1573.002: Asymmetric Cryptography Resource Development    T1583.003: Virtual Private Server    T1584: Compromise Infrastructure    T1608.003: Install Digital Certificate Execution    T1059.001: PowerShell    T1059.003: Windows Command Shell YARA Signatures Note: These rules are designed to broadly capture suspicious files and are not designed to detect a particular malware or threat. 8/9 rule QUIETEXIT_strings {     meta:         author = \"Mandiant\"         date_created = \"2022-01-13\"         date_modified = \"2022-01-13\"         rev = 1     strings:         $s1 = \"auth-agent@openssh.com\"         $s2 = \"auth-%.8x-%d\"         $s3 = \"Child connection from %s:%s\"         $s4 = \"Compiled without normal mode, can't run without -i\"         $s5 = \"cancel-tcpip-forward\"         $s6 = \"dropbear_prng\"         $s7 = \"cron\"     condition:         uint32be(0) == 0x7F454C46 and filesize < 2MB and all of them } rule REGEORG_Tuneller_generic {     meta:         author = \"Mandiant\"         date_created = \"2021-12-20\"         date_modified = \"2021-12-20\"         md5 = \"ba22992ce835dadcd06bff4ab7b162f9\"     strings:         $s1 = \"System.Net.IPEndPoint\"         $s2 = \"Response.AddHeader\"         $s3 = \"Request.InputStream.Read\"         $s4 = \"Request.Headers.Get\"         $s5 = \"Response.Write\"         $s6 = \"System.Buffer.BlockCopy\"         $s7 = \"Response.BinaryWrite\"         $s8 = \"SocketException soex\"     condition:         filesize < 1MB and 7 of them } 9/9 rule UNC3524_sha1 {     meta:         author = \"Mandiant\"         date_created = \"2022-01-19\"         date_modified = \"2022-01-19\"    strings:         $h1 = { DD E5 D5 97 20 53 27 BF F0 A2 BA CD 96 35 9A AD 1C 75 EB 47 }     condition:         uint32be(0) == 0x7F454C46 and filesize < 10MB and all of them } Indicators MALWARE FAMILY Indicator QUIETEXIT Dynamic DNS cloudns.asia dynu.net mywire.org webredirect.org MALWARE FAMILY MD5 SHA1 SHA256 REGEORG GitHub version ba22992ce835dadcd06bff4ab7b162f9 3d4dcc859c6ca7e5b36483ad84c9ceef34973f9a 7b5e3c1c06d82b3e7309C258dfbd4bfcd' which indicates a potential connection between a technique and a capec.",
    "context": "ATT&CK Tactic Category Techniques Defense Evasion    T1027: Obfuscated Files or Information Discovery    T1012: Query Registry    T1016: System Network Configuration Discovery    T1049: System Network Connections Discovery    T1057: Process Discovery    T1518: Software Discovery 7/9 Credential Access    T1003.004: LSA Secrets    T1003.006: DCSync    T1111: Two-Factor Authentication Interception Collection    T1114: Email Collection    T1114.002: Remote Email Collection Lateral Movement    T1021.004: SSH Persistence    T1037.004: RC Scripts    T1098.001: Additional Cloud Credentials    T1505.003: Web Shell Command and Control    T1071: Application Layer Protocol    T1090.003: Multi-hop Proxy    T1095: Non-Application Layer Protocol    T1572: Protocol Tunneling    T1573.002: Asymmetric Cryptography Resource Development    T1583.003: Virtual Private Server    T1584: Compromise Infrastructure    T1608.003: Install Digital Certificate Execution    T1059.001: PowerShell    T1059.003: Windows Command Shell YARA Signatures Note: These rules are designed to broadly capture suspicious files and are not designed to detect a particular malware or threat. 8/9 rule QUIETEXIT_strings {     meta:         author = \"Mandiant\"         date_created = \"2022-01-13\"         date_modified = \"2022-01-13\"         rev = 1     strings:         $s1 = \"auth-agent@openssh.com\"         $s2 = \"auth-%.8x-%d\"         $s3 = \"Child connection from %s:%s\"         $s4 = \"Compiled without normal mode, can't run without -i\"         $s5 = \"cancel-tcpip-forward\"         $s6 = \"dropbear_prng\"         $s7 = \"cron\"     condition:         uint32be(0) == 0x7F454C46 and filesize < 2MB and all of them } rule REGEORG_Tuneller_generic {     meta:         author = \"Mandiant\"         date_created = \"2021-12-20\"         date_modified = \"2021-12-20\"         md5 = \"ba22992ce835dadcd06bff4ab7b162f9\"     strings:         $s1 = \"System.Net.IPEndPoint\"         $s2 = \"Response.AddHeader\"         $s3 = \"Request.InputStream.Read\"         $s4 = \"Request.Headers.Get\"         $s5 = \"Response.Write\"         $s6 = \"System.Buffer.BlockCopy\"         $s7 = \"Response.BinaryWrite\"         $s8 = \"SocketException soex\"     condition:         filesize < 1MB and 7 of them } 9/9 rule UNC3524_sha1 {     meta:         author = \"Mandiant\"         date_created = \"2022-01-19\"         date_modified = \"2022-01-19\"    strings:         $h1 = { DD E5 D5 97 20 53 27 BF F0 A2 BA CD 96 35 9A AD 1C 75 EB 47 }     condition:         uint32be(0) == 0x7F454C46 and filesize < 10MB and all of them } Indicators MALWARE FAMILY Indicator QUIETEXIT Dynamic DNS cloudns.asia dynu.net mywire.org webredirect.org MALWARE FAMILY MD5 SHA1 SHA256 REGEORG GitHub version ba22992ce835dadcd06bff4ab7b162f9 3d4dcc859c6ca7e5b36483ad84c9ceef34973f9a 7b5e3c1c06d82b3e7309C258dfbd4bfcd"
  },
  {
    "from": "T1057",
    "to": "CAPEC-117",
    "from_name": "Process Discovery",
    "to_name": "Interception",
    "from_layer": "technique",
    "to_layer": "capec",
    "justification": "Both entities appear in the same sentence: 'ATT&CK Tactic Category Techniques Defense Evasion    T1027: Obfuscated Files or Information Discovery    T1012: Query Registry    T1016: System Network Configuration Discovery    T1049: System Network Connections Discovery    T1057: Process Discovery    T1518: Software Discovery 7/9 Credential Access    T1003.004: LSA Secrets    T1003.006: DCSync    T1111: Two-Factor Authentication Interception Collection    T1114: Email Collection    T1114.002: Remote Email Collection Lateral Movement    T1021.004: SSH Persistence    T1037.004: RC Scripts    T1098.001: Additional Cloud Credentials    T1505.003: Web Shell Command and Control    T1071: Application Layer Protocol    T1090.003: Multi-hop Proxy    T1095: Non-Application Layer Protocol    T1572: Protocol Tunneling    T1573.002: Asymmetric Cryptography Resource Development    T1583.003: Virtual Private Server    T1584: Compromise Infrastructure    T1608.003: Install Digital Certificate Execution    T1059.001: PowerShell    T1059.003: Windows Command Shell YARA Signatures Note: These rules are designed to broadly capture suspicious files and are not designed to detect a particular malware or threat. 8/9 rule QUIETEXIT_strings {     meta:         author = \"Mandiant\"         date_created = \"2022-01-13\"         date_modified = \"2022-01-13\"         rev = 1     strings:         $s1 = \"auth-agent@openssh.com\"         $s2 = \"auth-%.8x-%d\"         $s3 = \"Child connection from %s:%s\"         $s4 = \"Compiled without normal mode, can't run without -i\"         $s5 = \"cancel-tcpip-forward\"         $s6 = \"dropbear_prng\"         $s7 = \"cron\"     condition:         uint32be(0) == 0x7F454C46 and filesize < 2MB and all of them } rule REGEORG_Tuneller_generic {     meta:         author = \"Mandiant\"         date_created = \"2021-12-20\"         date_modified = \"2021-12-20\"         md5 = \"ba22992ce835dadcd06bff4ab7b162f9\"     strings:         $s1 = \"System.Net.IPEndPoint\"         $s2 = \"Response.AddHeader\"         $s3 = \"Request.InputStream.Read\"         $s4 = \"Request.Headers.Get\"         $s5 = \"Response.Write\"         $s6 = \"System.Buffer.BlockCopy\"         $s7 = \"Response.BinaryWrite\"         $s8 = \"SocketException soex\"     condition:         filesize < 1MB and 7 of them } 9/9 rule UNC3524_sha1 {     meta:         author = \"Mandiant\"         date_created = \"2022-01-19\"         date_modified = \"2022-01-19\"    strings:         $h1 = { DD E5 D5 97 20 53 27 BF F0 A2 BA CD 96 35 9A AD 1C 75 EB 47 }     condition:         uint32be(0) == 0x7F454C46 and filesize < 10MB and all of them } Indicators MALWARE FAMILY Indicator QUIETEXIT Dynamic DNS cloudns.asia dynu.net mywire.org webredirect.org MALWARE FAMILY MD5 SHA1 SHA256 REGEORG GitHub version ba22992ce835dadcd06bff4ab7b162f9 3d4dcc859c6ca7e5b36483ad84c9ceef34973f9a 7b5e3c1c06d82b3e7309C258dfbd4bfcd' which indicates a potential connection between a technique and a capec.",
    "context": "ATT&CK Tactic Category Techniques Defense Evasion    T1027: Obfuscated Files or Information Discovery    T1012: Query Registry    T1016: System Network Configuration Discovery    T1049: System Network Connections Discovery    T1057: Process Discovery    T1518: Software Discovery 7/9 Credential Access    T1003.004: LSA Secrets    T1003.006: DCSync    T1111: Two-Factor Authentication Interception Collection    T1114: Email Collection    T1114.002: Remote Email Collection Lateral Movement    T1021.004: SSH Persistence    T1037.004: RC Scripts    T1098.001: Additional Cloud Credentials    T1505.003: Web Shell Command and Control    T1071: Application Layer Protocol    T1090.003: Multi-hop Proxy    T1095: Non-Application Layer Protocol    T1572: Protocol Tunneling    T1573.002: Asymmetric Cryptography Resource Development    T1583.003: Virtual Private Server    T1584: Compromise Infrastructure    T1608.003: Install Digital Certificate Execution    T1059.001: PowerShell    T1059.003: Windows Command Shell YARA Signatures Note: These rules are designed to broadly capture suspicious files and are not designed to detect a particular malware or threat. 8/9 rule QUIETEXIT_strings {     meta:         author = \"Mandiant\"         date_created = \"2022-01-13\"         date_modified = \"2022-01-13\"         rev = 1     strings:         $s1 = \"auth-agent@openssh.com\"         $s2 = \"auth-%.8x-%d\"         $s3 = \"Child connection from %s:%s\"         $s4 = \"Compiled without normal mode, can't run without -i\"         $s5 = \"cancel-tcpip-forward\"         $s6 = \"dropbear_prng\"         $s7 = \"cron\"     condition:         uint32be(0) == 0x7F454C46 and filesize < 2MB and all of them } rule REGEORG_Tuneller_generic {     meta:         author = \"Mandiant\"         date_created = \"2021-12-20\"         date_modified = \"2021-12-20\"         md5 = \"ba22992ce835dadcd06bff4ab7b162f9\"     strings:         $s1 = \"System.Net.IPEndPoint\"         $s2 = \"Response.AddHeader\"         $s3 = \"Request.InputStream.Read\"         $s4 = \"Request.Headers.Get\"         $s5 = \"Response.Write\"         $s6 = \"System.Buffer.BlockCopy\"         $s7 = \"Response.BinaryWrite\"         $s8 = \"SocketException soex\"     condition:         filesize < 1MB and 7 of them } 9/9 rule UNC3524_sha1 {     meta:         author = \"Mandiant\"         date_created = \"2022-01-19\"         date_modified = \"2022-01-19\"    strings:         $h1 = { DD E5 D5 97 20 53 27 BF F0 A2 BA CD 96 35 9A AD 1C 75 EB 47 }     condition:         uint32be(0) == 0x7F454C46 and filesize < 10MB and all of them } Indicators MALWARE FAMILY Indicator QUIETEXIT Dynamic DNS cloudns.asia dynu.net mywire.org webredirect.org MALWARE FAMILY MD5 SHA1 SHA256 REGEORG GitHub version ba22992ce835dadcd06bff4ab7b162f9 3d4dcc859c6ca7e5b36483ad84c9ceef34973f9a 7b5e3c1c06d82b3e7309C258dfbd4bfcd"
  },
  {
    "from": "T1572",
    "to": "CAPEC-117",
    "from_name": "Protocol Tunneling",
    "to_name": "Interception",
    "from_layer": "technique",
    "to_layer": "capec",
    "justification": "Both entities appear in the same sentence: 'ATT&CK Tactic Category Techniques Defense Evasion    T1027: Obfuscated Files or Information Discovery    T1012: Query Registry    T1016: System Network Configuration Discovery    T1049: System Network Connections Discovery    T1057: Process Discovery    T1518: Software Discovery 7/9 Credential Access    T1003.004: LSA Secrets    T1003.006: DCSync    T1111: Two-Factor Authentication Interception Collection    T1114: Email Collection    T1114.002: Remote Email Collection Lateral Movement    T1021.004: SSH Persistence    T1037.004: RC Scripts    T1098.001: Additional Cloud Credentials    T1505.003: Web Shell Command and Control    T1071: Application Layer Protocol    T1090.003: Multi-hop Proxy    T1095: Non-Application Layer Protocol    T1572: Protocol Tunneling    T1573.002: Asymmetric Cryptography Resource Development    T1583.003: Virtual Private Server    T1584: Compromise Infrastructure    T1608.003: Install Digital Certificate Execution    T1059.001: PowerShell    T1059.003: Windows Command Shell YARA Signatures Note: These rules are designed to broadly capture suspicious files and are not designed to detect a particular malware or threat. 8/9 rule QUIETEXIT_strings {     meta:         author = \"Mandiant\"         date_created = \"2022-01-13\"         date_modified = \"2022-01-13\"         rev = 1     strings:         $s1 = \"auth-agent@openssh.com\"         $s2 = \"auth-%.8x-%d\"         $s3 = \"Child connection from %s:%s\"         $s4 = \"Compiled without normal mode, can't run without -i\"         $s5 = \"cancel-tcpip-forward\"         $s6 = \"dropbear_prng\"         $s7 = \"cron\"     condition:         uint32be(0) == 0x7F454C46 and filesize < 2MB and all of them } rule REGEORG_Tuneller_generic {     meta:         author = \"Mandiant\"         date_created = \"2021-12-20\"         date_modified = \"2021-12-20\"         md5 = \"ba22992ce835dadcd06bff4ab7b162f9\"     strings:         $s1 = \"System.Net.IPEndPoint\"         $s2 = \"Response.AddHeader\"         $s3 = \"Request.InputStream.Read\"         $s4 = \"Request.Headers.Get\"         $s5 = \"Response.Write\"         $s6 = \"System.Buffer.BlockCopy\"         $s7 = \"Response.BinaryWrite\"         $s8 = \"SocketException soex\"     condition:         filesize < 1MB and 7 of them } 9/9 rule UNC3524_sha1 {     meta:         author = \"Mandiant\"         date_created = \"2022-01-19\"         date_modified = \"2022-01-19\"    strings:         $h1 = { DD E5 D5 97 20 53 27 BF F0 A2 BA CD 96 35 9A AD 1C 75 EB 47 }     condition:         uint32be(0) == 0x7F454C46 and filesize < 10MB and all of them } Indicators MALWARE FAMILY Indicator QUIETEXIT Dynamic DNS cloudns.asia dynu.net mywire.org webredirect.org MALWARE FAMILY MD5 SHA1 SHA256 REGEORG GitHub version ba22992ce835dadcd06bff4ab7b162f9 3d4dcc859c6ca7e5b36483ad84c9ceef34973f9a 7b5e3c1c06d82b3e7309C258dfbd4bfcd' which indicates a potential connection between a technique and a capec.",
    "context": "ATT&CK Tactic Category Techniques Defense Evasion    T1027: Obfuscated Files or Information Discovery    T1012: Query Registry    T1016: System Network Configuration Discovery    T1049: System Network Connections Discovery    T1057: Process Discovery    T1518: Software Discovery 7/9 Credential Access    T1003.004: LSA Secrets    T1003.006: DCSync    T1111: Two-Factor Authentication Interception Collection    T1114: Email Collection    T1114.002: Remote Email Collection Lateral Movement    T1021.004: SSH Persistence    T1037.004: RC Scripts    T1098.001: Additional Cloud Credentials    T1505.003: Web Shell Command and Control    T1071: Application Layer Protocol    T1090.003: Multi-hop Proxy    T1095: Non-Application Layer Protocol    T1572: Protocol Tunneling    T1573.002: Asymmetric Cryptography Resource Development    T1583.003: Virtual Private Server    T1584: Compromise Infrastructure    T1608.003: Install Digital Certificate Execution    T1059.001: PowerShell    T1059.003: Windows Command Shell YARA Signatures Note: These rules are designed to broadly capture suspicious files and are not designed to detect a particular malware or threat. 8/9 rule QUIETEXIT_strings {     meta:         author = \"Mandiant\"         date_created = \"2022-01-13\"         date_modified = \"2022-01-13\"         rev = 1     strings:         $s1 = \"auth-agent@openssh.com\"         $s2 = \"auth-%.8x-%d\"         $s3 = \"Child connection from %s:%s\"         $s4 = \"Compiled without normal mode, can't run without -i\"         $s5 = \"cancel-tcpip-forward\"         $s6 = \"dropbear_prng\"         $s7 = \"cron\"     condition:         uint32be(0) == 0x7F454C46 and filesize < 2MB and all of them } rule REGEORG_Tuneller_generic {     meta:         author = \"Mandiant\"         date_created = \"2021-12-20\"         date_modified = \"2021-12-20\"         md5 = \"ba22992ce835dadcd06bff4ab7b162f9\"     strings:         $s1 = \"System.Net.IPEndPoint\"         $s2 = \"Response.AddHeader\"         $s3 = \"Request.InputStream.Read\"         $s4 = \"Request.Headers.Get\"         $s5 = \"Response.Write\"         $s6 = \"System.Buffer.BlockCopy\"         $s7 = \"Response.BinaryWrite\"         $s8 = \"SocketException soex\"     condition:         filesize < 1MB and 7 of them } 9/9 rule UNC3524_sha1 {     meta:         author = \"Mandiant\"         date_created = \"2022-01-19\"         date_modified = \"2022-01-19\"    strings:         $h1 = { DD E5 D5 97 20 53 27 BF F0 A2 BA CD 96 35 9A AD 1C 75 EB 47 }     condition:         uint32be(0) == 0x7F454C46 and filesize < 10MB and all of them } Indicators MALWARE FAMILY Indicator QUIETEXIT Dynamic DNS cloudns.asia dynu.net mywire.org webredirect.org MALWARE FAMILY MD5 SHA1 SHA256 REGEORG GitHub version ba22992ce835dadcd06bff4ab7b162f9 3d4dcc859c6ca7e5b36483ad84c9ceef34973f9a 7b5e3c1c06d82b3e7309C258dfbd4bfcd"
  },
  {
    "from": "T1012",
    "to": "CAPEC-117",
    "from_name": "Query Registry",
    "to_name": "Interception",
    "from_layer": "technique",
    "to_layer": "capec",
    "justification": "Both entities appear in the same sentence: 'ATT&CK Tactic Category Techniques Defense Evasion    T1027: Obfuscated Files or Information Discovery    T1012: Query Registry    T1016: System Network Configuration Discovery    T1049: System Network Connections Discovery    T1057: Process Discovery    T1518: Software Discovery 7/9 Credential Access    T1003.004: LSA Secrets    T1003.006: DCSync    T1111: Two-Factor Authentication Interception Collection    T1114: Email Collection    T1114.002: Remote Email Collection Lateral Movement    T1021.004: SSH Persistence    T1037.004: RC Scripts    T1098.001: Additional Cloud Credentials    T1505.003: Web Shell Command and Control    T1071: Application Layer Protocol    T1090.003: Multi-hop Proxy    T1095: Non-Application Layer Protocol    T1572: Protocol Tunneling    T1573.002: Asymmetric Cryptography Resource Development    T1583.003: Virtual Private Server    T1584: Compromise Infrastructure    T1608.003: Install Digital Certificate Execution    T1059.001: PowerShell    T1059.003: Windows Command Shell YARA Signatures Note: These rules are designed to broadly capture suspicious files and are not designed to detect a particular malware or threat. 8/9 rule QUIETEXIT_strings {     meta:         author = \"Mandiant\"         date_created = \"2022-01-13\"         date_modified = \"2022-01-13\"         rev = 1     strings:         $s1 = \"auth-agent@openssh.com\"         $s2 = \"auth-%.8x-%d\"         $s3 = \"Child connection from %s:%s\"         $s4 = \"Compiled without normal mode, can't run without -i\"         $s5 = \"cancel-tcpip-forward\"         $s6 = \"dropbear_prng\"         $s7 = \"cron\"     condition:         uint32be(0) == 0x7F454C46 and filesize < 2MB and all of them } rule REGEORG_Tuneller_generic {     meta:         author = \"Mandiant\"         date_created = \"2021-12-20\"         date_modified = \"2021-12-20\"         md5 = \"ba22992ce835dadcd06bff4ab7b162f9\"     strings:         $s1 = \"System.Net.IPEndPoint\"         $s2 = \"Response.AddHeader\"         $s3 = \"Request.InputStream.Read\"         $s4 = \"Request.Headers.Get\"         $s5 = \"Response.Write\"         $s6 = \"System.Buffer.BlockCopy\"         $s7 = \"Response.BinaryWrite\"         $s8 = \"SocketException soex\"     condition:         filesize < 1MB and 7 of them } 9/9 rule UNC3524_sha1 {     meta:         author = \"Mandiant\"         date_created = \"2022-01-19\"         date_modified = \"2022-01-19\"    strings:         $h1 = { DD E5 D5 97 20 53 27 BF F0 A2 BA CD 96 35 9A AD 1C 75 EB 47 }     condition:         uint32be(0) == 0x7F454C46 and filesize < 10MB and all of them } Indicators MALWARE FAMILY Indicator QUIETEXIT Dynamic DNS cloudns.asia dynu.net mywire.org webredirect.org MALWARE FAMILY MD5 SHA1 SHA256 REGEORG GitHub version ba22992ce835dadcd06bff4ab7b162f9 3d4dcc859c6ca7e5b36483ad84c9ceef34973f9a 7b5e3c1c06d82b3e7309C258dfbd4bfcd' which indicates a potential connection between a technique and a capec.",
    "context": "ATT&CK Tactic Category Techniques Defense Evasion    T1027: Obfuscated Files or Information Discovery    T1012: Query Registry    T1016: System Network Configuration Discovery    T1049: System Network Connections Discovery    T1057: Process Discovery    T1518: Software Discovery 7/9 Credential Access    T1003.004: LSA Secrets    T1003.006: DCSync    T1111: Two-Factor Authentication Interception Collection    T1114: Email Collection    T1114.002: Remote Email Collection Lateral Movement    T1021.004: SSH Persistence    T1037.004: RC Scripts    T1098.001: Additional Cloud Credentials    T1505.003: Web Shell Command and Control    T1071: Application Layer Protocol    T1090.003: Multi-hop Proxy    T1095: Non-Application Layer Protocol    T1572: Protocol Tunneling    T1573.002: Asymmetric Cryptography Resource Development    T1583.003: Virtual Private Server    T1584: Compromise Infrastructure    T1608.003: Install Digital Certificate Execution    T1059.001: PowerShell    T1059.003: Windows Command Shell YARA Signatures Note: These rules are designed to broadly capture suspicious files and are not designed to detect a particular malware or threat. 8/9 rule QUIETEXIT_strings {     meta:         author = \"Mandiant\"         date_created = \"2022-01-13\"         date_modified = \"2022-01-13\"         rev = 1     strings:         $s1 = \"auth-agent@openssh.com\"         $s2 = \"auth-%.8x-%d\"         $s3 = \"Child connection from %s:%s\"         $s4 = \"Compiled without normal mode, can't run without -i\"         $s5 = \"cancel-tcpip-forward\"         $s6 = \"dropbear_prng\"         $s7 = \"cron\"     condition:         uint32be(0) == 0x7F454C46 and filesize < 2MB and all of them } rule REGEORG_Tuneller_generic {     meta:         author = \"Mandiant\"         date_created = \"2021-12-20\"         date_modified = \"2021-12-20\"         md5 = \"ba22992ce835dadcd06bff4ab7b162f9\"     strings:         $s1 = \"System.Net.IPEndPoint\"         $s2 = \"Response.AddHeader\"         $s3 = \"Request.InputStream.Read\"         $s4 = \"Request.Headers.Get\"         $s5 = \"Response.Write\"         $s6 = \"System.Buffer.BlockCopy\"         $s7 = \"Response.BinaryWrite\"         $s8 = \"SocketException soex\"     condition:         filesize < 1MB and 7 of them } 9/9 rule UNC3524_sha1 {     meta:         author = \"Mandiant\"         date_created = \"2022-01-19\"         date_modified = \"2022-01-19\"    strings:         $h1 = { DD E5 D5 97 20 53 27 BF F0 A2 BA CD 96 35 9A AD 1C 75 EB 47 }     condition:         uint32be(0) == 0x7F454C46 and filesize < 10MB and all of them } Indicators MALWARE FAMILY Indicator QUIETEXIT Dynamic DNS cloudns.asia dynu.net mywire.org webredirect.org MALWARE FAMILY MD5 SHA1 SHA256 REGEORG GitHub version ba22992ce835dadcd06bff4ab7b162f9 3d4dcc859c6ca7e5b36483ad84c9ceef34973f9a 7b5e3c1c06d82b3e7309C258dfbd4bfcd"
  },
  {
    "from": "T1037.004",
    "to": "CAPEC-117",
    "from_name": "RC Scripts",
    "to_name": "Interception",
    "from_layer": "technique",
    "to_layer": "capec",
    "justification": "Both entities appear in the same sentence: 'ATT&CK Tactic Category Techniques Defense Evasion    T1027: Obfuscated Files or Information Discovery    T1012: Query Registry    T1016: System Network Configuration Discovery    T1049: System Network Connections Discovery    T1057: Process Discovery    T1518: Software Discovery 7/9 Credential Access    T1003.004: LSA Secrets    T1003.006: DCSync    T1111: Two-Factor Authentication Interception Collection    T1114: Email Collection    T1114.002: Remote Email Collection Lateral Movement    T1021.004: SSH Persistence    T1037.004: RC Scripts    T1098.001: Additional Cloud Credentials    T1505.003: Web Shell Command and Control    T1071: Application Layer Protocol    T1090.003: Multi-hop Proxy    T1095: Non-Application Layer Protocol    T1572: Protocol Tunneling    T1573.002: Asymmetric Cryptography Resource Development    T1583.003: Virtual Private Server    T1584: Compromise Infrastructure    T1608.003: Install Digital Certificate Execution    T1059.001: PowerShell    T1059.003: Windows Command Shell YARA Signatures Note: These rules are designed to broadly capture suspicious files and are not designed to detect a particular malware or threat. 8/9 rule QUIETEXIT_strings {     meta:         author = \"Mandiant\"         date_created = \"2022-01-13\"         date_modified = \"2022-01-13\"         rev = 1     strings:         $s1 = \"auth-agent@openssh.com\"         $s2 = \"auth-%.8x-%d\"         $s3 = \"Child connection from %s:%s\"         $s4 = \"Compiled without normal mode, can't run without -i\"         $s5 = \"cancel-tcpip-forward\"         $s6 = \"dropbear_prng\"         $s7 = \"cron\"     condition:         uint32be(0) == 0x7F454C46 and filesize < 2MB and all of them } rule REGEORG_Tuneller_generic {     meta:         author = \"Mandiant\"         date_created = \"2021-12-20\"         date_modified = \"2021-12-20\"         md5 = \"ba22992ce835dadcd06bff4ab7b162f9\"     strings:         $s1 = \"System.Net.IPEndPoint\"         $s2 = \"Response.AddHeader\"         $s3 = \"Request.InputStream.Read\"         $s4 = \"Request.Headers.Get\"         $s5 = \"Response.Write\"         $s6 = \"System.Buffer.BlockCopy\"         $s7 = \"Response.BinaryWrite\"         $s8 = \"SocketException soex\"     condition:         filesize < 1MB and 7 of them } 9/9 rule UNC3524_sha1 {     meta:         author = \"Mandiant\"         date_created = \"2022-01-19\"         date_modified = \"2022-01-19\"    strings:         $h1 = { DD E5 D5 97 20 53 27 BF F0 A2 BA CD 96 35 9A AD 1C 75 EB 47 }     condition:         uint32be(0) == 0x7F454C46 and filesize < 10MB and all of them } Indicators MALWARE FAMILY Indicator QUIETEXIT Dynamic DNS cloudns.asia dynu.net mywire.org webredirect.org MALWARE FAMILY MD5 SHA1 SHA256 REGEORG GitHub version ba22992ce835dadcd06bff4ab7b162f9 3d4dcc859c6ca7e5b36483ad84c9ceef34973f9a 7b5e3c1c06d82b3e7309C258dfbd4bfcd' which indicates a potential connection between a technique and a capec.",
    "context": "ATT&CK Tactic Category Techniques Defense Evasion    T1027: Obfuscated Files or Information Discovery    T1012: Query Registry    T1016: System Network Configuration Discovery    T1049: System Network Connections Discovery    T1057: Process Discovery    T1518: Software Discovery 7/9 Credential Access    T1003.004: LSA Secrets    T1003.006: DCSync    T1111: Two-Factor Authentication Interception Collection    T1114: Email Collection    T1114.002: Remote Email Collection Lateral Movement    T1021.004: SSH Persistence    T1037.004: RC Scripts    T1098.001: Additional Cloud Credentials    T1505.003: Web Shell Command and Control    T1071: Application Layer Protocol    T1090.003: Multi-hop Proxy    T1095: Non-Application Layer Protocol    T1572: Protocol Tunneling    T1573.002: Asymmetric Cryptography Resource Development    T1583.003: Virtual Private Server    T1584: Compromise Infrastructure    T1608.003: Install Digital Certificate Execution    T1059.001: PowerShell    T1059.003: Windows Command Shell YARA Signatures Note: These rules are designed to broadly capture suspicious files and are not designed to detect a particular malware or threat. 8/9 rule QUIETEXIT_strings {     meta:         author = \"Mandiant\"         date_created = \"2022-01-13\"         date_modified = \"2022-01-13\"         rev = 1     strings:         $s1 = \"auth-agent@openssh.com\"         $s2 = \"auth-%.8x-%d\"         $s3 = \"Child connection from %s:%s\"         $s4 = \"Compiled without normal mode, can't run without -i\"         $s5 = \"cancel-tcpip-forward\"         $s6 = \"dropbear_prng\"         $s7 = \"cron\"     condition:         uint32be(0) == 0x7F454C46 and filesize < 2MB and all of them } rule REGEORG_Tuneller_generic {     meta:         author = \"Mandiant\"         date_created = \"2021-12-20\"         date_modified = \"2021-12-20\"         md5 = \"ba22992ce835dadcd06bff4ab7b162f9\"     strings:         $s1 = \"System.Net.IPEndPoint\"         $s2 = \"Response.AddHeader\"         $s3 = \"Request.InputStream.Read\"         $s4 = \"Request.Headers.Get\"         $s5 = \"Response.Write\"         $s6 = \"System.Buffer.BlockCopy\"         $s7 = \"Response.BinaryWrite\"         $s8 = \"SocketException soex\"     condition:         filesize < 1MB and 7 of them } 9/9 rule UNC3524_sha1 {     meta:         author = \"Mandiant\"         date_created = \"2022-01-19\"         date_modified = \"2022-01-19\"    strings:         $h1 = { DD E5 D5 97 20 53 27 BF F0 A2 BA CD 96 35 9A AD 1C 75 EB 47 }     condition:         uint32be(0) == 0x7F454C46 and filesize < 10MB and all of them } Indicators MALWARE FAMILY Indicator QUIETEXIT Dynamic DNS cloudns.asia dynu.net mywire.org webredirect.org MALWARE FAMILY MD5 SHA1 SHA256 REGEORG GitHub version ba22992ce835dadcd06bff4ab7b162f9 3d4dcc859c6ca7e5b36483ad84c9ceef34973f9a 7b5e3c1c06d82b3e7309C258dfbd4bfcd"
  },
  {
    "from": "T1114.002",
    "to": "CAPEC-117",
    "from_name": "Remote Email Collection",
    "to_name": "Interception",
    "from_layer": "technique",
    "to_layer": "capec",
    "justification": "Both entities appear in the same sentence: 'ATT&CK Tactic Category Techniques Defense Evasion    T1027: Obfuscated Files or Information Discovery    T1012: Query Registry    T1016: System Network Configuration Discovery    T1049: System Network Connections Discovery    T1057: Process Discovery    T1518: Software Discovery 7/9 Credential Access    T1003.004: LSA Secrets    T1003.006: DCSync    T1111: Two-Factor Authentication Interception Collection    T1114: Email Collection    T1114.002: Remote Email Collection Lateral Movement    T1021.004: SSH Persistence    T1037.004: RC Scripts    T1098.001: Additional Cloud Credentials    T1505.003: Web Shell Command and Control    T1071: Application Layer Protocol    T1090.003: Multi-hop Proxy    T1095: Non-Application Layer Protocol    T1572: Protocol Tunneling    T1573.002: Asymmetric Cryptography Resource Development    T1583.003: Virtual Private Server    T1584: Compromise Infrastructure    T1608.003: Install Digital Certificate Execution    T1059.001: PowerShell    T1059.003: Windows Command Shell YARA Signatures Note: These rules are designed to broadly capture suspicious files and are not designed to detect a particular malware or threat. 8/9 rule QUIETEXIT_strings {     meta:         author = \"Mandiant\"         date_created = \"2022-01-13\"         date_modified = \"2022-01-13\"         rev = 1     strings:         $s1 = \"auth-agent@openssh.com\"         $s2 = \"auth-%.8x-%d\"         $s3 = \"Child connection from %s:%s\"         $s4 = \"Compiled without normal mode, can't run without -i\"         $s5 = \"cancel-tcpip-forward\"         $s6 = \"dropbear_prng\"         $s7 = \"cron\"     condition:         uint32be(0) == 0x7F454C46 and filesize < 2MB and all of them } rule REGEORG_Tuneller_generic {     meta:         author = \"Mandiant\"         date_created = \"2021-12-20\"         date_modified = \"2021-12-20\"         md5 = \"ba22992ce835dadcd06bff4ab7b162f9\"     strings:         $s1 = \"System.Net.IPEndPoint\"         $s2 = \"Response.AddHeader\"         $s3 = \"Request.InputStream.Read\"         $s4 = \"Request.Headers.Get\"         $s5 = \"Response.Write\"         $s6 = \"System.Buffer.BlockCopy\"         $s7 = \"Response.BinaryWrite\"         $s8 = \"SocketException soex\"     condition:         filesize < 1MB and 7 of them } 9/9 rule UNC3524_sha1 {     meta:         author = \"Mandiant\"         date_created = \"2022-01-19\"         date_modified = \"2022-01-19\"    strings:         $h1 = { DD E5 D5 97 20 53 27 BF F0 A2 BA CD 96 35 9A AD 1C 75 EB 47 }     condition:         uint32be(0) == 0x7F454C46 and filesize < 10MB and all of them } Indicators MALWARE FAMILY Indicator QUIETEXIT Dynamic DNS cloudns.asia dynu.net mywire.org webredirect.org MALWARE FAMILY MD5 SHA1 SHA256 REGEORG GitHub version ba22992ce835dadcd06bff4ab7b162f9 3d4dcc859c6ca7e5b36483ad84c9ceef34973f9a 7b5e3c1c06d82b3e7309C258dfbd4bfcd' which indicates a potential connection between a technique and a capec.",
    "context": "ATT&CK Tactic Category Techniques Defense Evasion    T1027: Obfuscated Files or Information Discovery    T1012: Query Registry    T1016: System Network Configuration Discovery    T1049: System Network Connections Discovery    T1057: Process Discovery    T1518: Software Discovery 7/9 Credential Access    T1003.004: LSA Secrets    T1003.006: DCSync    T1111: Two-Factor Authentication Interception Collection    T1114: Email Collection    T1114.002: Remote Email Collection Lateral Movement    T1021.004: SSH Persistence    T1037.004: RC Scripts    T1098.001: Additional Cloud Credentials    T1505.003: Web Shell Command and Control    T1071: Application Layer Protocol    T1090.003: Multi-hop Proxy    T1095: Non-Application Layer Protocol    T1572: Protocol Tunneling    T1573.002: Asymmetric Cryptography Resource Development    T1583.003: Virtual Private Server    T1584: Compromise Infrastructure    T1608.003: Install Digital Certificate Execution    T1059.001: PowerShell    T1059.003: Windows Command Shell YARA Signatures Note: These rules are designed to broadly capture suspicious files and are not designed to detect a particular malware or threat. 8/9 rule QUIETEXIT_strings {     meta:         author = \"Mandiant\"         date_created = \"2022-01-13\"         date_modified = \"2022-01-13\"         rev = 1     strings:         $s1 = \"auth-agent@openssh.com\"         $s2 = \"auth-%.8x-%d\"         $s3 = \"Child connection from %s:%s\"         $s4 = \"Compiled without normal mode, can't run without -i\"         $s5 = \"cancel-tcpip-forward\"         $s6 = \"dropbear_prng\"         $s7 = \"cron\"     condition:         uint32be(0) == 0x7F454C46 and filesize < 2MB and all of them } rule REGEORG_Tuneller_generic {     meta:         author = \"Mandiant\"         date_created = \"2021-12-20\"         date_modified = \"2021-12-20\"         md5 = \"ba22992ce835dadcd06bff4ab7b162f9\"     strings:         $s1 = \"System.Net.IPEndPoint\"         $s2 = \"Response.AddHeader\"         $s3 = \"Request.InputStream.Read\"         $s4 = \"Request.Headers.Get\"         $s5 = \"Response.Write\"         $s6 = \"System.Buffer.BlockCopy\"         $s7 = \"Response.BinaryWrite\"         $s8 = \"SocketException soex\"     condition:         filesize < 1MB and 7 of them } 9/9 rule UNC3524_sha1 {     meta:         author = \"Mandiant\"         date_created = \"2022-01-19\"         date_modified = \"2022-01-19\"    strings:         $h1 = { DD E5 D5 97 20 53 27 BF F0 A2 BA CD 96 35 9A AD 1C 75 EB 47 }     condition:         uint32be(0) == 0x7F454C46 and filesize < 10MB and all of them } Indicators MALWARE FAMILY Indicator QUIETEXIT Dynamic DNS cloudns.asia dynu.net mywire.org webredirect.org MALWARE FAMILY MD5 SHA1 SHA256 REGEORG GitHub version ba22992ce835dadcd06bff4ab7b162f9 3d4dcc859c6ca7e5b36483ad84c9ceef34973f9a 7b5e3c1c06d82b3e7309C258dfbd4bfcd"
  },
  {
    "from": "T1021",
    "to": "CAPEC-117",
    "from_name": "Remote Services",
    "to_name": "Interception",
    "from_layer": "technique",
    "to_layer": "capec",
    "justification": "Both entities appear in the same sentence: 'ATT&CK Tactic Category Techniques Defense Evasion    T1027: Obfuscated Files or Information Discovery    T1012: Query Registry    T1016: System Network Configuration Discovery    T1049: System Network Connections Discovery    T1057: Process Discovery    T1518: Software Discovery 7/9 Credential Access    T1003.004: LSA Secrets    T1003.006: DCSync    T1111: Two-Factor Authentication Interception Collection    T1114: Email Collection    T1114.002: Remote Email Collection Lateral Movement    T1021.004: SSH Persistence    T1037.004: RC Scripts    T1098.001: Additional Cloud Credentials    T1505.003: Web Shell Command and Control    T1071: Application Layer Protocol    T1090.003: Multi-hop Proxy    T1095: Non-Application Layer Protocol    T1572: Protocol Tunneling    T1573.002: Asymmetric Cryptography Resource Development    T1583.003: Virtual Private Server    T1584: Compromise Infrastructure    T1608.003: Install Digital Certificate Execution    T1059.001: PowerShell    T1059.003: Windows Command Shell YARA Signatures Note: These rules are designed to broadly capture suspicious files and are not designed to detect a particular malware or threat. 8/9 rule QUIETEXIT_strings {     meta:         author = \"Mandiant\"         date_created = \"2022-01-13\"         date_modified = \"2022-01-13\"         rev = 1     strings:         $s1 = \"auth-agent@openssh.com\"         $s2 = \"auth-%.8x-%d\"         $s3 = \"Child connection from %s:%s\"         $s4 = \"Compiled without normal mode, can't run without -i\"         $s5 = \"cancel-tcpip-forward\"         $s6 = \"dropbear_prng\"         $s7 = \"cron\"     condition:         uint32be(0) == 0x7F454C46 and filesize < 2MB and all of them } rule REGEORG_Tuneller_generic {     meta:         author = \"Mandiant\"         date_created = \"2021-12-20\"         date_modified = \"2021-12-20\"         md5 = \"ba22992ce835dadcd06bff4ab7b162f9\"     strings:         $s1 = \"System.Net.IPEndPoint\"         $s2 = \"Response.AddHeader\"         $s3 = \"Request.InputStream.Read\"         $s4 = \"Request.Headers.Get\"         $s5 = \"Response.Write\"         $s6 = \"System.Buffer.BlockCopy\"         $s7 = \"Response.BinaryWrite\"         $s8 = \"SocketException soex\"     condition:         filesize < 1MB and 7 of them } 9/9 rule UNC3524_sha1 {     meta:         author = \"Mandiant\"         date_created = \"2022-01-19\"         date_modified = \"2022-01-19\"    strings:         $h1 = { DD E5 D5 97 20 53 27 BF F0 A2 BA CD 96 35 9A AD 1C 75 EB 47 }     condition:         uint32be(0) == 0x7F454C46 and filesize < 10MB and all of them } Indicators MALWARE FAMILY Indicator QUIETEXIT Dynamic DNS cloudns.asia dynu.net mywire.org webredirect.org MALWARE FAMILY MD5 SHA1 SHA256 REGEORG GitHub version ba22992ce835dadcd06bff4ab7b162f9 3d4dcc859c6ca7e5b36483ad84c9ceef34973f9a 7b5e3c1c06d82b3e7309C258dfbd4bfcd' which indicates a potential connection between a technique and a capec.",
    "context": "ATT&CK Tactic Category Techniques Defense Evasion    T1027: Obfuscated Files or Information Discovery    T1012: Query Registry    T1016: System Network Configuration Discovery    T1049: System Network Connections Discovery    T1057: Process Discovery    T1518: Software Discovery 7/9 Credential Access    T1003.004: LSA Secrets    T1003.006: DCSync    T1111: Two-Factor Authentication Interception Collection    T1114: Email Collection    T1114.002: Remote Email Collection Lateral Movement    T1021.004: SSH Persistence    T1037.004: RC Scripts    T1098.001: Additional Cloud Credentials    T1505.003: Web Shell Command and Control    T1071: Application Layer Protocol    T1090.003: Multi-hop Proxy    T1095: Non-Application Layer Protocol    T1572: Protocol Tunneling    T1573.002: Asymmetric Cryptography Resource Development    T1583.003: Virtual Private Server    T1584: Compromise Infrastructure    T1608.003: Install Digital Certificate Execution    T1059.001: PowerShell    T1059.003: Windows Command Shell YARA Signatures Note: These rules are designed to broadly capture suspicious files and are not designed to detect a particular malware or threat. 8/9 rule QUIETEXIT_strings {     meta:         author = \"Mandiant\"         date_created = \"2022-01-13\"         date_modified = \"2022-01-13\"         rev = 1     strings:         $s1 = \"auth-agent@openssh.com\"         $s2 = \"auth-%.8x-%d\"         $s3 = \"Child connection from %s:%s\"         $s4 = \"Compiled without normal mode, can't run without -i\"         $s5 = \"cancel-tcpip-forward\"         $s6 = \"dropbear_prng\"         $s7 = \"cron\"     condition:         uint32be(0) == 0x7F454C46 and filesize < 2MB and all of them } rule REGEORG_Tuneller_generic {     meta:         author = \"Mandiant\"         date_created = \"2021-12-20\"         date_modified = \"2021-12-20\"         md5 = \"ba22992ce835dadcd06bff4ab7b162f9\"     strings:         $s1 = \"System.Net.IPEndPoint\"         $s2 = \"Response.AddHeader\"         $s3 = \"Request.InputStream.Read\"         $s4 = \"Request.Headers.Get\"         $s5 = \"Response.Write\"         $s6 = \"System.Buffer.BlockCopy\"         $s7 = \"Response.BinaryWrite\"         $s8 = \"SocketException soex\"     condition:         filesize < 1MB and 7 of them } 9/9 rule UNC3524_sha1 {     meta:         author = \"Mandiant\"         date_created = \"2022-01-19\"         date_modified = \"2022-01-19\"    strings:         $h1 = { DD E5 D5 97 20 53 27 BF F0 A2 BA CD 96 35 9A AD 1C 75 EB 47 }     condition:         uint32be(0) == 0x7F454C46 and filesize < 10MB and all of them } Indicators MALWARE FAMILY Indicator QUIETEXIT Dynamic DNS cloudns.asia dynu.net mywire.org webredirect.org MALWARE FAMILY MD5 SHA1 SHA256 REGEORG GitHub version ba22992ce835dadcd06bff4ab7b162f9 3d4dcc859c6ca7e5b36483ad84c9ceef34973f9a 7b5e3c1c06d82b3e7309C258dfbd4bfcd"
  },
  {
    "from": "T1505",
    "to": "CAPEC-117",
    "from_name": "Server Software Component",
    "to_name": "Interception",
    "from_layer": "technique",
    "to_layer": "capec",
    "justification": "Both entities appear in the same sentence: 'ATT&CK Tactic Category Techniques Defense Evasion    T1027: Obfuscated Files or Information Discovery    T1012: Query Registry    T1016: System Network Configuration Discovery    T1049: System Network Connections Discovery    T1057: Process Discovery    T1518: Software Discovery 7/9 Credential Access    T1003.004: LSA Secrets    T1003.006: DCSync    T1111: Two-Factor Authentication Interception Collection    T1114: Email Collection    T1114.002: Remote Email Collection Lateral Movement    T1021.004: SSH Persistence    T1037.004: RC Scripts    T1098.001: Additional Cloud Credentials    T1505.003: Web Shell Command and Control    T1071: Application Layer Protocol    T1090.003: Multi-hop Proxy    T1095: Non-Application Layer Protocol    T1572: Protocol Tunneling    T1573.002: Asymmetric Cryptography Resource Development    T1583.003: Virtual Private Server    T1584: Compromise Infrastructure    T1608.003: Install Digital Certificate Execution    T1059.001: PowerShell    T1059.003: Windows Command Shell YARA Signatures Note: These rules are designed to broadly capture suspicious files and are not designed to detect a particular malware or threat. 8/9 rule QUIETEXIT_strings {     meta:         author = \"Mandiant\"         date_created = \"2022-01-13\"         date_modified = \"2022-01-13\"         rev = 1     strings:         $s1 = \"auth-agent@openssh.com\"         $s2 = \"auth-%.8x-%d\"         $s3 = \"Child connection from %s:%s\"         $s4 = \"Compiled without normal mode, can't run without -i\"         $s5 = \"cancel-tcpip-forward\"         $s6 = \"dropbear_prng\"         $s7 = \"cron\"     condition:         uint32be(0) == 0x7F454C46 and filesize < 2MB and all of them } rule REGEORG_Tuneller_generic {     meta:         author = \"Mandiant\"         date_created = \"2021-12-20\"         date_modified = \"2021-12-20\"         md5 = \"ba22992ce835dadcd06bff4ab7b162f9\"     strings:         $s1 = \"System.Net.IPEndPoint\"         $s2 = \"Response.AddHeader\"         $s3 = \"Request.InputStream.Read\"         $s4 = \"Request.Headers.Get\"         $s5 = \"Response.Write\"         $s6 = \"System.Buffer.BlockCopy\"         $s7 = \"Response.BinaryWrite\"         $s8 = \"SocketException soex\"     condition:         filesize < 1MB and 7 of them } 9/9 rule UNC3524_sha1 {     meta:         author = \"Mandiant\"         date_created = \"2022-01-19\"         date_modified = \"2022-01-19\"    strings:         $h1 = { DD E5 D5 97 20 53 27 BF F0 A2 BA CD 96 35 9A AD 1C 75 EB 47 }     condition:         uint32be(0) == 0x7F454C46 and filesize < 10MB and all of them } Indicators MALWARE FAMILY Indicator QUIETEXIT Dynamic DNS cloudns.asia dynu.net mywire.org webredirect.org MALWARE FAMILY MD5 SHA1 SHA256 REGEORG GitHub version ba22992ce835dadcd06bff4ab7b162f9 3d4dcc859c6ca7e5b36483ad84c9ceef34973f9a 7b5e3c1c06d82b3e7309C258dfbd4bfcd' which indicates a potential connection between a technique and a capec.",
    "context": "ATT&CK Tactic Category Techniques Defense Evasion    T1027: Obfuscated Files or Information Discovery    T1012: Query Registry    T1016: System Network Configuration Discovery    T1049: System Network Connections Discovery    T1057: Process Discovery    T1518: Software Discovery 7/9 Credential Access    T1003.004: LSA Secrets    T1003.006: DCSync    T1111: Two-Factor Authentication Interception Collection    T1114: Email Collection    T1114.002: Remote Email Collection Lateral Movement    T1021.004: SSH Persistence    T1037.004: RC Scripts    T1098.001: Additional Cloud Credentials    T1505.003: Web Shell Command and Control    T1071: Application Layer Protocol    T1090.003: Multi-hop Proxy    T1095: Non-Application Layer Protocol    T1572: Protocol Tunneling    T1573.002: Asymmetric Cryptography Resource Development    T1583.003: Virtual Private Server    T1584: Compromise Infrastructure    T1608.003: Install Digital Certificate Execution    T1059.001: PowerShell    T1059.003: Windows Command Shell YARA Signatures Note: These rules are designed to broadly capture suspicious files and are not designed to detect a particular malware or threat. 8/9 rule QUIETEXIT_strings {     meta:         author = \"Mandiant\"         date_created = \"2022-01-13\"         date_modified = \"2022-01-13\"         rev = 1     strings:         $s1 = \"auth-agent@openssh.com\"         $s2 = \"auth-%.8x-%d\"         $s3 = \"Child connection from %s:%s\"         $s4 = \"Compiled without normal mode, can't run without -i\"         $s5 = \"cancel-tcpip-forward\"         $s6 = \"dropbear_prng\"         $s7 = \"cron\"     condition:         uint32be(0) == 0x7F454C46 and filesize < 2MB and all of them } rule REGEORG_Tuneller_generic {     meta:         author = \"Mandiant\"         date_created = \"2021-12-20\"         date_modified = \"2021-12-20\"         md5 = \"ba22992ce835dadcd06bff4ab7b162f9\"     strings:         $s1 = \"System.Net.IPEndPoint\"         $s2 = \"Response.AddHeader\"         $s3 = \"Request.InputStream.Read\"         $s4 = \"Request.Headers.Get\"         $s5 = \"Response.Write\"         $s6 = \"System.Buffer.BlockCopy\"         $s7 = \"Response.BinaryWrite\"         $s8 = \"SocketException soex\"     condition:         filesize < 1MB and 7 of them } 9/9 rule UNC3524_sha1 {     meta:         author = \"Mandiant\"         date_created = \"2022-01-19\"         date_modified = \"2022-01-19\"    strings:         $h1 = { DD E5 D5 97 20 53 27 BF F0 A2 BA CD 96 35 9A AD 1C 75 EB 47 }     condition:         uint32be(0) == 0x7F454C46 and filesize < 10MB and all of them } Indicators MALWARE FAMILY Indicator QUIETEXIT Dynamic DNS cloudns.asia dynu.net mywire.org webredirect.org MALWARE FAMILY MD5 SHA1 SHA256 REGEORG GitHub version ba22992ce835dadcd06bff4ab7b162f9 3d4dcc859c6ca7e5b36483ad84c9ceef34973f9a 7b5e3c1c06d82b3e7309C258dfbd4bfcd"
  },
  {
    "from": "T1518",
    "to": "CAPEC-117",
    "from_name": "Software Discovery",
    "to_name": "Interception",
    "from_layer": "technique",
    "to_layer": "capec",
    "justification": "Both entities appear in the same sentence: 'ATT&CK Tactic Category Techniques Defense Evasion    T1027: Obfuscated Files or Information Discovery    T1012: Query Registry    T1016: System Network Configuration Discovery    T1049: System Network Connections Discovery    T1057: Process Discovery    T1518: Software Discovery 7/9 Credential Access    T1003.004: LSA Secrets    T1003.006: DCSync    T1111: Two-Factor Authentication Interception Collection    T1114: Email Collection    T1114.002: Remote Email Collection Lateral Movement    T1021.004: SSH Persistence    T1037.004: RC Scripts    T1098.001: Additional Cloud Credentials    T1505.003: Web Shell Command and Control    T1071: Application Layer Protocol    T1090.003: Multi-hop Proxy    T1095: Non-Application Layer Protocol    T1572: Protocol Tunneling    T1573.002: Asymmetric Cryptography Resource Development    T1583.003: Virtual Private Server    T1584: Compromise Infrastructure    T1608.003: Install Digital Certificate Execution    T1059.001: PowerShell    T1059.003: Windows Command Shell YARA Signatures Note: These rules are designed to broadly capture suspicious files and are not designed to detect a particular malware or threat. 8/9 rule QUIETEXIT_strings {     meta:         author = \"Mandiant\"         date_created = \"2022-01-13\"         date_modified = \"2022-01-13\"         rev = 1     strings:         $s1 = \"auth-agent@openssh.com\"         $s2 = \"auth-%.8x-%d\"         $s3 = \"Child connection from %s:%s\"         $s4 = \"Compiled without normal mode, can't run without -i\"         $s5 = \"cancel-tcpip-forward\"         $s6 = \"dropbear_prng\"         $s7 = \"cron\"     condition:         uint32be(0) == 0x7F454C46 and filesize < 2MB and all of them } rule REGEORG_Tuneller_generic {     meta:         author = \"Mandiant\"         date_created = \"2021-12-20\"         date_modified = \"2021-12-20\"         md5 = \"ba22992ce835dadcd06bff4ab7b162f9\"     strings:         $s1 = \"System.Net.IPEndPoint\"         $s2 = \"Response.AddHeader\"         $s3 = \"Request.InputStream.Read\"         $s4 = \"Request.Headers.Get\"         $s5 = \"Response.Write\"         $s6 = \"System.Buffer.BlockCopy\"         $s7 = \"Response.BinaryWrite\"         $s8 = \"SocketException soex\"     condition:         filesize < 1MB and 7 of them } 9/9 rule UNC3524_sha1 {     meta:         author = \"Mandiant\"         date_created = \"2022-01-19\"         date_modified = \"2022-01-19\"    strings:         $h1 = { DD E5 D5 97 20 53 27 BF F0 A2 BA CD 96 35 9A AD 1C 75 EB 47 }     condition:         uint32be(0) == 0x7F454C46 and filesize < 10MB and all of them } Indicators MALWARE FAMILY Indicator QUIETEXIT Dynamic DNS cloudns.asia dynu.net mywire.org webredirect.org MALWARE FAMILY MD5 SHA1 SHA256 REGEORG GitHub version ba22992ce835dadcd06bff4ab7b162f9 3d4dcc859c6ca7e5b36483ad84c9ceef34973f9a 7b5e3c1c06d82b3e7309C258dfbd4bfcd' which indicates a potential connection between a technique and a capec.",
    "context": "ATT&CK Tactic Category Techniques Defense Evasion    T1027: Obfuscated Files or Information Discovery    T1012: Query Registry    T1016: System Network Configuration Discovery    T1049: System Network Connections Discovery    T1057: Process Discovery    T1518: Software Discovery 7/9 Credential Access    T1003.004: LSA Secrets    T1003.006: DCSync    T1111: Two-Factor Authentication Interception Collection    T1114: Email Collection    T1114.002: Remote Email Collection Lateral Movement    T1021.004: SSH Persistence    T1037.004: RC Scripts    T1098.001: Additional Cloud Credentials    T1505.003: Web Shell Command and Control    T1071: Application Layer Protocol    T1090.003: Multi-hop Proxy    T1095: Non-Application Layer Protocol    T1572: Protocol Tunneling    T1573.002: Asymmetric Cryptography Resource Development    T1583.003: Virtual Private Server    T1584: Compromise Infrastructure    T1608.003: Install Digital Certificate Execution    T1059.001: PowerShell    T1059.003: Windows Command Shell YARA Signatures Note: These rules are designed to broadly capture suspicious files and are not designed to detect a particular malware or threat. 8/9 rule QUIETEXIT_strings {     meta:         author = \"Mandiant\"         date_created = \"2022-01-13\"         date_modified = \"2022-01-13\"         rev = 1     strings:         $s1 = \"auth-agent@openssh.com\"         $s2 = \"auth-%.8x-%d\"         $s3 = \"Child connection from %s:%s\"         $s4 = \"Compiled without normal mode, can't run without -i\"         $s5 = \"cancel-tcpip-forward\"         $s6 = \"dropbear_prng\"         $s7 = \"cron\"     condition:         uint32be(0) == 0x7F454C46 and filesize < 2MB and all of them } rule REGEORG_Tuneller_generic {     meta:         author = \"Mandiant\"         date_created = \"2021-12-20\"         date_modified = \"2021-12-20\"         md5 = \"ba22992ce835dadcd06bff4ab7b162f9\"     strings:         $s1 = \"System.Net.IPEndPoint\"         $s2 = \"Response.AddHeader\"         $s3 = \"Request.InputStream.Read\"         $s4 = \"Request.Headers.Get\"         $s5 = \"Response.Write\"         $s6 = \"System.Buffer.BlockCopy\"         $s7 = \"Response.BinaryWrite\"         $s8 = \"SocketException soex\"     condition:         filesize < 1MB and 7 of them } 9/9 rule UNC3524_sha1 {     meta:         author = \"Mandiant\"         date_created = \"2022-01-19\"         date_modified = \"2022-01-19\"    strings:         $h1 = { DD E5 D5 97 20 53 27 BF F0 A2 BA CD 96 35 9A AD 1C 75 EB 47 }     condition:         uint32be(0) == 0x7F454C46 and filesize < 10MB and all of them } Indicators MALWARE FAMILY Indicator QUIETEXIT Dynamic DNS cloudns.asia dynu.net mywire.org webredirect.org MALWARE FAMILY MD5 SHA1 SHA256 REGEORG GitHub version ba22992ce835dadcd06bff4ab7b162f9 3d4dcc859c6ca7e5b36483ad84c9ceef34973f9a 7b5e3c1c06d82b3e7309C258dfbd4bfcd"
  },
  {
    "from": "T1608",
    "to": "CAPEC-117",
    "from_name": "Stage Capabilities",
    "to_name": "Interception",
    "from_layer": "technique",
    "to_layer": "capec",
    "justification": "Both entities appear in the same sentence: 'ATT&CK Tactic Category Techniques Defense Evasion    T1027: Obfuscated Files or Information Discovery    T1012: Query Registry    T1016: System Network Configuration Discovery    T1049: System Network Connections Discovery    T1057: Process Discovery    T1518: Software Discovery 7/9 Credential Access    T1003.004: LSA Secrets    T1003.006: DCSync    T1111: Two-Factor Authentication Interception Collection    T1114: Email Collection    T1114.002: Remote Email Collection Lateral Movement    T1021.004: SSH Persistence    T1037.004: RC Scripts    T1098.001: Additional Cloud Credentials    T1505.003: Web Shell Command and Control    T1071: Application Layer Protocol    T1090.003: Multi-hop Proxy    T1095: Non-Application Layer Protocol    T1572: Protocol Tunneling    T1573.002: Asymmetric Cryptography Resource Development    T1583.003: Virtual Private Server    T1584: Compromise Infrastructure    T1608.003: Install Digital Certificate Execution    T1059.001: PowerShell    T1059.003: Windows Command Shell YARA Signatures Note: These rules are designed to broadly capture suspicious files and are not designed to detect a particular malware or threat. 8/9 rule QUIETEXIT_strings {     meta:         author = \"Mandiant\"         date_created = \"2022-01-13\"         date_modified = \"2022-01-13\"         rev = 1     strings:         $s1 = \"auth-agent@openssh.com\"         $s2 = \"auth-%.8x-%d\"         $s3 = \"Child connection from %s:%s\"         $s4 = \"Compiled without normal mode, can't run without -i\"         $s5 = \"cancel-tcpip-forward\"         $s6 = \"dropbear_prng\"         $s7 = \"cron\"     condition:         uint32be(0) == 0x7F454C46 and filesize < 2MB and all of them } rule REGEORG_Tuneller_generic {     meta:         author = \"Mandiant\"         date_created = \"2021-12-20\"         date_modified = \"2021-12-20\"         md5 = \"ba22992ce835dadcd06bff4ab7b162f9\"     strings:         $s1 = \"System.Net.IPEndPoint\"         $s2 = \"Response.AddHeader\"         $s3 = \"Request.InputStream.Read\"         $s4 = \"Request.Headers.Get\"         $s5 = \"Response.Write\"         $s6 = \"System.Buffer.BlockCopy\"         $s7 = \"Response.BinaryWrite\"         $s8 = \"SocketException soex\"     condition:         filesize < 1MB and 7 of them } 9/9 rule UNC3524_sha1 {     meta:         author = \"Mandiant\"         date_created = \"2022-01-19\"         date_modified = \"2022-01-19\"    strings:         $h1 = { DD E5 D5 97 20 53 27 BF F0 A2 BA CD 96 35 9A AD 1C 75 EB 47 }     condition:         uint32be(0) == 0x7F454C46 and filesize < 10MB and all of them } Indicators MALWARE FAMILY Indicator QUIETEXIT Dynamic DNS cloudns.asia dynu.net mywire.org webredirect.org MALWARE FAMILY MD5 SHA1 SHA256 REGEORG GitHub version ba22992ce835dadcd06bff4ab7b162f9 3d4dcc859c6ca7e5b36483ad84c9ceef34973f9a 7b5e3c1c06d82b3e7309C258dfbd4bfcd' which indicates a potential connection between a technique and a capec.",
    "context": "ATT&CK Tactic Category Techniques Defense Evasion    T1027: Obfuscated Files or Information Discovery    T1012: Query Registry    T1016: System Network Configuration Discovery    T1049: System Network Connections Discovery    T1057: Process Discovery    T1518: Software Discovery 7/9 Credential Access    T1003.004: LSA Secrets    T1003.006: DCSync    T1111: Two-Factor Authentication Interception Collection    T1114: Email Collection    T1114.002: Remote Email Collection Lateral Movement    T1021.004: SSH Persistence    T1037.004: RC Scripts    T1098.001: Additional Cloud Credentials    T1505.003: Web Shell Command and Control    T1071: Application Layer Protocol    T1090.003: Multi-hop Proxy    T1095: Non-Application Layer Protocol    T1572: Protocol Tunneling    T1573.002: Asymmetric Cryptography Resource Development    T1583.003: Virtual Private Server    T1584: Compromise Infrastructure    T1608.003: Install Digital Certificate Execution    T1059.001: PowerShell    T1059.003: Windows Command Shell YARA Signatures Note: These rules are designed to broadly capture suspicious files and are not designed to detect a particular malware or threat. 8/9 rule QUIETEXIT_strings {     meta:         author = \"Mandiant\"         date_created = \"2022-01-13\"         date_modified = \"2022-01-13\"         rev = 1     strings:         $s1 = \"auth-agent@openssh.com\"         $s2 = \"auth-%.8x-%d\"         $s3 = \"Child connection from %s:%s\"         $s4 = \"Compiled without normal mode, can't run without -i\"         $s5 = \"cancel-tcpip-forward\"         $s6 = \"dropbear_prng\"         $s7 = \"cron\"     condition:         uint32be(0) == 0x7F454C46 and filesize < 2MB and all of them } rule REGEORG_Tuneller_generic {     meta:         author = \"Mandiant\"         date_created = \"2021-12-20\"         date_modified = \"2021-12-20\"         md5 = \"ba22992ce835dadcd06bff4ab7b162f9\"     strings:         $s1 = \"System.Net.IPEndPoint\"         $s2 = \"Response.AddHeader\"         $s3 = \"Request.InputStream.Read\"         $s4 = \"Request.Headers.Get\"         $s5 = \"Response.Write\"         $s6 = \"System.Buffer.BlockCopy\"         $s7 = \"Response.BinaryWrite\"         $s8 = \"SocketException soex\"     condition:         filesize < 1MB and 7 of them } 9/9 rule UNC3524_sha1 {     meta:         author = \"Mandiant\"         date_created = \"2022-01-19\"         date_modified = \"2022-01-19\"    strings:         $h1 = { DD E5 D5 97 20 53 27 BF F0 A2 BA CD 96 35 9A AD 1C 75 EB 47 }     condition:         uint32be(0) == 0x7F454C46 and filesize < 10MB and all of them } Indicators MALWARE FAMILY Indicator QUIETEXIT Dynamic DNS cloudns.asia dynu.net mywire.org webredirect.org MALWARE FAMILY MD5 SHA1 SHA256 REGEORG GitHub version ba22992ce835dadcd06bff4ab7b162f9 3d4dcc859c6ca7e5b36483ad84c9ceef34973f9a 7b5e3c1c06d82b3e7309C258dfbd4bfcd"
  },
  {
    "from": "T1573.001",
    "to": "CAPEC-117",
    "from_name": "Symmetric Cryptography",
    "to_name": "Interception",
    "from_layer": "technique",
    "to_layer": "capec",
    "justification": "Both entities appear in the same sentence: 'ATT&CK Tactic Category Techniques Defense Evasion    T1027: Obfuscated Files or Information Discovery    T1012: Query Registry    T1016: System Network Configuration Discovery    T1049: System Network Connections Discovery    T1057: Process Discovery    T1518: Software Discovery 7/9 Credential Access    T1003.004: LSA Secrets    T1003.006: DCSync    T1111: Two-Factor Authentication Interception Collection    T1114: Email Collection    T1114.002: Remote Email Collection Lateral Movement    T1021.004: SSH Persistence    T1037.004: RC Scripts    T1098.001: Additional Cloud Credentials    T1505.003: Web Shell Command and Control    T1071: Application Layer Protocol    T1090.003: Multi-hop Proxy    T1095: Non-Application Layer Protocol    T1572: Protocol Tunneling    T1573.002: Asymmetric Cryptography Resource Development    T1583.003: Virtual Private Server    T1584: Compromise Infrastructure    T1608.003: Install Digital Certificate Execution    T1059.001: PowerShell    T1059.003: Windows Command Shell YARA Signatures Note: These rules are designed to broadly capture suspicious files and are not designed to detect a particular malware or threat. 8/9 rule QUIETEXIT_strings {     meta:         author = \"Mandiant\"         date_created = \"2022-01-13\"         date_modified = \"2022-01-13\"         rev = 1     strings:         $s1 = \"auth-agent@openssh.com\"         $s2 = \"auth-%.8x-%d\"         $s3 = \"Child connection from %s:%s\"         $s4 = \"Compiled without normal mode, can't run without -i\"         $s5 = \"cancel-tcpip-forward\"         $s6 = \"dropbear_prng\"         $s7 = \"cron\"     condition:         uint32be(0) == 0x7F454C46 and filesize < 2MB and all of them } rule REGEORG_Tuneller_generic {     meta:         author = \"Mandiant\"         date_created = \"2021-12-20\"         date_modified = \"2021-12-20\"         md5 = \"ba22992ce835dadcd06bff4ab7b162f9\"     strings:         $s1 = \"System.Net.IPEndPoint\"         $s2 = \"Response.AddHeader\"         $s3 = \"Request.InputStream.Read\"         $s4 = \"Request.Headers.Get\"         $s5 = \"Response.Write\"         $s6 = \"System.Buffer.BlockCopy\"         $s7 = \"Response.BinaryWrite\"         $s8 = \"SocketException soex\"     condition:         filesize < 1MB and 7 of them } 9/9 rule UNC3524_sha1 {     meta:         author = \"Mandiant\"         date_created = \"2022-01-19\"         date_modified = \"2022-01-19\"    strings:         $h1 = { DD E5 D5 97 20 53 27 BF F0 A2 BA CD 96 35 9A AD 1C 75 EB 47 }     condition:         uint32be(0) == 0x7F454C46 and filesize < 10MB and all of them } Indicators MALWARE FAMILY Indicator QUIETEXIT Dynamic DNS cloudns.asia dynu.net mywire.org webredirect.org MALWARE FAMILY MD5 SHA1 SHA256 REGEORG GitHub version ba22992ce835dadcd06bff4ab7b162f9 3d4dcc859c6ca7e5b36483ad84c9ceef34973f9a 7b5e3c1c06d82b3e7309C258dfbd4bfcd' which indicates a potential connection between a technique and a capec.",
    "context": "ATT&CK Tactic Category Techniques Defense Evasion    T1027: Obfuscated Files or Information Discovery    T1012: Query Registry    T1016: System Network Configuration Discovery    T1049: System Network Connections Discovery    T1057: Process Discovery    T1518: Software Discovery 7/9 Credential Access    T1003.004: LSA Secrets    T1003.006: DCSync    T1111: Two-Factor Authentication Interception Collection    T1114: Email Collection    T1114.002: Remote Email Collection Lateral Movement    T1021.004: SSH Persistence    T1037.004: RC Scripts    T1098.001: Additional Cloud Credentials    T1505.003: Web Shell Command and Control    T1071: Application Layer Protocol    T1090.003: Multi-hop Proxy    T1095: Non-Application Layer Protocol    T1572: Protocol Tunneling    T1573.002: Asymmetric Cryptography Resource Development    T1583.003: Virtual Private Server    T1584: Compromise Infrastructure    T1608.003: Install Digital Certificate Execution    T1059.001: PowerShell    T1059.003: Windows Command Shell YARA Signatures Note: These rules are designed to broadly capture suspicious files and are not designed to detect a particular malware or threat. 8/9 rule QUIETEXIT_strings {     meta:         author = \"Mandiant\"         date_created = \"2022-01-13\"         date_modified = \"2022-01-13\"         rev = 1     strings:         $s1 = \"auth-agent@openssh.com\"         $s2 = \"auth-%.8x-%d\"         $s3 = \"Child connection from %s:%s\"         $s4 = \"Compiled without normal mode, can't run without -i\"         $s5 = \"cancel-tcpip-forward\"         $s6 = \"dropbear_prng\"         $s7 = \"cron\"     condition:         uint32be(0) == 0x7F454C46 and filesize < 2MB and all of them } rule REGEORG_Tuneller_generic {     meta:         author = \"Mandiant\"         date_created = \"2021-12-20\"         date_modified = \"2021-12-20\"         md5 = \"ba22992ce835dadcd06bff4ab7b162f9\"     strings:         $s1 = \"System.Net.IPEndPoint\"         $s2 = \"Response.AddHeader\"         $s3 = \"Request.InputStream.Read\"         $s4 = \"Request.Headers.Get\"         $s5 = \"Response.Write\"         $s6 = \"System.Buffer.BlockCopy\"         $s7 = \"Response.BinaryWrite\"         $s8 = \"SocketException soex\"     condition:         filesize < 1MB and 7 of them } 9/9 rule UNC3524_sha1 {     meta:         author = \"Mandiant\"         date_created = \"2022-01-19\"         date_modified = \"2022-01-19\"    strings:         $h1 = { DD E5 D5 97 20 53 27 BF F0 A2 BA CD 96 35 9A AD 1C 75 EB 47 }     condition:         uint32be(0) == 0x7F454C46 and filesize < 10MB and all of them } Indicators MALWARE FAMILY Indicator QUIETEXIT Dynamic DNS cloudns.asia dynu.net mywire.org webredirect.org MALWARE FAMILY MD5 SHA1 SHA256 REGEORG GitHub version ba22992ce835dadcd06bff4ab7b162f9 3d4dcc859c6ca7e5b36483ad84c9ceef34973f9a 7b5e3c1c06d82b3e7309C258dfbd4bfcd"
  },
  {
    "from": "T1016",
    "to": "CAPEC-117",
    "from_name": "System Network Configuration Discovery",
    "to_name": "Interception",
    "from_layer": "technique",
    "to_layer": "capec",
    "justification": "Both entities appear in the same sentence: 'ATT&CK Tactic Category Techniques Defense Evasion    T1027: Obfuscated Files or Information Discovery    T1012: Query Registry    T1016: System Network Configuration Discovery    T1049: System Network Connections Discovery    T1057: Process Discovery    T1518: Software Discovery 7/9 Credential Access    T1003.004: LSA Secrets    T1003.006: DCSync    T1111: Two-Factor Authentication Interception Collection    T1114: Email Collection    T1114.002: Remote Email Collection Lateral Movement    T1021.004: SSH Persistence    T1037.004: RC Scripts    T1098.001: Additional Cloud Credentials    T1505.003: Web Shell Command and Control    T1071: Application Layer Protocol    T1090.003: Multi-hop Proxy    T1095: Non-Application Layer Protocol    T1572: Protocol Tunneling    T1573.002: Asymmetric Cryptography Resource Development    T1583.003: Virtual Private Server    T1584: Compromise Infrastructure    T1608.003: Install Digital Certificate Execution    T1059.001: PowerShell    T1059.003: Windows Command Shell YARA Signatures Note: These rules are designed to broadly capture suspicious files and are not designed to detect a particular malware or threat. 8/9 rule QUIETEXIT_strings {     meta:         author = \"Mandiant\"         date_created = \"2022-01-13\"         date_modified = \"2022-01-13\"         rev = 1     strings:         $s1 = \"auth-agent@openssh.com\"         $s2 = \"auth-%.8x-%d\"         $s3 = \"Child connection from %s:%s\"         $s4 = \"Compiled without normal mode, can't run without -i\"         $s5 = \"cancel-tcpip-forward\"         $s6 = \"dropbear_prng\"         $s7 = \"cron\"     condition:         uint32be(0) == 0x7F454C46 and filesize < 2MB and all of them } rule REGEORG_Tuneller_generic {     meta:         author = \"Mandiant\"         date_created = \"2021-12-20\"         date_modified = \"2021-12-20\"         md5 = \"ba22992ce835dadcd06bff4ab7b162f9\"     strings:         $s1 = \"System.Net.IPEndPoint\"         $s2 = \"Response.AddHeader\"         $s3 = \"Request.InputStream.Read\"         $s4 = \"Request.Headers.Get\"         $s5 = \"Response.Write\"         $s6 = \"System.Buffer.BlockCopy\"         $s7 = \"Response.BinaryWrite\"         $s8 = \"SocketException soex\"     condition:         filesize < 1MB and 7 of them } 9/9 rule UNC3524_sha1 {     meta:         author = \"Mandiant\"         date_created = \"2022-01-19\"         date_modified = \"2022-01-19\"    strings:         $h1 = { DD E5 D5 97 20 53 27 BF F0 A2 BA CD 96 35 9A AD 1C 75 EB 47 }     condition:         uint32be(0) == 0x7F454C46 and filesize < 10MB and all of them } Indicators MALWARE FAMILY Indicator QUIETEXIT Dynamic DNS cloudns.asia dynu.net mywire.org webredirect.org MALWARE FAMILY MD5 SHA1 SHA256 REGEORG GitHub version ba22992ce835dadcd06bff4ab7b162f9 3d4dcc859c6ca7e5b36483ad84c9ceef34973f9a 7b5e3c1c06d82b3e7309C258dfbd4bfcd' which indicates a potential connection between a technique and a capec.",
    "context": "ATT&CK Tactic Category Techniques Defense Evasion    T1027: Obfuscated Files or Information Discovery    T1012: Query Registry    T1016: System Network Configuration Discovery    T1049: System Network Connections Discovery    T1057: Process Discovery    T1518: Software Discovery 7/9 Credential Access    T1003.004: LSA Secrets    T1003.006: DCSync    T1111: Two-Factor Authentication Interception Collection    T1114: Email Collection    T1114.002: Remote Email Collection Lateral Movement    T1021.004: SSH Persistence    T1037.004: RC Scripts    T1098.001: Additional Cloud Credentials    T1505.003: Web Shell Command and Control    T1071: Application Layer Protocol    T1090.003: Multi-hop Proxy    T1095: Non-Application Layer Protocol    T1572: Protocol Tunneling    T1573.002: Asymmetric Cryptography Resource Development    T1583.003: Virtual Private Server    T1584: Compromise Infrastructure    T1608.003: Install Digital Certificate Execution    T1059.001: PowerShell    T1059.003: Windows Command Shell YARA Signatures Note: These rules are designed to broadly capture suspicious files and are not designed to detect a particular malware or threat. 8/9 rule QUIETEXIT_strings {     meta:         author = \"Mandiant\"         date_created = \"2022-01-13\"         date_modified = \"2022-01-13\"         rev = 1     strings:         $s1 = \"auth-agent@openssh.com\"         $s2 = \"auth-%.8x-%d\"         $s3 = \"Child connection from %s:%s\"         $s4 = \"Compiled without normal mode, can't run without -i\"         $s5 = \"cancel-tcpip-forward\"         $s6 = \"dropbear_prng\"         $s7 = \"cron\"     condition:         uint32be(0) == 0x7F454C46 and filesize < 2MB and all of them } rule REGEORG_Tuneller_generic {     meta:         author = \"Mandiant\"         date_created = \"2021-12-20\"         date_modified = \"2021-12-20\"         md5 = \"ba22992ce835dadcd06bff4ab7b162f9\"     strings:         $s1 = \"System.Net.IPEndPoint\"         $s2 = \"Response.AddHeader\"         $s3 = \"Request.InputStream.Read\"         $s4 = \"Request.Headers.Get\"         $s5 = \"Response.Write\"         $s6 = \"System.Buffer.BlockCopy\"         $s7 = \"Response.BinaryWrite\"         $s8 = \"SocketException soex\"     condition:         filesize < 1MB and 7 of them } 9/9 rule UNC3524_sha1 {     meta:         author = \"Mandiant\"         date_created = \"2022-01-19\"         date_modified = \"2022-01-19\"    strings:         $h1 = { DD E5 D5 97 20 53 27 BF F0 A2 BA CD 96 35 9A AD 1C 75 EB 47 }     condition:         uint32be(0) == 0x7F454C46 and filesize < 10MB and all of them } Indicators MALWARE FAMILY Indicator QUIETEXIT Dynamic DNS cloudns.asia dynu.net mywire.org webredirect.org MALWARE FAMILY MD5 SHA1 SHA256 REGEORG GitHub version ba22992ce835dadcd06bff4ab7b162f9 3d4dcc859c6ca7e5b36483ad84c9ceef34973f9a 7b5e3c1c06d82b3e7309C258dfbd4bfcd"
  },
  {
    "from": "T1049",
    "to": "CAPEC-117",
    "from_name": "System Network Connections Discovery",
    "to_name": "Interception",
    "from_layer": "technique",
    "to_layer": "capec",
    "justification": "Both entities appear in the same sentence: 'ATT&CK Tactic Category Techniques Defense Evasion    T1027: Obfuscated Files or Information Discovery    T1012: Query Registry    T1016: System Network Configuration Discovery    T1049: System Network Connections Discovery    T1057: Process Discovery    T1518: Software Discovery 7/9 Credential Access    T1003.004: LSA Secrets    T1003.006: DCSync    T1111: Two-Factor Authentication Interception Collection    T1114: Email Collection    T1114.002: Remote Email Collection Lateral Movement    T1021.004: SSH Persistence    T1037.004: RC Scripts    T1098.001: Additional Cloud Credentials    T1505.003: Web Shell Command and Control    T1071: Application Layer Protocol    T1090.003: Multi-hop Proxy    T1095: Non-Application Layer Protocol    T1572: Protocol Tunneling    T1573.002: Asymmetric Cryptography Resource Development    T1583.003: Virtual Private Server    T1584: Compromise Infrastructure    T1608.003: Install Digital Certificate Execution    T1059.001: PowerShell    T1059.003: Windows Command Shell YARA Signatures Note: These rules are designed to broadly capture suspicious files and are not designed to detect a particular malware or threat. 8/9 rule QUIETEXIT_strings {     meta:         author = \"Mandiant\"         date_created = \"2022-01-13\"         date_modified = \"2022-01-13\"         rev = 1     strings:         $s1 = \"auth-agent@openssh.com\"         $s2 = \"auth-%.8x-%d\"         $s3 = \"Child connection from %s:%s\"         $s4 = \"Compiled without normal mode, can't run without -i\"         $s5 = \"cancel-tcpip-forward\"         $s6 = \"dropbear_prng\"         $s7 = \"cron\"     condition:         uint32be(0) == 0x7F454C46 and filesize < 2MB and all of them } rule REGEORG_Tuneller_generic {     meta:         author = \"Mandiant\"         date_created = \"2021-12-20\"         date_modified = \"2021-12-20\"         md5 = \"ba22992ce835dadcd06bff4ab7b162f9\"     strings:         $s1 = \"System.Net.IPEndPoint\"         $s2 = \"Response.AddHeader\"         $s3 = \"Request.InputStream.Read\"         $s4 = \"Request.Headers.Get\"         $s5 = \"Response.Write\"         $s6 = \"System.Buffer.BlockCopy\"         $s7 = \"Response.BinaryWrite\"         $s8 = \"SocketException soex\"     condition:         filesize < 1MB and 7 of them } 9/9 rule UNC3524_sha1 {     meta:         author = \"Mandiant\"         date_created = \"2022-01-19\"         date_modified = \"2022-01-19\"    strings:         $h1 = { DD E5 D5 97 20 53 27 BF F0 A2 BA CD 96 35 9A AD 1C 75 EB 47 }     condition:         uint32be(0) == 0x7F454C46 and filesize < 10MB and all of them } Indicators MALWARE FAMILY Indicator QUIETEXIT Dynamic DNS cloudns.asia dynu.net mywire.org webredirect.org MALWARE FAMILY MD5 SHA1 SHA256 REGEORG GitHub version ba22992ce835dadcd06bff4ab7b162f9 3d4dcc859c6ca7e5b36483ad84c9ceef34973f9a 7b5e3c1c06d82b3e7309C258dfbd4bfcd' which indicates a potential connection between a technique and a capec.",
    "context": "ATT&CK Tactic Category Techniques Defense Evasion    T1027: Obfuscated Files or Information Discovery    T1012: Query Registry    T1016: System Network Configuration Discovery    T1049: System Network Connections Discovery    T1057: Process Discovery    T1518: Software Discovery 7/9 Credential Access    T1003.004: LSA Secrets    T1003.006: DCSync    T1111: Two-Factor Authentication Interception Collection    T1114: Email Collection    T1114.002: Remote Email Collection Lateral Movement    T1021.004: SSH Persistence    T1037.004: RC Scripts    T1098.001: Additional Cloud Credentials    T1505.003: Web Shell Command and Control    T1071: Application Layer Protocol    T1090.003: Multi-hop Proxy    T1095: Non-Application Layer Protocol    T1572: Protocol Tunneling    T1573.002: Asymmetric Cryptography Resource Development    T1583.003: Virtual Private Server    T1584: Compromise Infrastructure    T1608.003: Install Digital Certificate Execution    T1059.001: PowerShell    T1059.003: Windows Command Shell YARA Signatures Note: These rules are designed to broadly capture suspicious files and are not designed to detect a particular malware or threat. 8/9 rule QUIETEXIT_strings {     meta:         author = \"Mandiant\"         date_created = \"2022-01-13\"         date_modified = \"2022-01-13\"         rev = 1     strings:         $s1 = \"auth-agent@openssh.com\"         $s2 = \"auth-%.8x-%d\"         $s3 = \"Child connection from %s:%s\"         $s4 = \"Compiled without normal mode, can't run without -i\"         $s5 = \"cancel-tcpip-forward\"         $s6 = \"dropbear_prng\"         $s7 = \"cron\"     condition:         uint32be(0) == 0x7F454C46 and filesize < 2MB and all of them } rule REGEORG_Tuneller_generic {     meta:         author = \"Mandiant\"         date_created = \"2021-12-20\"         date_modified = \"2021-12-20\"         md5 = \"ba22992ce835dadcd06bff4ab7b162f9\"     strings:         $s1 = \"System.Net.IPEndPoint\"         $s2 = \"Response.AddHeader\"         $s3 = \"Request.InputStream.Read\"         $s4 = \"Request.Headers.Get\"         $s5 = \"Response.Write\"         $s6 = \"System.Buffer.BlockCopy\"         $s7 = \"Response.BinaryWrite\"         $s8 = \"SocketException soex\"     condition:         filesize < 1MB and 7 of them } 9/9 rule UNC3524_sha1 {     meta:         author = \"Mandiant\"         date_created = \"2022-01-19\"         date_modified = \"2022-01-19\"    strings:         $h1 = { DD E5 D5 97 20 53 27 BF F0 A2 BA CD 96 35 9A AD 1C 75 EB 47 }     condition:         uint32be(0) == 0x7F454C46 and filesize < 10MB and all of them } Indicators MALWARE FAMILY Indicator QUIETEXIT Dynamic DNS cloudns.asia dynu.net mywire.org webredirect.org MALWARE FAMILY MD5 SHA1 SHA256 REGEORG GitHub version ba22992ce835dadcd06bff4ab7b162f9 3d4dcc859c6ca7e5b36483ad84c9ceef34973f9a 7b5e3c1c06d82b3e7309C258dfbd4bfcd"
  },
  {
    "from": "T1584.003",
    "to": "CAPEC-117",
    "from_name": "Virtual Private Server",
    "to_name": "Interception",
    "from_layer": "technique",
    "to_layer": "capec",
    "justification": "Both entities appear in the same sentence: 'ATT&CK Tactic Category Techniques Defense Evasion    T1027: Obfuscated Files or Information Discovery    T1012: Query Registry    T1016: System Network Configuration Discovery    T1049: System Network Connections Discovery    T1057: Process Discovery    T1518: Software Discovery 7/9 Credential Access    T1003.004: LSA Secrets    T1003.006: DCSync    T1111: Two-Factor Authentication Interception Collection    T1114: Email Collection    T1114.002: Remote Email Collection Lateral Movement    T1021.004: SSH Persistence    T1037.004: RC Scripts    T1098.001: Additional Cloud Credentials    T1505.003: Web Shell Command and Control    T1071: Application Layer Protocol    T1090.003: Multi-hop Proxy    T1095: Non-Application Layer Protocol    T1572: Protocol Tunneling    T1573.002: Asymmetric Cryptography Resource Development    T1583.003: Virtual Private Server    T1584: Compromise Infrastructure    T1608.003: Install Digital Certificate Execution    T1059.001: PowerShell    T1059.003: Windows Command Shell YARA Signatures Note: These rules are designed to broadly capture suspicious files and are not designed to detect a particular malware or threat. 8/9 rule QUIETEXIT_strings {     meta:         author = \"Mandiant\"         date_created = \"2022-01-13\"         date_modified = \"2022-01-13\"         rev = 1     strings:         $s1 = \"auth-agent@openssh.com\"         $s2 = \"auth-%.8x-%d\"         $s3 = \"Child connection from %s:%s\"         $s4 = \"Compiled without normal mode, can't run without -i\"         $s5 = \"cancel-tcpip-forward\"         $s6 = \"dropbear_prng\"         $s7 = \"cron\"     condition:         uint32be(0) == 0x7F454C46 and filesize < 2MB and all of them } rule REGEORG_Tuneller_generic {     meta:         author = \"Mandiant\"         date_created = \"2021-12-20\"         date_modified = \"2021-12-20\"         md5 = \"ba22992ce835dadcd06bff4ab7b162f9\"     strings:         $s1 = \"System.Net.IPEndPoint\"         $s2 = \"Response.AddHeader\"         $s3 = \"Request.InputStream.Read\"         $s4 = \"Request.Headers.Get\"         $s5 = \"Response.Write\"         $s6 = \"System.Buffer.BlockCopy\"         $s7 = \"Response.BinaryWrite\"         $s8 = \"SocketException soex\"     condition:         filesize < 1MB and 7 of them } 9/9 rule UNC3524_sha1 {     meta:         author = \"Mandiant\"         date_created = \"2022-01-19\"         date_modified = \"2022-01-19\"    strings:         $h1 = { DD E5 D5 97 20 53 27 BF F0 A2 BA CD 96 35 9A AD 1C 75 EB 47 }     condition:         uint32be(0) == 0x7F454C46 and filesize < 10MB and all of them } Indicators MALWARE FAMILY Indicator QUIETEXIT Dynamic DNS cloudns.asia dynu.net mywire.org webredirect.org MALWARE FAMILY MD5 SHA1 SHA256 REGEORG GitHub version ba22992ce835dadcd06bff4ab7b162f9 3d4dcc859c6ca7e5b36483ad84c9ceef34973f9a 7b5e3c1c06d82b3e7309C258dfbd4bfcd' which indicates a potential connection between a technique and a capec.",
    "context": "ATT&CK Tactic Category Techniques Defense Evasion    T1027: Obfuscated Files or Information Discovery    T1012: Query Registry    T1016: System Network Configuration Discovery    T1049: System Network Connections Discovery    T1057: Process Discovery    T1518: Software Discovery 7/9 Credential Access    T1003.004: LSA Secrets    T1003.006: DCSync    T1111: Two-Factor Authentication Interception Collection    T1114: Email Collection    T1114.002: Remote Email Collection Lateral Movement    T1021.004: SSH Persistence    T1037.004: RC Scripts    T1098.001: Additional Cloud Credentials    T1505.003: Web Shell Command and Control    T1071: Application Layer Protocol    T1090.003: Multi-hop Proxy    T1095: Non-Application Layer Protocol    T1572: Protocol Tunneling    T1573.002: Asymmetric Cryptography Resource Development    T1583.003: Virtual Private Server    T1584: Compromise Infrastructure    T1608.003: Install Digital Certificate Execution    T1059.001: PowerShell    T1059.003: Windows Command Shell YARA Signatures Note: These rules are designed to broadly capture suspicious files and are not designed to detect a particular malware or threat. 8/9 rule QUIETEXIT_strings {     meta:         author = \"Mandiant\"         date_created = \"2022-01-13\"         date_modified = \"2022-01-13\"         rev = 1     strings:         $s1 = \"auth-agent@openssh.com\"         $s2 = \"auth-%.8x-%d\"         $s3 = \"Child connection from %s:%s\"         $s4 = \"Compiled without normal mode, can't run without -i\"         $s5 = \"cancel-tcpip-forward\"         $s6 = \"dropbear_prng\"         $s7 = \"cron\"     condition:         uint32be(0) == 0x7F454C46 and filesize < 2MB and all of them } rule REGEORG_Tuneller_generic {     meta:         author = \"Mandiant\"         date_created = \"2021-12-20\"         date_modified = \"2021-12-20\"         md5 = \"ba22992ce835dadcd06bff4ab7b162f9\"     strings:         $s1 = \"System.Net.IPEndPoint\"         $s2 = \"Response.AddHeader\"         $s3 = \"Request.InputStream.Read\"         $s4 = \"Request.Headers.Get\"         $s5 = \"Response.Write\"         $s6 = \"System.Buffer.BlockCopy\"         $s7 = \"Response.BinaryWrite\"         $s8 = \"SocketException soex\"     condition:         filesize < 1MB and 7 of them } 9/9 rule UNC3524_sha1 {     meta:         author = \"Mandiant\"         date_created = \"2022-01-19\"         date_modified = \"2022-01-19\"    strings:         $h1 = { DD E5 D5 97 20 53 27 BF F0 A2 BA CD 96 35 9A AD 1C 75 EB 47 }     condition:         uint32be(0) == 0x7F454C46 and filesize < 10MB and all of them } Indicators MALWARE FAMILY Indicator QUIETEXIT Dynamic DNS cloudns.asia dynu.net mywire.org webredirect.org MALWARE FAMILY MD5 SHA1 SHA256 REGEORG GitHub version ba22992ce835dadcd06bff4ab7b162f9 3d4dcc859c6ca7e5b36483ad84c9ceef34973f9a 7b5e3c1c06d82b3e7309C258dfbd4bfcd"
  },
  {
    "from": "T1583.003",
    "to": "CAPEC-117",
    "from_name": "Virtual Private Server",
    "to_name": "Interception",
    "from_layer": "technique",
    "to_layer": "capec",
    "justification": "Both entities appear in the same sentence: 'ATT&CK Tactic Category Techniques Defense Evasion    T1027: Obfuscated Files or Information Discovery    T1012: Query Registry    T1016: System Network Configuration Discovery    T1049: System Network Connections Discovery    T1057: Process Discovery    T1518: Software Discovery 7/9 Credential Access    T1003.004: LSA Secrets    T1003.006: DCSync    T1111: Two-Factor Authentication Interception Collection    T1114: Email Collection    T1114.002: Remote Email Collection Lateral Movement    T1021.004: SSH Persistence    T1037.004: RC Scripts    T1098.001: Additional Cloud Credentials    T1505.003: Web Shell Command and Control    T1071: Application Layer Protocol    T1090.003: Multi-hop Proxy    T1095: Non-Application Layer Protocol    T1572: Protocol Tunneling    T1573.002: Asymmetric Cryptography Resource Development    T1583.003: Virtual Private Server    T1584: Compromise Infrastructure    T1608.003: Install Digital Certificate Execution    T1059.001: PowerShell    T1059.003: Windows Command Shell YARA Signatures Note: These rules are designed to broadly capture suspicious files and are not designed to detect a particular malware or threat. 8/9 rule QUIETEXIT_strings {     meta:         author = \"Mandiant\"         date_created = \"2022-01-13\"         date_modified = \"2022-01-13\"         rev = 1     strings:         $s1 = \"auth-agent@openssh.com\"         $s2 = \"auth-%.8x-%d\"         $s3 = \"Child connection from %s:%s\"         $s4 = \"Compiled without normal mode, can't run without -i\"         $s5 = \"cancel-tcpip-forward\"         $s6 = \"dropbear_prng\"         $s7 = \"cron\"     condition:         uint32be(0) == 0x7F454C46 and filesize < 2MB and all of them } rule REGEORG_Tuneller_generic {     meta:         author = \"Mandiant\"         date_created = \"2021-12-20\"         date_modified = \"2021-12-20\"         md5 = \"ba22992ce835dadcd06bff4ab7b162f9\"     strings:         $s1 = \"System.Net.IPEndPoint\"         $s2 = \"Response.AddHeader\"         $s3 = \"Request.InputStream.Read\"         $s4 = \"Request.Headers.Get\"         $s5 = \"Response.Write\"         $s6 = \"System.Buffer.BlockCopy\"         $s7 = \"Response.BinaryWrite\"         $s8 = \"SocketException soex\"     condition:         filesize < 1MB and 7 of them } 9/9 rule UNC3524_sha1 {     meta:         author = \"Mandiant\"         date_created = \"2022-01-19\"         date_modified = \"2022-01-19\"    strings:         $h1 = { DD E5 D5 97 20 53 27 BF F0 A2 BA CD 96 35 9A AD 1C 75 EB 47 }     condition:         uint32be(0) == 0x7F454C46 and filesize < 10MB and all of them } Indicators MALWARE FAMILY Indicator QUIETEXIT Dynamic DNS cloudns.asia dynu.net mywire.org webredirect.org MALWARE FAMILY MD5 SHA1 SHA256 REGEORG GitHub version ba22992ce835dadcd06bff4ab7b162f9 3d4dcc859c6ca7e5b36483ad84c9ceef34973f9a 7b5e3c1c06d82b3e7309C258dfbd4bfcd' which indicates a potential connection between a technique and a capec.",
    "context": "ATT&CK Tactic Category Techniques Defense Evasion    T1027: Obfuscated Files or Information Discovery    T1012: Query Registry    T1016: System Network Configuration Discovery    T1049: System Network Connections Discovery    T1057: Process Discovery    T1518: Software Discovery 7/9 Credential Access    T1003.004: LSA Secrets    T1003.006: DCSync    T1111: Two-Factor Authentication Interception Collection    T1114: Email Collection    T1114.002: Remote Email Collection Lateral Movement    T1021.004: SSH Persistence    T1037.004: RC Scripts    T1098.001: Additional Cloud Credentials    T1505.003: Web Shell Command and Control    T1071: Application Layer Protocol    T1090.003: Multi-hop Proxy    T1095: Non-Application Layer Protocol    T1572: Protocol Tunneling    T1573.002: Asymmetric Cryptography Resource Development    T1583.003: Virtual Private Server    T1584: Compromise Infrastructure    T1608.003: Install Digital Certificate Execution    T1059.001: PowerShell    T1059.003: Windows Command Shell YARA Signatures Note: These rules are designed to broadly capture suspicious files and are not designed to detect a particular malware or threat. 8/9 rule QUIETEXIT_strings {     meta:         author = \"Mandiant\"         date_created = \"2022-01-13\"         date_modified = \"2022-01-13\"         rev = 1     strings:         $s1 = \"auth-agent@openssh.com\"         $s2 = \"auth-%.8x-%d\"         $s3 = \"Child connection from %s:%s\"         $s4 = \"Compiled without normal mode, can't run without -i\"         $s5 = \"cancel-tcpip-forward\"         $s6 = \"dropbear_prng\"         $s7 = \"cron\"     condition:         uint32be(0) == 0x7F454C46 and filesize < 2MB and all of them } rule REGEORG_Tuneller_generic {     meta:         author = \"Mandiant\"         date_created = \"2021-12-20\"         date_modified = \"2021-12-20\"         md5 = \"ba22992ce835dadcd06bff4ab7b162f9\"     strings:         $s1 = \"System.Net.IPEndPoint\"         $s2 = \"Response.AddHeader\"         $s3 = \"Request.InputStream.Read\"         $s4 = \"Request.Headers.Get\"         $s5 = \"Response.Write\"         $s6 = \"System.Buffer.BlockCopy\"         $s7 = \"Response.BinaryWrite\"         $s8 = \"SocketException soex\"     condition:         filesize < 1MB and 7 of them } 9/9 rule UNC3524_sha1 {     meta:         author = \"Mandiant\"         date_created = \"2022-01-19\"         date_modified = \"2022-01-19\"    strings:         $h1 = { DD E5 D5 97 20 53 27 BF F0 A2 BA CD 96 35 9A AD 1C 75 EB 47 }     condition:         uint32be(0) == 0x7F454C46 and filesize < 10MB and all of them } Indicators MALWARE FAMILY Indicator QUIETEXIT Dynamic DNS cloudns.asia dynu.net mywire.org webredirect.org MALWARE FAMILY MD5 SHA1 SHA256 REGEORG GitHub version ba22992ce835dadcd06bff4ab7b162f9 3d4dcc859c6ca7e5b36483ad84c9ceef34973f9a 7b5e3c1c06d82b3e7309C258dfbd4bfcd"
  },
  {
    "from": "T1059.003",
    "to": "CAPEC-117",
    "from_name": "Windows Command Shell",
    "to_name": "Interception",
    "from_layer": "technique",
    "to_layer": "capec",
    "justification": "Both entities appear in the same sentence: 'ATT&CK Tactic Category Techniques Defense Evasion    T1027: Obfuscated Files or Information Discovery    T1012: Query Registry    T1016: System Network Configuration Discovery    T1049: System Network Connections Discovery    T1057: Process Discovery    T1518: Software Discovery 7/9 Credential Access    T1003.004: LSA Secrets    T1003.006: DCSync    T1111: Two-Factor Authentication Interception Collection    T1114: Email Collection    T1114.002: Remote Email Collection Lateral Movement    T1021.004: SSH Persistence    T1037.004: RC Scripts    T1098.001: Additional Cloud Credentials    T1505.003: Web Shell Command and Control    T1071: Application Layer Protocol    T1090.003: Multi-hop Proxy    T1095: Non-Application Layer Protocol    T1572: Protocol Tunneling    T1573.002: Asymmetric Cryptography Resource Development    T1583.003: Virtual Private Server    T1584: Compromise Infrastructure    T1608.003: Install Digital Certificate Execution    T1059.001: PowerShell    T1059.003: Windows Command Shell YARA Signatures Note: These rules are designed to broadly capture suspicious files and are not designed to detect a particular malware or threat. 8/9 rule QUIETEXIT_strings {     meta:         author = \"Mandiant\"         date_created = \"2022-01-13\"         date_modified = \"2022-01-13\"         rev = 1     strings:         $s1 = \"auth-agent@openssh.com\"         $s2 = \"auth-%.8x-%d\"         $s3 = \"Child connection from %s:%s\"         $s4 = \"Compiled without normal mode, can't run without -i\"         $s5 = \"cancel-tcpip-forward\"         $s6 = \"dropbear_prng\"         $s7 = \"cron\"     condition:         uint32be(0) == 0x7F454C46 and filesize < 2MB and all of them } rule REGEORG_Tuneller_generic {     meta:         author = \"Mandiant\"         date_created = \"2021-12-20\"         date_modified = \"2021-12-20\"         md5 = \"ba22992ce835dadcd06bff4ab7b162f9\"     strings:         $s1 = \"System.Net.IPEndPoint\"         $s2 = \"Response.AddHeader\"         $s3 = \"Request.InputStream.Read\"         $s4 = \"Request.Headers.Get\"         $s5 = \"Response.Write\"         $s6 = \"System.Buffer.BlockCopy\"         $s7 = \"Response.BinaryWrite\"         $s8 = \"SocketException soex\"     condition:         filesize < 1MB and 7 of them } 9/9 rule UNC3524_sha1 {     meta:         author = \"Mandiant\"         date_created = \"2022-01-19\"         date_modified = \"2022-01-19\"    strings:         $h1 = { DD E5 D5 97 20 53 27 BF F0 A2 BA CD 96 35 9A AD 1C 75 EB 47 }     condition:         uint32be(0) == 0x7F454C46 and filesize < 10MB and all of them } Indicators MALWARE FAMILY Indicator QUIETEXIT Dynamic DNS cloudns.asia dynu.net mywire.org webredirect.org MALWARE FAMILY MD5 SHA1 SHA256 REGEORG GitHub version ba22992ce835dadcd06bff4ab7b162f9 3d4dcc859c6ca7e5b36483ad84c9ceef34973f9a 7b5e3c1c06d82b3e7309C258dfbd4bfcd' which indicates a potential connection between a technique and a capec.",
    "context": "ATT&CK Tactic Category Techniques Defense Evasion    T1027: Obfuscated Files or Information Discovery    T1012: Query Registry    T1016: System Network Configuration Discovery    T1049: System Network Connections Discovery    T1057: Process Discovery    T1518: Software Discovery 7/9 Credential Access    T1003.004: LSA Secrets    T1003.006: DCSync    T1111: Two-Factor Authentication Interception Collection    T1114: Email Collection    T1114.002: Remote Email Collection Lateral Movement    T1021.004: SSH Persistence    T1037.004: RC Scripts    T1098.001: Additional Cloud Credentials    T1505.003: Web Shell Command and Control    T1071: Application Layer Protocol    T1090.003: Multi-hop Proxy    T1095: Non-Application Layer Protocol    T1572: Protocol Tunneling    T1573.002: Asymmetric Cryptography Resource Development    T1583.003: Virtual Private Server    T1584: Compromise Infrastructure    T1608.003: Install Digital Certificate Execution    T1059.001: PowerShell    T1059.003: Windows Command Shell YARA Signatures Note: These rules are designed to broadly capture suspicious files and are not designed to detect a particular malware or threat. 8/9 rule QUIETEXIT_strings {     meta:         author = \"Mandiant\"         date_created = \"2022-01-13\"         date_modified = \"2022-01-13\"         rev = 1     strings:         $s1 = \"auth-agent@openssh.com\"         $s2 = \"auth-%.8x-%d\"         $s3 = \"Child connection from %s:%s\"         $s4 = \"Compiled without normal mode, can't run without -i\"         $s5 = \"cancel-tcpip-forward\"         $s6 = \"dropbear_prng\"         $s7 = \"cron\"     condition:         uint32be(0) == 0x7F454C46 and filesize < 2MB and all of them } rule REGEORG_Tuneller_generic {     meta:         author = \"Mandiant\"         date_created = \"2021-12-20\"         date_modified = \"2021-12-20\"         md5 = \"ba22992ce835dadcd06bff4ab7b162f9\"     strings:         $s1 = \"System.Net.IPEndPoint\"         $s2 = \"Response.AddHeader\"         $s3 = \"Request.InputStream.Read\"         $s4 = \"Request.Headers.Get\"         $s5 = \"Response.Write\"         $s6 = \"System.Buffer.BlockCopy\"         $s7 = \"Response.BinaryWrite\"         $s8 = \"SocketException soex\"     condition:         filesize < 1MB and 7 of them } 9/9 rule UNC3524_sha1 {     meta:         author = \"Mandiant\"         date_created = \"2022-01-19\"         date_modified = \"2022-01-19\"    strings:         $h1 = { DD E5 D5 97 20 53 27 BF F0 A2 BA CD 96 35 9A AD 1C 75 EB 47 }     condition:         uint32be(0) == 0x7F454C46 and filesize < 10MB and all of them } Indicators MALWARE FAMILY Indicator QUIETEXIT Dynamic DNS cloudns.asia dynu.net mywire.org webredirect.org MALWARE FAMILY MD5 SHA1 SHA256 REGEORG GitHub version ba22992ce835dadcd06bff4ab7b162f9 3d4dcc859c6ca7e5b36483ad84c9ceef34973f9a 7b5e3c1c06d82b3e7309C258dfbd4bfcd"
  }
]